Keyword,Source,Author,Title,URL,Text,Published
migrant,Breitbart News,Chris Tomlinson,Iraqi Convicted of Beheading Swedish Teen Pleads Innocence at Appeal,https://www.breitbart.com/europe/2020/10/10/iraqi-convicted-of-beheading-swedish-teen-pleads-innocence-at-appeal/,"Iraqi migrant Tishko S. has maintained his innocence during an appeal after he was convicted in July of murdering Swedish teen Wilma Andersson and dismembering her body.
The appeal against the convi… [+2312 chars]",2020-10-10T10:18:46Z
migrant,Breitbart News,Chris Tomlinson,Austrian Chancellor Speaks Out Against EU Migrant Redistribution Policy,https://www.breitbart.com/europe/2020/09/25/austrian-chancellor-speaks-out-against-eu-migrant-redistribution-policy/,"Austrian Chancellor Sebastian Kurz has rejected migrant redistribution as a failed policy, saying that the EU’s latest plans will not work.
The Austrian Chancellor made his comments as the European … [+2474 chars]",2020-09-25T10:59:08Z
migrant,Breitbart News,Jack Montgomery,EU Reveals 'Mandatory Solidarity Mechanism' to Spread Migrants Across All States,https://www.breitbart.com/europe/2020/09/24/eu-plots-mandatory-solidarity-mechanism-spread-migrants/,"The European Union’s unelected executive-cum-legislature, the European Commission, has put forward a “Mandatory Solidarity Mechanism” to spread the burden of the migrant crisis across all member-stat… [+4041 chars]",2020-09-24T07:58:53Z
migrant,Breitbart News,Breitbart London,Prosecutor Files Terrorism Charges Over New Charlie Hebdo Stabbings,https://www.breitbart.com/europe/2020/09/30/prosecutor-files-terrorism-charges-over-new-charlie-hebdo-stabbings/,"PARIS (AP) – A Pakistani man accused in a double stabbing outside the former Paris offices of satirical newspaper Charlie Hebdo has been handed preliminary terrorism charges.
The suspect told invest… [+1455 chars]",2020-09-30T10:22:00Z
migrant,Breitbart News,Jack Montgomery,First of Up to 431 Channel Migrants Arrive at New Open Camp in England,https://www.breitbart.com/europe/2020/09/23/first-of-up-431-channel-migrants-arrive-new-open-camp-england/,"The first of up to 431 illegal migrants are arriving at a new open camp based at a disused Army barracks in Folkestone, Kent.
The asylum seekers are “understood to be migrants who crossed the Channe… [+3979 chars]",2020-09-23T12:30:50Z
migrant,Breitbart News,Chris Tomlinson,Gothenburg Police Concerned Over Growing Drug Trade Ethnic Gang Violence,https://www.breitbart.com/europe/2020/09/30/gothenburg-police-concerned-over-growing-drug-trade-ethnic-gang-violence/,"An intelligence report from the Gothenburg police has revealed deep concern over growing violence between ethnic gangs in the city as they battle over the city’s illegal drug trade.
The report claim… [+3203 chars]",2020-09-30T09:43:30Z
migrant,Breitbart News,Virginia Hale,UK Government Importing Asylum Seekers Directly from Greece Under ‘Family Reunification’,https://www.breitbart.com/europe/2020/10/05/uk-government-importing-asylum-seekers/,"The British government has revealed it is flying in asylum seekers directly from Greece, while record numbers of illegal immigrants continue to arrive on UK shores in boats.
On Friday, the governmen… [+3422 chars]",2020-10-05T12:21:03Z
migrant,Breitbart News,Breitbart London,It CAN Be Done: Tunisia Stops and Turns Backs Hundreds of Boat Migrants at Sea,https://www.breitbart.com/europe/2020/09/23/it-can-be-done-tunisia-stops-turns-backs-hundreds-boat-migrants/,(AFP) — Tunisia said Monday that naval patrols had intercepted 19 boats carrying a total of 246 people seeking to cross from the North African nation to Europe overnight Saturday to Sunday alone. The… [+1496 chars],2020-09-23T11:33:40Z
migrant,Breitbart News,Chris Tomlinson,Italy: Majority of Migrants Rejected for Asylum But Stay in Country Anyway,https://www.breitbart.com/europe/2020/09/29/italy-majority-of-migrants-rejected-for-asylum-but-stay-in-country-anyway/,"Italian asylum case figures show an overwhelming majority of migrants coming into the country are not approved for asylum but nearly none of the rejected asylum seekers are actually deported.
Data f… [+2874 chars]",2020-09-29T11:44:00Z
migrant,Breitbart News,Chris Tomlinson,Migrant Crisis Balkan Route Nations Have Least Favourable Opinions Towards Migrants,https://www.breitbart.com/europe/2020/09/26/migrant-crisis-balkan-route-nations-have-least-favourable-opinions-towards-migrants/,Polling firm Gallup has revealed that residents from many of the countries that formed the Balkan route of the 2015 European migrant crisis have some of the most negative views of migrants in the wor… [+3301 chars],2020-09-26T10:18:08Z
migrant,Breitbart News,Virginia Hale,. UN Insists Record Boat Migrant Numbers 'Not a Threat' to Britain,https://www.breitbart.com/europe/2020/10/01/un-boat-migrants-threat-britain/,"Record numbers of illegal immigrants crossing the English Channel are not a threat to Britain, and could even be a boon for taxpayers, the United Nations (UN) has claimed.
Speaking to the Commons Ho… [+4550 chars]",2020-10-01T09:20:20Z
migrant,Breitbart News,Chris Tomlinson,Mayor Says Parents Fear for Children After Migrant Centre Becomes Crime Hotspot,https://www.breitbart.com/europe/2020/10/10/german-mayor-raises-alarm-asylum-seeker-home-becoming-crime-hotspot/,"The mayor of a German city has said locals are afraid to let their children out alone because of growing criminality at an asylum seeker centre housing hundreds of migrants.
André Knapp, the mayor o… [+2254 chars]",2020-10-10T09:12:27Z
migrant,Breitbart News,Chris Tomlinson,Swedish Police Hunt for Danes Who Burned Qur’an in No-Go Zone,https://www.breitbart.com/europe/2020/09/12/swedish-police-hunt-danes-who-burned-quran-no-go-area/,"Swedish police are hunting for members of an anti-Islam group from Denmark who are alleged to have burned a copy of the Qur’an in Stockholm’s no-go Rinkeby suburb.
Swedish police say they are search… [+2216 chars]",2020-09-12T09:51:37Z
migrant,Breitbart News,John Binder,Amy Schumer Posts Staged Photo of Mannequins in Cages in Get Out the Vote Screed Against America’s ‘Caste System’,https://www.breitbart.com/entertainment/2020/10/09/amy-schumer-posts-staged-photo-of-mannequins-in-cages-in-get-out-the-vote-screed-against-americas-caste-system/,Actress and leftist activist Amy Schumer posted a staged photo of mannequin dolls in cages in a social media rant urging people to vote against America’s “caste system.” Schumer’s screed to her 10 mi… [+2042 chars],2020-10-09T16:35:04Z
migrant,Breitbart News,Victoria Friedman,Deportation Flight Had One Passenger After 29 Lodged Legal Challenges,https://www.breitbart.com/europe/2020/10/03/deportation-flight-had-one-passenger-29-lodged-legal-challenges/,"The UK deported just one out of 30 failed asylum seekers scheduled on a flight to France after the rest had lodged legal challenges to their removal.
One Sudanese man was returned to Paris under cur… [+3664 chars]",2020-10-03T07:47:46Z
migrant,Breitbart News,Chris Tomlinson,Hungarian Police Discover 16 Tunnels Used by Migrants to Cross Border,https://www.breitbart.com/europe/2020/09/27/hungarian-police-discover-16-tunnels-used-migrants-cross-border/,"Hungarian police say they have discovered at least 16 tunnels used by people traffickers to smuggle migrants across the border from neighbouring Serbia.
The small tunnels, which are around a hundred… [+1825 chars]",2020-09-27T09:47:19Z
migrant,Breitbart News,Jack Montgomery,Report: Law Firm Which Stops Deportations Got 55m in Taxpayer Legal Aid,https://www.breitbart.com/europe/2020/10/06/report-law-firm-which-stops-deportations-got-55m-taxpayer-legal-aid/,"A law firm which has helped to block a number of deportations has received tens of millions in taxpayer-funded legal aid over the last three years, according to reports.
Amarpal Singh Gupta’s firm, … [+3583 chars]",2020-10-06T11:42:32Z
migrant,Breitbart News,David Ng,"Ng: HBO’s Quarantine Comedy ‘Coastal Elites,’ Starring Bette Midler, Is an Angry Anti-Trump Rage Fest",https://www.breitbart.com/entertainment/2020/09/13/ng-hbos-quarantine-comedy-coastal-elites-starring-bette-midler-is-an-angry-anti-trump-rage-fest/,"HBO’s Coastal Elites is what happens when Hollywood turns its collective Trump Derangement Syndrome into a movie, a boring movie. Equally earnest and angry, the project is a five-alarm Trump meltdown… [+2745 chars]",2020-09-13T16:57:53Z
migrant,Breitbart News,Victoria Friedman,Deported Criminal Migrants Who Break Back into Britain Using Human Rights Laws to Fight Removals: Report,https://www.breitbart.com/europe/2020/10/04/criminal-migrants-using-human-rights-eu-family-rights-laws-fight-deportations/,"The Times has revealed several cases in the past year of deported criminal migrants returning to the UK and using EU and human rights laws to fight their removals.
In the report published on Sunday,… [+2936 chars]",2020-10-04T15:53:50Z
migrant,Breitbart News,Breitbart London,Italians Able to Head to Polls in Seven Regional Elections Despite Coronavirus,https://www.breitbart.com/europe/2020/09/20/italians-able-to-head-to-polls-in-seven-regional-elections-despite-coronavirus/,Voters were required to wear masks and maintain social distancing as they cast ballots in regional contests originally scheduled for the spring but delayed due to the pandemic. Italy’s outbreak has c… [+3140 chars],2020-09-20T09:35:55Z
migrant,Breitbart News,Neil Munro,Reports: CDC Health Officials Resisted Disease Closure of U.S.-Mexican Border,https://www.breitbart.com/health/2020/10/04/reports-cdc-health-officials-resisted-closure-mexican-border/,"Vice President Mike Pence and other White House officials had to order uncooperative federal healthcare managers to shut the U.S.-Mexican border during the coronavirus crisis, according to reports.
… [+3681 chars]",2020-10-04T21:32:14Z
migrant,Breitbart News,Kyle Olson,"Colorado Secretary of State Encourages Non-Citizens, Deceased to Register to Vote",https://www.breitbart.com/politics/2020/09/27/colorado-secretary-state-encourages-non-citizens-deceased-register-vote/,"Democrat Colorado Secretary of State Jena Griswold sent a postcard to non-citizens and the dead encouraging them to register to vote so they can cast ballots in November.
Griswold sent a mailer to s… [+2575 chars]",2020-09-27T20:33:16Z
migrant,Breitbart News,Jack Montgomery,Burger King Depicts Mascot in Gay Kiss with Ronald McDonald for New Ad Campaign,https://www.breitbart.com/europe/2020/09/11/urger-king-depicts-mascot-gay-kiss-with-ronald-mcdonald-new-ad-campaign/,"Burger King has launched a new advertising campaign in Finland featuring its eponymous mascot sharing a deep kiss with Ronald McDonald, along with the English slogan ‘Love Conquers All’.
The image i… [+2662 chars]",2020-09-11T09:28:39Z
migrant,Breitbart News,Chris Tomlinson,Populist Salvini Candidate on Course to Get Largest Governor Vote in Italian History,https://www.breitbart.com/europe/2020/09/22/populist-salvini-candidate-course-get-largest-governor-vote-italian-history/,"Luca Zaia, a member of Matteo Salvini’s League, is on course to win at least 74 per cent in the Veneto regional presidential election — the Italian equivalent of a U.S. state governor — exit polls in… [+3704 chars]",2020-09-22T08:36:56Z
migrant,Breitbart News,Chris Tomlinson,Leftist Italian Govt Set to Dismantle Salvini Anti-Mass Migration Decrees,https://www.breitbart.com/europe/2020/09/26/leftist-italian-govt-set-to-dismantle-salvini-anti-mass-migration-decrees/,Italian Interior Minister Luciana Lamorgese has sent a draft letter to Italian Prime Minister Giuseppe Conte which could dismantle the anti-mass migration decrees enacted by populist Senator Matteo S… [+2021 chars],2020-09-26T13:41:44Z
migrant,Breitbart News,Chris Tomlinson,Muslim Imam Arrested in Huge Child Pornography Bust,https://www.breitbart.com/europe/2020/10/10/muslim-imam-arrested-in-huge-child-pornography-bust/,"A 50-year-old imam is one of 65 men who have been placed into custody after French police conducted a large-scale operation in multiple cities aimed at tackling child pornography.
The imam is said t… [+1970 chars]",2020-10-10T09:35:01Z
migrant,Breitbart News,Chris Tomlinson,French Butcher Attacked With Tear Gas By Children For Selling Pork,https://www.breitbart.com/europe/2020/10/01/french-butcher-attacked-with-tear-gas-by-children-for-selling-pork/,"Children as young as twelve years old attacked a butcher in the French city of Lyon, allegedly over the shop selling pork products.
The attacks took place on September 19th at the butcher shop locat… [+1951 chars]",2020-10-01T08:59:44Z
migrant,Breitbart News,Chris Tomlinson,"Quarantined Migrants Grow Angry, Set Fires in Italian Hotel",https://www.breitbart.com/europe/2020/09/25/migrants-angered-quarantine-set-fires-italian-hotel/,"Migrants housed in a Sicilian hotel set fires in the accommodation to protest against anti-coronavirus measures.
The Villa Sant’Andrea hotel, located in the town of Valderice, has been used to quara… [+2031 chars]",2020-09-25T09:36:03Z
migrant,Breitbart News,Neil Munro,Axios: New York City Shrinks Due to Lower Immigration,https://www.breitbart.com/politics/2020/09/18/axios-new-york-city-shrinks-due-to-lower-immigration/,"President Donald Trump’s pro-American curbs on migration are pressuring New York’s parochial elite to accept out-of-state young Americans into the city’s economy.
“The main driver of both new busine… [+8321 chars]",2020-09-18T23:05:13Z
migrant,Breitbart News,Neil Munro,White House Posts H-1B Visa Reforms to Help American Graduates Get Good Jobs,https://www.breitbart.com/immigration/2020/10/06/white-house-posts-h-1b-visa-reforms-to-help-american-graduates-get-good-jobs/,The administration has announced reforms of the H-1B visa-worker program to help American graduates get many of the U.S. jobs that Fortune 500 CEOs are now giving to compliant and cheap foreign gradu… [+10890 chars],2020-10-06T18:01:17Z
migrant,Breitbart News,Jack Montgomery,Judges Ground Another Entire Deportation Flight for Illegal Migrants,https://www.breitbart.com/europe/2020/09/19/judges-ground-another-entire-deportation-flight-illegal-migrants/,"Judges have blocked another entire deportation flight of illegal migrants, agreeing with lawyers that the first world EU member-state Spain could not be trusted to treat them as lavishly as Britain.… [+3268 chars]",2020-09-19T20:38:40Z
migrant,Breitbart News,Neil Munro,"Amnesty Groups Demand Bailout for Cities, States that Rely on Illegal Migrants",https://www.breitbart.com/politics/2020/09/16/amnesty-groups-demand-bailout-for-cities-states-that-rely-on-illegal-migrants/,"The unemployment rate for illegal migrants in the United States reached almost 30 percent during the coronavirus crash, says a California advocacy report that urges a federal bailout for the cities a… [+5639 chars]",2020-09-17T00:40:20Z
migrant,Breitbart News,Neil Munro,Agriculture Deptartment Drops Wage Floor in H-2A Farmworker Program,https://www.breitbart.com/economy/2020/10/01/agriculture-dept-drops-wage-floor-h2a-program/,"Agriculture department officials have announced they will not conduct a routine annual survey on wages in the farm sector, likely helping agriculture employers to suppress wages for the expected supp… [+5197 chars]",2020-10-02T02:22:16Z
migrant,Breitbart News,Joel B. Pollak,Blue State Blues: Joe Biden Is Already Irritating — and Worrying — U.S. Allies,https://www.breitbart.com/politics/2020/09/18/blue-state-blues-joe-biden-is-already-irritating-and-worrying-u-s-allies/,"Joe Biden is promising to restore “historic partnerships” with America’s allies, but he is already irritating them.
On Friday, British Prime Minister Boris Johnson suggested that Biden does not unde… [+5458 chars]",2020-09-18T16:55:04Z
migrant,Breitbart News,Joel B. Pollak,Pollak: The NYT’s Latest ‘Whistleblower’ Looks Like Another Adam Schiff Hit Job,https://www.breitbart.com/2020-election/2020/09/10/pollak-the-nyts-latest-whistleblower-looks-like-another-adam-schiff-hit-job/,The New York Times reported Wednesday that a “whistleblower” at the Department of Homeland Security had alleged that officials “directed agency analysts to downplay the threat of violent white suprem… [+5430 chars],2020-09-10T12:55:44Z
migrant,Breitbart News,Victoria Friedman,"MSM Catches up to Farage, Finally Reports Alleged Refugees Evading Authorities",https://www.breitbart.com/europe/2020/09/14/msm-catches-up-farage-finally-reports-alleged-refugees-evading-authorities/,"Five months after Nigel Farage first reported that the true number of illegal aliens was likely much higher than the official figure because many arrive undetected, the mainstream media has finally r… [+4631 chars]",2020-09-14T17:42:30Z
migrant,Breitbart News,Victoria Friedman,"UK Considering Floating Asylum Centres in Old Ferries, Sending Migrants to Remote Islands: Reports",https://www.breitbart.com/europe/2020/10/02/uk-considering-floating-asylum-centres-in-old-ferries-sending-migrants-to-remote-islands-reports/,"The British government is said to be considering off-shore asylum centres on old ferries, or even sending claimants to remote islands in the South Atlantic.
The government is reportedly considering … [+4499 chars]",2020-10-02T09:59:28Z
migrant,Breitbart News,Victoria Friedman,Paris Stabbing Suspect Admits He Was Trying to Target Charlie Hebdo: Report,https://www.breitbart.com/europe/2020/09/26/suspect-admits-paris-stabbing-attack-was-trying-target-charlie-hebdo/,The 18-year-old Pakistani currently being held by French police for attacking two people with a meat cleaver has reportedly admitted that he had wanted to target those working at Charlie Hebdo in rev… [+2244 chars],2020-09-26T16:34:50Z
migrant,Breitbart News,Chris Tomlinson,Italian Authorites Open After Being Rammed by Suspected Smuggler Boat,https://www.breitbart.com/europe/2020/10/01/italian-authorites-open-fire-near-tunisan-fishing-ship-being-rammed/,"The Italian Guardia di Finanza fired across the bows of a Tunisian fishing vessel suspected of aiding illegal migration after the boat rammed one of the Italian ships.
The dramatic incident, which t… [+2104 chars]",2020-10-01T11:10:10Z
migrant,Breitbart News,Chris Tomlinson,NGO Claims Around Half of Migrants on Paris Streets May Be Coronavirus Positive,https://www.breitbart.com/europe/2020/10/07/ngo-claims-around-half-of-migrants-on-paris-streets-may-be-coronavirus-positive/,"According to NGO Doctors without Borders (Médecins Sans Frontières/MSF), 55 per cent of those living on the streets of the Paris region might be infected with the Wuhan coronavirus, the vast majority… [+2258 chars]",2020-10-07T17:17:21Z
migrant,Breitbart News,Virginia Hale,Macron Faces Islamophobia Claims Over Homeschooling Ban 'to Protect Children From Religion',https://www.breitbart.com/europe/2020/10/06/france-macron-ban-homeschooling/,"Emmanuel Macron has been attacked for “Islamophobia” by the Turkish government in the wake of his announcement that France will ban homeschooling to protect children from religion, as part of plans t… [+5206 chars]",2020-10-06T09:21:09Z
migrant,Breitbart News,Chris Tomlinson,Italian Authorites Open After Being Rammed by Suspected Smuggler Boat,https://www.breitbart.com/europe/2020/10/01/italian-authorities-open-fire-near-tunisan-fishing-ship-being-rammed/,"The Italian Guardia di Finanza fired across the bows of a Tunisian fishing vessel suspected of aiding illegal migration after the boat rammed one of the Italian ships.
The dramatic incident, which t… [+2104 chars]",2020-10-01T11:10:10Z
migrant,Breitbart News,Chris Tomlinson,Former Swedish Broadcaster CEO: No One in Sweden Likes President Trump,https://www.breitbart.com/europe/2020/10/03/former-swedish-broadcaster-ceo-no-one-sweden-likes-president-trump/,"Eva Hamilton, the former CEO of Sweden’s public television broadcaster SVT, has claimed that no one in Sweden likes U.S. President Donald J. Trump and that Swedes view him as dangerous.
Ms Hamilton … [+2082 chars]",2020-10-03T08:10:05Z
migrant,Breitbart News,Chris Tomlinson,Greece to Recruit 800 New Border Guards After Turks Push Migrants to Frontier,https://www.breitbart.com/europe/2020/09/25/greece-recruit-least-800-new-border-guards-along-turkish-border/,Greek Minister of Civil Protection Michalis Chrysochoidis has revealed that another 400 border guards will be recruited to man the border in addition to the 400 previously announced by the government… [+2064 chars],2020-09-25T08:09:31Z
migrant,Breitbart News,Chris Tomlinson,Paris No-Go Suburb Politician Faced Trial for Apologising for Terrorism,https://www.breitbart.com/europe/2020/10/09/paris-no-go-suburb-politician-trial-apologising-terrorism/,A regional politician in the no-go Paris suburb of Seine-Saint-Denis was placed on trial for apologising for terrorism after stating that he wanted to be like radical Islamic terrorist Mohammed Merah… [+1958 chars],2020-10-09T11:28:31Z
migrant,Breitbart News,Chris Tomlinson,Swedish 2021 Budget Spends More on Foreign Aid Than Police Force,https://www.breitbart.com/europe/2020/09/24/swedish-2021-budget-spends-more-on-foreign-aid-than-police-force/,"The new Swedish 2021 budget has been revealed, with the government looking to spend more on foreign aid than on the country’s police force despite violent gang crime remaining a problem.
The budget,… [+2225 chars]",2020-09-24T08:07:09Z
migrant,Breitbart News,Chris Tomlinson,Nearly All Top Ten Baby Names in Paris Suburbs Have Islamic Connection,https://www.breitbart.com/europe/2020/09/24/nearly-all-top-ten-baby-names-paris-suburbs-have-islamic-connection/,"The majority of baby names given in the suburbs of Paris have Islamic connections, according to figures released by the French National Institute of Statistics and Economic Studies (INSEE).
The Pari… [+2258 chars]",2020-09-24T15:54:04Z
migrant,Breitbart News,Chris Tomlinson,Greek Birthrate Declined by over Three Per Cent in 2019,https://www.breitbart.com/europe/2020/10/03/greek-birthrate-declined-three-per-cent-2019/,"Statistics released by the Greek government show that the country’s birthrate declined by 3.1 per cent in 2019 as deaths increased by 3.9 per cent.
According to statistics released by the Hellenic S… [+2270 chars]",2020-10-03T11:54:13Z
migrant,Breitbart News,Rep. Matt Gaetz (R-FL),Exclusive Excerpt—Rep. Matt Gaetz: ‘Firebrand: Dispatches from the Front Lines of the MAGA Revolution’,https://www.breitbart.com/politics/2020/09/21/exclusive-excerpt-rep-matt-gaetz-firebrand-dispatches-from-the-front-lines-of-the-maga-revolution/,"The following is an exclusive excerpt from a new book by Rep. Matt Gaetz (R-FL), Firebrand: Dispatches from the Front Lines of the MAGA Revolution, available Tuesday, September 22.
***
America is n… [+7330 chars]",2020-09-21T16:12:59Z
migrant,Breitbart News,Neil Munro,Washington Post: Only ‘Bigots’ Oppose Large Refugee Inflows,https://www.breitbart.com/politics/2020/10/06/washington-post-only-bigots-oppose-large-refugee-inflows/,"President Donald Trump’s decision to accept 15,000 refugees in 2020 only helps “bigots,” says Catherine Rampell, a pro-migration columnist at the Washington Post.
“The only constituency helped by Tr… [+6473 chars]",2020-10-06T22:18:19Z
migrant,Breitbart News,Neil Munro,Business Slams Draft Curbs on White-Collar Illegal Migrants,https://www.breitbart.com/economy/2020/09/24/business-slams-draft-curbs-on-white-collar-illegal-migrants/,"Business groups, labor brokers, and migration advocates are protesting a draft regulation that would open up many thousands of outsourced white-collar jobs to debt-burdened U.S. graduates.
The regul… [+6940 chars]",2020-09-25T01:25:35Z
migrant,Bloomberg,,Singapore Introduces Night Clinics for Migrant Workers,https://www.bloomberg.com/news/articles/2020-10-09/singapore-introduces-night-clinics-for-migrant-workers,,2020-10-09T05:53:20Z
migrant,Bloomberg,,Philippines' Army of Migrant Workers Retrains for Life Back Home,https://www.bloomberg.com/news/articles/2020-09-23/philippines-army-of-migrant-workers-retrains-for-life-back-home,,2020-09-23T21:00:00Z
migrant,Bloomberg,,Singapore Scales Up Virus Screening Centers for Migrant Workers,https://www.bloomberg.com/news/articles/2020-10-08/singapore-scales-up-virus-screening-centers-for-migrant-workers,,2020-10-08T07:36:37Z
migrant,Bloomberg,Shuli Ren,China’s Economic Recovery Leaves the Bottom 60% Behind,https://www.bloomberg.com/news/articles/2020-09-28/coronavirus-pandemic-china-is-experiencing-a-k-shaped-economic-recovery,,2020-09-28T08:00:19Z
migrant,Bloomberg,Arne Delfs,"Merkel, Macron Open Doors to 400 Minors From Greek Refugee Camp",https://www.bloomberg.com/news/articles/2020-09-10/merkel-macron-open-doors-to-400-minors-from-greek-refugee-camp,,2020-09-10T17:38:03Z
migrant,Al Jazeera English,Sandra Cuffe,‘There is no work’: Hondurans brave risks in US-bound caravan,https://www.aljazeera.com/news/2020/10/3/there-is-no-work-hondurans-brave-risks-in-us-bound-caravan,"Guatemala City, Guatemala  The Guatemalan government is ramping up efforts to halt the exodus of thousands of Honduran migrants attempting to reach the United States.
More than 3,000 Honduran migran… [+5966 chars]",2020-10-03T19:13:17Z
