Keyword,Source,Author,Title,URL,Text,Published
migrant,CBS News,CBS News,Thousands spend another night in the open after fires destroy refugee camp,https://www.cbsnews.com/news/moria-camp-lesbos-greece-thousands-homeless/,"Thousands of asylum-seekers have spent a fourth night sleeping in the open on the Greek island of Lesbos, after successive fires destroyed a notoriously overcrowded migrant and refugee camp during a … [+3700 chars]",2020-09-12T14:14:49Z
migrant,CBS News,Kathryn Watson,Incumbent Trump banks on fear and anxiety to motivate voters,https://www.cbsnews.com/news/trumps-use-of-fear-and-anxiety-to-motivate-his-voters/,"President Trump's central reelection campaign theme was perhaps most simply expressed in a remark in his acceptance speech at the Republican National Convention: ""No one will be safe in Biden's Ameri… [+8681 chars]",2020-09-29T12:57:57Z
migrant,CBS News,Camilo Montoya-Galvez,Trump-Biden race to dictate fate of U.S. immigration for generations,https://www.cbsnews.com/news/trump-biden-2020-immigration-policies/,"The 2020 presidential election will pit two drastically different visions on immigration against each other, with the victor retaining or assuming broad executive authorities that have dominated poli… [+17636 chars]",2020-09-28T20:00:05Z
migrant,CBS News,Camilo Montoya-Galvez,"ICE billboards of immigrants denounced as ""wildly inappropriate""",https://www.cbsnews.com/news/ice-billboards-immigrants-pennsylvania-criticism-former-officials/,"Former U.S. Department of Homeland Security (DHS) officials criticized the Trump administration for erecting billboards of immigrants it seeks to arrest in a key 2020 battleground state, saying the p… [+8044 chars]",2020-10-05T14:00:01Z
migrant,CBS News,Caitlin Conant,2020 Daily Trail Markers: Debate prep is in full swing for Trump and Biden,https://www.cbsnews.com/news/2020-daily-trail-markers-debate-prep-is-in-full-swing-for-trump-and-biden-2020-09-28/,Debate preparation is in full swing for President Trump and Joe Biden ahead of their first debate matchup on Tuesday evening. Mr. Trump has dispensed with traditional formal rehearsals and scripted p… [+22896 chars],2020-09-29T00:16:59Z
migrant,CBS News,CBS News,"Mexico asks U.S. to ""clarify"" alleged hysterectomies on migrant women in ICE custody",https://www.cbsnews.com/news/mexico-asks-us-to-clarify-alleged-hysterectomies-on-migrant-women-in-ice-custody/,"Mexico City — Mexico said Monday it had requested more information from the U.S. on medical procedures given to migrants in detention centers, after allegations that detained Mexican women were steri… [+2968 chars]",2020-09-29T09:12:14Z
migrant,Breitbart News,"Bob Price, 
Bob Price",GRAPHIC: Female Migrant Found Dead on Texas Ranch -- 80 Miles from Border,https://www.breitbart.com/border/2020/09/16/graphic-female-migrant-found-dead-on-texas-ranch-80-miles-from-border/,"A Brooks County, Texas, sheriff’s deputy recovered the recently deceased body of a young migrant woman who died after being abandoned by smugglers. The death occurred on a ranch located south of the … [+2814 chars]",2020-09-16T21:19:31Z
migrant,Breitbart News,"Kurt Zindulka, 
Kurt Zindulka",Farage Predicts the Future! Hundreds of Illegal Boat Migrants Cross the Channel,https://www.breitbart.com/europe/2020/09/22/farage-predicts-the-future-as-hundreds-of-illegal-boat-migrants-cross-the-channel/,"Brexit Party Leader Nigel Farage was proven right in his prediction that hundreds of illegal boat migrants would make the journey across the English Channel from France on Tuesday, as massive numbers… [+2447 chars]",2020-09-22T17:23:22Z
migrant,Breitbart News,"Chris Tomlinson, 
Chris Tomlinson",Greek Police Investigation Into Suspicious Fires Near Turkish Border,https://www.breitbart.com/europe/2020/09/20/greek-police-launch-investigation-suspicious-fires-turkish-border-area/,"Greece’s police and fire service have launched an investigation after at least 15 fires broke out in just 48 hours in the Evros border area with Turkey.
The investigation comes as a massive fire rag… [+2163 chars]",2020-09-20T08:38:16Z
migrant,Breitbart News,"Chris Tomlinson, 
Chris Tomlinson","Paris Region Arrests Over 6,300 Underage Migrants in 2020",https://www.breitbart.com/europe/2020/10/01/paris-region-arrests-over-6300-underage-migrants-in-2020/,"The Paris region of Ile-de-France has seen a surge in the number of arrests of underage unaccompanied migrants, with 2020 seeing over 6,300 arrests so far this year.
According to the Paris prefectur… [+2670 chars]",2020-10-01T14:06:39Z
migrant,Breitbart News,"John Binder, 
John Binder","First Lady Melania Trump Rips the Media, Liberals in Leaked Tapes",https://www.breitbart.com/politics/2020/10/01/melania-trump-rips-media-liberals-leaked-tapes/,"First Lady Melania Trump ripped the establishment media and liberals for their treatment of her in July 2018, secretly recorded phone calls by a former friend reveal.
On Thursday evening, CNN’s Ande… [+5142 chars]",2020-10-02T03:56:25Z
migrant,Breitbart News,"Neil Munro, 
Neil Munro",Presidential Debates Ignore '2000-Lb Elephant' of Immigration,https://www.breitbart.com/politics/2020/10/09/presidential-debates-ignore-2000-lb-elephant-immigration/,"The first Presidential debate and the Vice Presidential debates avoided any mention of the hot-button, trillion-dollar immigration issue that got Donald Trump elected in 2016.
“I’m consistently surp… [+4609 chars]",2020-10-09T16:48:35Z
migrant,Breitbart News,Mike Rivero,Hungary Strikes Back Against E.U. ‘Open Borders’ Propaganda,https://www.breitbart.com/immigration/2020/09/15/hungary-strikes-back-against-e-u-open-borders-propaganda/,"ROME The Hungarian government has rejected new calls for open borders, insisting on the right of sovereign states to control their own borders.
Government spokesman Zoltan Kovacs responded sharply t… [+3933 chars]",2020-09-16T12:39:52Z
migrant,Breitbart News,Kurt Zindulka,"Second UK Military Migrant Camp Set to Open in Wales, as Migrant Crisis Grows",https://www.breitbart.com/europe/2020/09/17/second-uk-military-migrant-camp-set-up-wales-migrant-crisis-grows/,"The British government is “actively” considering opening a second migrant camp to house some 250 alleged asylum seekers in Wales, as the illegal boat migration crisis in the UK deepens.
Following th… [+3375 chars]",2020-09-17T15:29:18Z
migrant,Breitbart News,Kurt Zindulka,‘We Have Space’ Thousands of Germans Protest For MORE Migrants After Moria Camp Fire,https://www.breitbart.com/europe/2020/09/21/we-have-space-thousands-of-germans-protest-for-more-migrants-after-moria-camp-fire/,"Thousands of protesters took to the streets of Germany on Sunday to demand that the government take in more migrants following the fire that destroyed the Moria migrant camp in Greece.
In Berlin, ar… [+2848 chars]",2020-09-21T16:43:27Z
migrant,Breitbart News,Chris Tomlinson,Iraqi Migrants Accused of Dragging Women into a Car And Raping Them,https://www.breitbart.com/europe/2020/09/27/iraqi-migrants-accused-dragging-women-car-raping-them/,"Two Iraqi migrant brothers are on trial in a Berlin court after being accused of dragging young women into an SUV and then raping them for hours.
The brothers, 33-year-old Wisam and 25-year-old Karr… [+1994 chars]",2020-09-27T07:37:46Z
migrant,Breitbart News,Bob Price,42 Migrants Found in Horse Trailer near Inland Texas Checkpoint,https://www.breitbart.com/border/2020/09/14/42-migrants-found-in-horse-trailer-near-inland-texas-checkpoint/,Laredo Sector Border Patrol agents disrupted a human smuggling attempt after finding a migrant-filled horse trailer. The driver allegedly attempted to sneak around an interior immigration checkpoint.… [+2702 chars],2020-09-14T15:33:19Z
migrant,Breitbart News,Neil Munro,Donald Trump’s Judges Fill Immigration Courts,https://www.breitbart.com/economy/2020/09/14/donald-trumps-judges-fill-immigration-courts/,"Judges appointed by President Donald Trump’s deputies are filling up the immigration courts, and they have reversed the anti-deportation trend caused by President Barack Obama’s judges.
“Nearly two-… [+4231 chars]",2020-09-14T19:35:17Z
migrant,Breitbart News,Jack Montgomery,Leftists Protest New Migrant Camps – Want Even More Generous Housing for Illegals,https://www.breitbart.com/europe/2020/09/22/leftists-protest-new-migrant-camps-want-illegals-get-more-generous-housing/,"Leftist campaigners protest plans to establish migrant camps in Wales — because they want them to receive more luxurious housing, free education, and paying jobs instead.
The Penally Army Centre nea… [+2801 chars]",2020-09-22T13:05:09Z
migrant,Breitbart News,Breitbart London,"Driver Killed, Nine Injured After Suspected Migrant Smuggler’s Car Crash",https://www.breitbart.com/europe/2020/10/09/driver-killed-nine-injured-after-suspected-migrant-smugglers-car-crash/,"THESSALONIKI, Greece (AP) – A car involved in suspected migrant trafficking has crashed in northern Greece leaving the driver dead and all nine passengers injured, police said Friday.
Police said th… [+1021 chars]",2020-10-09T14:14:06Z
migrant,Breitbart News,Victoria Friedman,Farage Watched French Warship Escort Migrant Boat into British Waters,https://www.breitbart.com/europe/2020/09/16/farage-watched-french-warships-escort-migrants-british-waters-hour/,"Nigel Farage reported from the English Channel on Wednesday that French authorities continue to escort boats full of illegal aliens into British waters, despite UK government claims that France is do… [+3371 chars]",2020-09-16T11:45:27Z
migrant,Breitbart News,Chris Tomlinson,Pakistani Migrant Paris Attacker Revealed to Be 25 Not 18,https://www.breitbart.com/europe/2020/09/29/pakistani-migrant-paris-attacker-revealed-to-be-25-not-18/,Paris investigators have revealed that the Pakistani migrant who attacked and injured two people outside of the former office of magazine Charlie Hebdo is actually 25 and not 18 as he had previously … [+2380 chars],2020-09-29T09:05:19Z
migrant,Breitbart News,Neil Munro,Democrats Demand Investigation of ‘Mass Hysterectomies’ of Migrant Women,https://www.breitbart.com/2020-election/2020/09/16/democrats-demand-investigation-mass-hysterectomies-migrant-women/,Democrats are pushing for an investigation into the dramatic charge that a contract doctor secretly removed the uteruses of migrant women who were detained at a privately-run detention center in Geor… [+6739 chars],2020-09-16T18:56:36Z
migrant,Breitbart News,Chris Tomlinson,French Police Catch Pregnant 13-Year-Old Migrant Pickpocket,https://www.breitbart.com/europe/2020/09/13/french-police-catch-pregnant-13-year-old-migrant-pickpocket/,"French police in the city of Montpellier arrested a 13-year-old Bosnian migrant girl for pickpocketing and found that the young girl was also eight and a half months pregnant.
The young girl was arr… [+2185 chars]",2020-09-13T13:47:40Z
migrant,Breitbart News,Chris Tomlinson,Populist Salvini Physically Attacked by Leftist Migrant in Tuscany,https://www.breitbart.com/europe/2020/09/11/salvini-physically-attacked-by-leftist-migrant-in-tuscany/,"Populist Italian Senator Matteo Salvini was the victim of a physical attack, reportedly by a politically left-wing migrant during a campaign event ahead of the regional elections in the traditional l… [+2188 chars]",2020-09-11T12:00:40Z
migrant,Breitbart News,Chris Tomlinson,Underage Afghan Migrants Arrested for Moria Migrant Camp Arson,https://www.breitbart.com/europe/2020/09/16/underage-afghan-migrants-arrested-moria-migrant-camp-arson/,"Greek police have arrested five migrants, including two underage Afghans, in connection to the alleged arson of the Moria migrant camp which has left more than 13,000 people homeless.
Since the fire… [+2382 chars]",2020-09-16T10:36:45Z
migrant,Breitbart News,Chris Tomlinson,Over 100 Migrants Jump Overboard from NGO Vessel to Reach Italy,https://www.breitbart.com/europe/2020/09/20/over-100-migrants-jump-overboard-from-ngo-vessel-to-reach-italy/,"Nearly half the migrants aboard a Spanish migrant transport NGO vessel stuck off the coast of Sicily by Italian authorities jumped overboard in a bid to reach Italian shores.
The Spanish NGO Open Ar… [+2460 chars]",2020-09-20T17:46:43Z
migrant,Breitbart News,Chris Tomlinson,Confession: Pakistani Migrant Stabbed German Teen in Plot to Avoid Getting Deported,https://www.breitbart.com/europe/2020/09/16/pakistani-migrant-stabs-german-teen-plan-avoid-deportation/,"A 19-year-old German was stabbed at random on a tram in the city of Cottbus by a Pakistani migrant who later told officials he stabbed him to stay in the country.
The attack took place in the early … [+1983 chars]",2020-09-16T09:19:36Z
migrant,Breitbart News,Bob Price,GRAPHIC: Migrant’s Decaying Body Found on Texas Ranch 80 miles from Border,https://www.breitbart.com/border/2020/09/26/graphic-migrants-decaying-body-found-on-texas-ranch-80-miles-from-border/,"A Texas deputy and Border Patrol agents recovered the partially decayed body of a migrant who died after being abandoned on a ranch located about 80 miles north of the Texas-Mexico border.
Brooks Co… [+2535 chars]",2020-09-26T19:10:51Z
migrant,Breitbart News,Kurt Zindulka,‘We Wish We Stayed in France’: Sudanese Illegal Migrants Complain About Conditions in UK Camp,https://www.breitbart.com/europe/2020/09/28/we-wish-we-stayed-france-illegal-migrants-complain-conditions-uk-camp/,"A group of illegal migrants have spoken publicly to complain about the conditions in the recently opened migrant camp in Folkestone, Kent, claiming that the supposedly poor conditions make them regre… [+3730 chars]",2020-09-28T11:00:31Z
migrant,Breitbart News,Chris Tomlinson,Majority of Germans Fear Taking Migrants from Greece Will Trigger New Migrant Wave,https://www.breitbart.com/europe/2020/09/20/majority-of-germans-fear-taking-migrants-from-greece-will-trigger-new-migrant-wave/,"A majority of Germans have expressed concern that the German government taking in large numbers of migrants from Greece after the Moria migrant camp fire could trigger a new wave of migration.
The G… [+1854 chars]",2020-09-20T16:39:17Z
migrant,Breitbart News,Chris Tomlinson,Migrant Under Deportation Order Turns Himself in After Murder of Priest,https://www.breitbart.com/europe/2020/09/17/migrant-deportation-order-turns-himself-murder-priest/,"A homeless illegal migrant from Tunisia has turned himself in after the brutal murder of priest Roberto Malgesini, who was killed in a public square in the city of Como.
The alleged murder took plac… [+2228 chars]",2020-09-17T08:47:29Z
migrant,Breitbart News,Neil Munro,NYT: Elites ‘Ghost’ Their Illegal Migrants in Coronavirus Crash,https://www.breitbart.com/economy/2020/09/21/nyt-elites-ghost-their-illegal-migrants-in-coronavirus-crash/,"Wealthy Americans have quietly fired and discarded many of their illegal migrant house cleaners since the coronavirus economic crash, often without warning or compensation, says the New York Times:
… [+6298 chars]",2020-09-21T23:31:15Z
migrant,Breitbart News,Bob Price,Migrants Lost in Arizona Mountains Rescued by CBP Helicopter Crews,https://www.breitbart.com/border/2020/09/29/migrants-lost-in-arizona-mountains-rescued-by-cbp-helicopter-crews/,"Tucson Branch Air and Marine Operations aircrews carried out two rescues in recent days after migrants became lost in the Baboquivari Peak Wilderness area in Arizona.
U.S. Customs and Border Protect… [+2441 chars]",2020-09-29T15:20:45Z
migrant,Breitbart News,Chris Tomlinson,Greek Minister Claims Closed Borders Have Cost People Traffickers €100 Million,https://www.breitbart.com/europe/2020/09/18/greek-minister-closed-borders-cost-people-traffickers-100-million/,"Greek Minister for Migration and Asylum Notis Mitarakis has claimed that people traffickers have lost as much as 100 million due to the reduction in migrants flowing into Greece.
The Migration and A… [+2216 chars]",2020-09-18T14:20:18Z
migrant,Breitbart News,Ildefonso Ortiz,Mexico’s President Suggests New Migrant Caravan Timed to Influence U.S. Presidential Election,https://www.breitbart.com/border/2020/10/02/mexicos-president-suggests-new-migrant-caravan-timed-to-influence-u-s-presidential-election/,Mexicos President said the newly formed Central American migrant caravan appears to be a politically motivated development shortly before the U.S. presidential election. The bombshell allegation come… [+1874 chars],2020-10-02T20:06:47Z
migrant,Breitbart News,Bob Price,"Lost Migrant Starts Fire in California, 13 More Rescued from Heatwave",https://www.breitbart.com/border/2020/09/10/lost-migrant-starts-fire-in-california-13-more-rescued-from-heatwave/,San Diego Sector Border Patrol agents rescued 14 migrants over the Labor Day weekend. The rescues led to eight of the 14 being transported to hospitals due to heat-related illnesses. One admitted to … [+2662 chars],2020-09-10T15:51:12Z
migrant,Breitbart News,Chris Tomlinson,"EU Considers Scrapping Dublin Asylum Agreement, New Measures Could Force Migrant Redistribution",https://www.breitbart.com/europe/2020/09/17/eu-considers-scrapping-dublin-asylum-agreement-new-measures-could-force-migrant-redistribution/,"European Commission President Ursula von der Leyen has proposed abolishing current European Union asylum rules, suggesting new measures could force member states to take migrants through a “new stron… [+1891 chars]",2020-09-17T14:49:13Z
migrant,Breitbart News,Chris Tomlinson,Bosnian Regional PM Calls on Italy to Help Stop Migrant Surge,https://www.breitbart.com/europe/2020/09/13/bosnian-regional-pm-calls-on-italy-to-help-stop-migrant-surge/,"Mustafa Runi, Prime Minister of the canton of Una Sana in Bosnia-Herzegovina, has called on Italy to help stop the flow of migrants in the Balkans as tens of thousands continue to pass through.
Una … [+2269 chars]",2020-09-13T11:17:00Z
migrant,Breitbart News,Victoria Friedman,Farage Watched French Navy Abandon Struggling Migrant Vessel in English Channel,https://www.breitbart.com/europe/2020/09/17/farage-watched-french-abandon-struggling-migrant-vessel-channel/,"Nigel Farage, a Telegraph journalist, and a fishing boat captain were witnesses to the French Navy escorting into British waters a vessel full of migrants bailing water and return to France without t… [+5142 chars]",2020-09-17T15:50:56Z
migrant,Breitbart News,Chris Tomlinson,Paris to Open Migrant Reception Centre in Historic Former Town Hall,https://www.breitbart.com/europe/2020/10/08/paris-to-open-migrant-reception-centre-historic-former-town-hall/,"The Paris city government has announced it will be transforming the historic former town hall in the city’s 1st arrondissement into a reception centre for asylum seekers and migrants.
Paris Mayor An… [+2021 chars]",2020-10-08T08:42:27Z
migrant,Breitbart News,Chris Tomlinson,Father of Paris Charlie Hebdo Attacker Claims To Be ‘Proud’ Of His Actions,https://www.breitbart.com/europe/2020/09/30/father-of-paris-charlie-hebdo-attacker-claims-to-be-proud-of-his-actions/,"The father of the Pakistan migrant arrested for stabbing two people outside of the former offices of satirical French magazine Charlie Hebdo, claims to be “proud” of his son’s actions
The father of … [+2269 chars]",2020-09-30T16:09:42Z
migrant,Breitbart News,Kurt Zindulka,‘Will Anybody Lift A Finger?’ Farage Predicts Hundreds of Boat Migrants Will Set Off on Tuesday,https://www.breitbart.com/europe/2020/09/21/will-anybody-lift-a-finger-farage-predicts-hundreds-of-boat-migrants-will-set-off-on-tuesday/,"Brexit Party leader Nigel Farage said that he has intelligence from sources in Calais, that a massive wave of hundreds of illegal migrants will set sail from the beaches of France on Tuesday, and que… [+3396 chars]",2020-09-21T17:30:59Z
migrant,Breitbart News,Chris Tomlinson,Swedish Police: New Gang Culture Emerged from Second-Generation Migrants,https://www.breitbart.com/europe/2020/10/04/swedish-police-claim-new-gang-culture-emerged-second-generation-migrants/,The head of the intelligence unit of the National Operational Department (NOA) of the Swedish police force said that many of the gangs in no-go vulnerable areas consist of second-generation migrants … [+2197 chars],2020-10-04T08:11:51Z
migrant,Breitbart News,Chris Tomlinson,Sweden: Nearly Half of Unemployed Migrants Lack High School Education,https://www.breitbart.com/europe/2020/10/07/sweden-nearly-half-unemployed-migrants-lack-high-school-education/,"The Swedish Public Employment Office has revealed that 43 per cent of foreigners without work lack a high school education, compared to 18 per cent of native-born unemployed.
The agency stated that … [+1988 chars]",2020-10-07T12:05:33Z
migrant,Breitbart News,Victoria Friedman,"Orbán Rejects Migration Pact, Says EU Wants to ‘Manage Migration’ Not Stop It",https://www.breitbart.com/europe/2020/09/27/central-europe-eu-wants-manage-migration-not-stop-it-new-migration-pact/,"The central European Visegrád group has criticised the European Commission’s planned reform of the EU’s asylum policy, which could ultimately force members to accept migrants.
This week, the EU’s po… [+3898 chars]",2020-09-27T07:43:39Z
migrant,Breitbart News,Chris Tomlinson,Moroccans Make Up Nearly a Quarter of All Juvenile Inmates in Spain,https://www.breitbart.com/europe/2020/09/20/moroccans-make-up-nearly-a-quarter-of-all-juvenile-inmates-in-spain/,"A study has revealed that around a quarter of those in juvenile detention in Spain come from Morocco and as many as three in ten illegal migrants have committed some sort of crime.
According to the … [+2234 chars]",2020-09-20T13:58:25Z
migrant,Breitbart News,Victoria Friedman,British Authorities ‘Overwhelmed’ by ‘Absolute Mayhem’ as 200 Illegals Land,https://www.breitbart.com/europe/2020/09/12/authorities-overwhelmed-absolute-mayhem-200-illegals-land/,"Authorities described being “overwhelmed” by the “absolute mayhem” in the English Channel as illegal aliens took advantage of the calm waters to break into Britain.
Of the reported 200 migrants, 73 … [+4043 chars]",2020-09-12T08:14:07Z
migrant,Breitbart News,Victoria Friedman,More Illegals Have Landed in UK in September Than Whole of 2019: Report,https://www.breitbart.com/europe/2020/09/25/more-illegals-have-landed-uk-september-whole-2019/,"More migrants have arrived in the United Kingdom by boat in September than the whole of 2019, according to reports.
Tuesday’s landings of 393 illegal aliens on English shores made September hit a mi… [+4041 chars]",2020-09-25T10:23:31Z
migrant,Breitbart News,Chris Tomlinson,Lawyer Linked to Swedish Migrant Clan Gangs Threatened with Expulsion from Bar Association,https://www.breitbart.com/europe/2020/10/02/lawyer-linked-swedish-migrant-clan-gangs-threatened-expulsion-bar-association/,"Gothenburg lawyer Edip Samuelsson, who has represented local migrant clan gangs, has been threatened with expulsion from the Bar Association after allegedly leaking restricted information from detain… [+2574 chars]",2020-10-02T10:10:52Z
migrant,Breitbart News,Chris Tomlinson,Italian Coastguard Tells German Migrant Taxi NGO Ship to Go to Germany,https://www.breitbart.com/europe/2020/09/23/italian-coastguard-tells-german-migrant-taxi-ngo-ship-go-germany/,"Italian coastguard authorities on the island of Lampedusa have denied port access to the German migrant transport NGO Sea-Eye, telling the vessel to head to Germany.
Sea-Eye’s ship, the Alan Kurdi, … [+1995 chars]",2020-09-23T10:45:42Z
migrant,Breitbart News,Kurt Zindulka,French Police Dismantle Calais 'Jungle' Migrant Camp Housing Over 700 'Asylum Seekers',https://www.breitbart.com/europe/2020/09/29/french-police-dismantle-calais-jungle-camp-housing-700-migrants/,"A migrant camp in Calais, France in which 700 to 800 migrants were squatting was dismantled by French police on Tuesday, in what is being characterized as the largest operation since the destruction … [+4664 chars]",2020-09-29T17:55:56Z
migrant,Breitbart News,Chris Tomlinson,Austrian Integration Minister Rejects Any Form of Parallel Migrant Societies,https://www.breitbart.com/europe/2020/09/10/austrian-integration-minister-rejects-any-form-parallel-migrant-societies/,"Integration Minister Susanne Raab has rejected the idea of migrant enclaves in Austria, saying she would not support a Chinatown or a Little Italy developing in the country.
Minister Raab made her c… [+3011 chars]",2020-09-10T11:38:59Z
migrant,Breitbart News,Chris Tomlinson,"At Least 13,000 Migrants Homeless After Notorious Moria Camp Burns to the Ground",https://www.breitbart.com/europe/2020/09/10/least-13000-migrants-homeless-notorious-moria-camp-burns-ground/,"At least 13,000 asylum seekers are without housing after a massive fire gutted the notorious Moria migrant camp on the island of Lesbos, with some accusing migrants of setting the blaze.
The fire be… [+3549 chars]",2020-09-10T14:43:10Z
migrant,Breitbart News,Chris Tomlinson,Spanish Canary Islands See 'Unsustainable' 700 Per Cent Rise in Migrants,https://www.breitbart.com/europe/2020/10/08/spanish-canary-islands-see-unsustainable-700-per-cent-rise-migrants/,"The Spanish Canary Islands have seen a massive 700 per cent rise in illegal migrant arrivals in 2020 and European Union officials are calling the influx “unsustainable”.
European Union Home Affairs … [+2140 chars]",2020-10-08T16:00:39Z
