Keyword,Source,Author,Title,URL,Text,Published
immigrant,USA Today,"Pocono Record, J.D. Prose, Pocono Record","'This hatred is taught': Gisele Fetterman, Pennsylvania's second lady, records racist insults aimed at her",https://www.usatoday.com/story/news/politics/2020/10/12/gisele-fetterman-pennsylvania-second-lady-racist-insults/5974160002/,"Sesame Street is teaching children to stand up against racism in their half-hour special, The Power of We.
Buzz60
FOREST HILLS, Pa.  A visit to a local grocery store turned ugly Sunday when Gisele … [+4711 chars]",2020-10-12T23:17:58Z
immigrant,USA Today,"Tallahassee Democrat, Jeffrey Schweers, Tallahassee Democrat",Security agency sees no 'malicious activity' in latest crash of Florida's online voter registration system,https://www.usatoday.com/story/news/politics/2020/10/07/no-malicious-activity-florida-voter-registration-system-crash/5917343002/,"Civil rights experts point to long wait times to vote as a sign of growing voter suppression in the U.S. Here's what to expect in the 2020 election.
USA TODAY
TALLAHASSEE, Fla.  U.S. Chief Judge Ma… [+4903 chars]",2020-10-08T00:39:39Z
immigrant,USA Today,Associated Press,Nurse questions medical care – including hysterectomies – at Georgia ICE jail - USA TODAY,https://www.usatoday.com/story/news/nation/2020/09/15/ice-jail-georgia-nurse-questions-medical-care-detainees/5801521002/,"After 9/11, the U.S. enforced stricter control on immigration. This enforcement led to the birth of Homeland Security and ICE, but what is ICE exactly? We explain.
USA TODAY
OCILLA, Ga. An immigrat… [+3465 chars]",2020-09-15T09:34:46Z
immigrant,USA Today,"USA TODAY, Lindsay Schnell, USA TODAY",'Like smoking multiple packs a day': Hazardous air quality worries West Coast parents,https://www.usatoday.com/in-depth/news/nation/2020/09/20/california-oregon-wildfires-hazardous-air-quality-fire-smoke-kids-health/3488945001/,"El Dorado Forest Fire rages in San Bernardino County
Winds increased activity of the El Dorado Fire on September 9, San Bernardino firefighters said, as crews made a hard stance to save numerous hom… [+10820 chars]",2020-09-20T10:01:11Z
immigrant,USA Today,"USA TODAY, Kelly Tyko, USA TODAY",Google marks start of National Hispanic Heritage Month with new Doodle and plans to spotlight Latino businesses,https://www.usatoday.com/story/tech/2020/09/15/google-national-hispanic-heritage-month-2020-doodle-honors-felicitas-mendez/5804947002/,"Google is honoring Felicitas Mendez to mark the start of National Hispanic Heritage Month.
 (Photo: Google)
Google's search website was updated Tuesday for the first day of National Hispanic Herita… [+1996 chars]",2020-09-15T17:17:34Z
immigrant,USA Today,"USA TODAY, Bill Keveney, USA TODAY","Study: TV shows exaggerate the number of undocumented immigrants, but nuanced portrayals can educate",https://www.usatoday.com/story/entertainment/tv/2020/09/23/study-tv-shows-need-more-accurate-nuanced-immigrant-portrayals/5857127002/,"Cristina Jiménez, a Genius grant recipient and founder of United We Dream, the nation's largest youth immigrant organization, talks about significant moments in her life that propelled her to speak a… [+5688 chars]",2020-09-23T13:00:20Z
immigrant,USA Today,"USA TODAY, Deirdre Shesgreen, USA TODAY",Trump administration slashes refugee program amid president's campaign attacks on immigrants,https://www.usatoday.com/story/news/world/2020/10/01/trump-moves-slash-refugee-resettlement-amid-campaign-attacks/3574637001/,"Starting a new life in the United States is never easy for refugees. But doing it during a pandemic has created even more struggles, especially after the federal government cut off resettlement fundi… [+5522 chars]",2020-10-01T15:14:23Z
immigrant,USA Today,"USA TODAY, Annika Hom, Report for America","In San Francisco, voters to decide if noncitizens can serve on city boards",https://www.usatoday.com/story/opinion/2020/10/08/san-francisco-decide-if-undocumented-can-serve-city-boards-column/5909163002/,"Cristina Jiménez, a Genius grant recipient and founder of United We Dream, the nation's largest youth immigrant organization, talks about significant moments in her life that propelled her to speak a… [+7347 chars]",2020-10-08T11:00:55Z
immigrant,USA Today,"USA TODAY, Jefferson Graham, USA TODAY","In China, WeChat is everything: Text messaging, video chat and mobile payments",https://www.usatoday.com/story/tech/2020/09/18/wechat-connects-business-family-everything-china/5826467002/,"Frances He is a Chinese immigrant living near Los Angeles who uses the WeChat app to talk to her brother back home. But with the Trump Administration's Sunday ban on the app, she's going to have to f… [+5128 chars]",2020-09-18T21:02:59Z
immigrant,USA Today,"USA TODAY, Rick Jervis, Alan Gomez and Maria Clark, USA TODAY",Alleged unwanted hysterectomies and other abuses at ICE facility prompts investigation,https://www.usatoday.com/story/news/nation/2020/09/17/hysterectomies-immigrants-complaint-ice-and-detention-center-irwin-county/3482369001/,"ICE detention is meant to assure immigration compliance only, but detainees describe desperation, and punitive measures that resemble prisons.
USA TODAY
Members of Congress are pressing the adminis… [+11386 chars]",2020-09-18T00:41:07Z
immigrant,USA Today,"Arizona Republic, Daniel Gonzalez, Arizona Republic","124 immigrant children held in 3 Phoenix hotels under Trump policy, court records show",https://www.usatoday.com/story/travel/hotels/2020/09/24/under-trump-policy-124-immigrant-children-held-hotels-phoenix-court-records-show/3514509001/,"Albert Law says he was floored by a question from a security guard after checking into a Hilton hotel in Richmond, Virginia.
USA TODAY
A federal judge has given the Trump administration until Sept.… [+9677 chars]",2020-09-24T11:35:59Z
immigrant,USA Today,"USA TODAY, Randall Kennedy and Ilya Somin, Opinion contributors",Remove the natural born citizen clause in the Constitution. Let immigrants be president.,https://www.usatoday.com/story/opinion/2020/09/18/immigrants-president-repeal-natural-born-citizen-clause-column/5805710002/,"Repealing the citizenship clause may get easier as xenophobia recedes and people realize how ridiculous it is. Already it has backers from right to left.
This presidential election season joins the … [+5955 chars]",2020-09-18T11:00:28Z
immigrant,USA Today,"USA TODAY, Brian Truitt, USA TODAY",'Cuties': Here's why the controversial Netflix film became a combatant in America's culture war,https://www.usatoday.com/story/entertainment/movies/2020/09/15/cuties-controversial-netflix-drama-uncomfortable-yet-worthwhile/5806625002/,"The Academy of Motion Picture Arts and Sciences reveals new criteria that require more diversity for nominees. The rules will go into effect in 2024.
USA TODAY
It was only a matter of time before o… [+3958 chars]",2020-09-15T18:54:17Z
immigrant,USA Today,"USA TODAY, Rebecca Morin, USA TODAY",Lindsey Graham in debate forum: Black people can go anywhere in South Carolina if they're 'not liberal',https://www.usatoday.com/story/news/politics/2020/10/10/lindsey-graham-black-people-can-go-anywhere-sc-if-conservative/5954115002/,"What history has shown us about contested elections and peaceful transitions of power.
USA TODAY
Sen. Lindsey Graham of South Carolina, who is facing a competitive re-election campaign, said Friday… [+2158 chars]",2020-10-10T19:22:16Z
immigrant,USA Today,"USA TODAY, Joel Shannon and Joshua Bote, USA TODAY",West Coast wildfires are ravaging communities. Here's how to help victims and first responders,https://www.usatoday.com/story/news/nation/2020/09/15/how-help-california-oregon-fire-victims-firefighters/5806864002/,"Dozens of wind-driven wildfires race through more than a dozen western U.S. states.
USA TODAY
Ongoing wildfires in western U.S. states including California, Oregon and Washington have burned thousa… [+4728 chars]",2020-09-15T22:13:37Z
immigrant,USA Today,"USA TODAY, Marco della Cava, USA TODAY",Review: 'A Brotherhood Betrayed' is a riveting true-crime gangster tale,https://www.usatoday.com/story/entertainment/books/2020/10/02/review-brotherhood-betrayed-riveting-true-crime-gangster-tale/5830727002/,"""A Brotherhood Betrayed: The Man Behind the Rise and Fall of Murder, Inc.,"" by Michael Cannell.
 (Photo: Minotaur Books)
A book that can whisk you away to another world even the Mob underworld has … [+3901 chars]",2020-10-02T18:55:06Z
immigrant,USA Today,"USA TODAY, Mary Cadden and Barbara VanDenburgh, USA TODAY","2020 Booker Prize shortlist includes Diane Cook, Tsitsi Dangarembga",https://www.usatoday.com/picture-gallery/entertainment/books/2020/09/15/shortlist-announced-2020-booker-prize/5716323002/,"The winner of the literary award, which&amp;nbsp;honors the best original novel written in the English language and published in the United Kingdom or Ireland, will be announced Nov. 17."" orientation… [+5371 chars]",2020-09-15T12:35:33Z
immigrant,USA Today,"USA TODAY, David Jackson, USA TODAY",Rep. Ilhan Omar responds to President Donald Trump's attacks: 'This is my country',https://www.usatoday.com/story/news/politics/elections/2020/09/23/ilhan-omar-responds-president-trumps-attacks-this-my-country/3501453001/,"Rep. Ilhan Omar said since President Donald Trump tweeted about her, she's received an increase in ""direct threats.""
USA TODAY
WASHINGTON  President Donald Trump again attacked Rep. Ilhan Omar at a… [+3093 chars]",2020-09-23T13:34:32Z
immigrant,USA Today,"USA TODAY, Joseph Salvador, USA TODAY",What aren't there more Latinos playing and coach high school and college football?,https://www.usatoday.com/story/sports/2020/10/14/barriers-latinos-power-5-football-told-hispanic-players/3589170001/,"Ruben Garcia, the head football coach and athletic director at Falfurrias High School in Falfurrias, Texas, didnt think much of the small group chat he created.
The collection of Hispanic high schoo… [+9420 chars]",2020-10-14T18:03:25Z
immigrant,USA Today,"USA TODAY, Erin Jensen, USA TODAY",'Family Guy': Arif Zahir takes over Cleveland Brown role from white actor Mike Henry,https://www.usatoday.com/story/entertainment/tv/2020/09/25/family-guy-cleveland-brown-voice-actor-arif-zahir-mike-henry/3531768001/,"Actor Arif Zahir will take over the role of Cleveland Brown for Season 19 of ""Family Guy.""
 (Photo: Ben Krantz)
There's a new ""Family Guy"" voice actor who can say, ""My name is Cleveland Brown.""
Bl… [+2723 chars]",2020-09-25T17:55:36Z
immigrant,USA Today,"USA TODAY, William Cummings, USA TODAY","'Other than slavery,' COVID-19 lockdowns are worst civil liberties infringement in US history, Barr says",https://www.usatoday.com/story/news/politics/2020/09/17/barr-lockdowns-worst-civil-liberty-infringement-other-than-slavery/3477686001/,"A new book suggests that President Trump understood the threats of the coronavirus even as he told the nation it was no worse than the seasonal flu.
USA TODAY
Attorney General William Barr drew cri… [+4828 chars]",2020-09-17T14:41:28Z
immigrant,USA Today,"USA TODAY, Kristan Hawkins, Opinion contributor",Catholic voters can't ignore abortion or Kamala Harris' religious bigotry in 2020 election,https://www.usatoday.com/story/opinion/voices/2020/09/22/catholic-abortion-vote-biden-trump-ruth-bader-ginsburg-2020-column/5853831002/,"As Pope Francis has said, 'The right to life is the first among human rights.' So why make American Catholics feel like they shouldn't vote for life?
We are at one of those regular intervals when th… [+6123 chars]",2020-09-22T11:00:17Z
immigrant,USA Today,"USA TODAY, Kurt Bardella, Opinion columnist",Why do Republicans still work for Trump? Especially when the White House is a COVID hotspot?,https://www.usatoday.com/story/opinion/2020/10/14/trump-aides-risk-lives-white-house-covid-19-hotspot-column/3639042001/,"When I left the Republican Party and lost my network, I fell into debt. I understand financial obligations. But now Trump is putting lives at risk.
I get asked all the time, Why do people who you kn… [+6466 chars]",2020-10-14T07:15:10Z
immigrant,USA Today,"Tallahassee Democrat, Jeffrey Schweers, Capital Bureau","Federal judge won't extend voter registration in Florida, criticizes state over failures",https://www.usatoday.com/story/news/politics/elections/2020/10/09/federal-judge-denies-request-extend-voter-registration-deadline-florida/5937754002/,Election Day is just 4 weeks away and the deadline to register to vote is rapidly approaching in most states. The quickest way to register to vote online is to go to your states official elections we… [+6342 chars],2020-10-09T15:53:38Z
immigrant,USA Today,"Asbury Park Press, Joshua Chung, Asbury Park Press","New Jersey man charged with stealing over $480,000 from Asbury Park hotel, authorities say",https://www.usatoday.com/story/travel/hotels/2020/09/24/new-jersey-hotel-lost-over-480-k-from-alleged-employee-theft/3514571001/,"The stay-at-home order has affected everything, including crime as numbers show a 43% decrease over the past month across the Jersey Shore.
Asbury Park Press
FREEHOLD, N.J.  A Montclair, New Jersey… [+2843 chars]",2020-09-24T11:45:20Z
immigrant,USA Today,"USA TODAY, Alia E. Dastagir, USA TODAY","COVID, hurricanes, wildfires, politics: 2020 is an American nightmare that's wearing us out",https://www.usatoday.com/story/news/nation/2020/09/20/covid-hurricanes-wildfires-politics-2020-worst-year-ever/5839914002/,"A driver recorded the dramatic moments as they drove through the Beachie Creek Fire in Mill City, Oregon, on Sept. 8.
Accuweather
It's too much.
First the pandemic, which divided us, economically … [+11691 chars]",2020-09-20T16:09:00Z
immigrant,USA Today,"USA TODAY, Lindsay Schnell, USA TODAY",'You're not wanted': Trump's proposed college student visa changes worry international students — again,https://www.usatoday.com/story/news/education/2020/09/26/trump-student-visa-rule-dhs-f-1-changes/3537182001/,International students at U.S. universities expressed relief after the Trump administration rescinded a rule that would have required them to transfer or leave the country if their schools held class… [+8900 chars],2020-09-26T07:01:08Z
immigrant,USA Today,"USA TODAY, Maureen Groppe, USA TODAY",How Vice President Mike Pence and Sen. Kamala Harris stack up against each other,https://www.usatoday.com/in-depth/news/politics/elections/2020/10/07/vice-presidential-debate-comparing-mike-pence-and-kamala-harris/3636989001/,"Vice President Mike Pence and Sen. Kamala Harris get their turn in the spotlight at the Oct. 7 vice presidential debate. 
While vice presidential candidates try to keep the focus on the top of the t… [+8570 chars]",2020-10-07T14:27:58Z
immigrant,USA Today,"Tallahassee Democrat, Jeffrey Schweers, Capital Bureau",Federal judge weighs arguments in lawsuit over Florida voter registration system crash,https://www.usatoday.com/story/news/politics/elections/2020/10/08/federal-judge-weighs-arguments-voter-registration-system-crash-lawsuit/5929416002/,"These postcards are being mailed out to potential voters who aren't registered, but some say it's too little too late.
 (Photo: Florida Division of Elections)
The fate of thousands of potential vot… [+8156 chars]",2020-10-08T21:21:58Z
immigrant,USA Today,"USA TODAY, Kim Hjelmgaard and Deirdre Shesgreen, USA TODAY",'Treating us like garbage': New sanctions announced as many Iranian Americans feel fed up with Trump,https://www.usatoday.com/story/news/politics/elections/2020/10/08/iran-sanctions-trump-iranian-americans-vote-election/3528381001/,Iran has rejected a U.S. demand for the United Nations to restore sanctions against the Islamic state. The Trump administration on Thursday formally notified the United Nations of its demand for all … [+16737 chars],2020-10-08T18:48:50Z
immigrant,NBC News,Chris Fuchs,Chinese Americans look to new platforms as WeChat's future remains uncertain,https://www.nbcnews.com/news/asian-america/chinese-americans-look-new-platforms-wechat-s-future-remains-uncertain-n1241027,"Back in April, when New York City was in the grips of COVID-19, Yuan Mingyue relied on WeChat to keep in touch with relatives in China, to check on their health and to share how things were in New Yo… [+4773 chars]",2020-09-26T16:26:24Z
immigrant,NBC News,Ben Kesslen,Wife of Pennsylvania's Lt. Governor called racist slur at grocery store,https://www.nbcnews.com/news/us-news/wife-pennsylvania-s-lt-governor-called-racist-slur-grocery-store-n1242916,"The wife of Pennsylvanias lieutenant governor said she was subject to a racist verbal attack at a grocery store on Sunday.
Gisele Barreto Fetterman, wife to Democratic Lt. Gov. John Fetterman, said … [+1777 chars]",2020-10-12T12:15:37Z
immigrant,NBC News,Agnes Constante,"New film explores immigrant family sacrifice, understanding through LGBTQ lens",https://www.nbcnews.com/news/asian-america/new-film-explores-immigrant-family-sacrifice-understanding-through-lgbtq-lens-n1242632,"Shortly after Javi and Elsa learn that their grandmother has died, Javi decides to get ready for work instead of taking a day off to mourn.
Elsa reminds Javi of the magnitude of their grandmothers s… [+4661 chars]",2020-10-13T17:59:10Z
immigrant,NBC News,Variety,"""False sense of perspective"": Immigrant TV stories mainly focus on Latinos, deportation",https://www.nbcnews.com/news/latino/false-sense-perspective-immigrant-tv-stories-mainly-focus-latinos-deportation-n1240921,"As immigration policy continues to be a crucial topic in the news, a new report from Define American and the Norman Lear Center at USC Annenberg shows the television industry still has a long way to … [+5755 chars]",2020-09-24T13:41:39Z
immigrant,NBC News,"María Peña, Noticias Telemundo",Coalition backing TPS starts tour slamming Trump's 'racist' end to immigrant protections,https://www.nbcnews.com/news/latino/coalition-backing-tps-starts-tour-slamming-trump-s-racist-end-n1240711,A coalition of groups opposed to President Donald Trump's decision to end protections for hundreds of thousands of immigrants has embarked on a national tour to put a focus on the issue and mobilize … [+3623 chars],2020-09-22T19:50:01Z
immigrant,NBC News,Nicole Acevedo,"Latino workers are at increased risk of dying on the job, new report says",https://www.nbcnews.com/news/latino/latino-workers-are-increased-risk-dying-job-new-report-says-n1242284,"Latino workers, especially whose who are immigrants, continue to be at increased risk of dying on the job, according to a new report published Tuesday by the American Federation of Labor and Congress… [+3305 chars]",2020-10-06T19:03:52Z
immigrant,NBC News,Chloe Atkins,Maryland council member loses six family members to Covid-19,https://www.nbcnews.com/news/us-news/coronavirus-claims-lives-six-members-one-family-infects-14-others-n1242738,"A Prince George's County council member in Maryland is grappling with loss and grief after Covid-19 killed six members of her extended family and infected 16 others.
Council member Deni Taveras, who… [+2568 chars]",2020-10-09T22:34:50Z
immigrant,NBC News,Raul A. Reyes,A voice for the 'excluded' and 'oppressed': Latinos remember Justice Ruth Bader Ginsburg,https://www.nbcnews.com/news/latino/voice-excluded-oppressed-latinos-remember-justice-ruth-bader-ginsburg-n1240548,Latino civic and advocacy groups have joined in the outpouring of sympathy over the passing of Supreme Court Justice Ruth Bader Ginsburg. The pioneering jurist died at her home in Washington on Septe… [+4348 chars],2020-09-19T17:55:00Z
immigrant,NBC News,"Janet Alvarez, CNBC","Amid Covid crisis, these Latino businesses are thriving",https://www.nbcnews.com/news/latino/amid-covid-crisis-these-latino-businesses-are-thriving-strengthening-their-n1242456,"When Jennifer Rodriguez relocated to Philadelphia in the late 90s, the once-bustling South Philly neighborhood of Italian Market was in decay.
It was a place experiencing disinvestment, and many won… [+9056 chars]",2020-10-07T20:28:10Z
immigrant,NBC News,Danielle Campoamor,It's a mistake to compare ICE's 'mass hysterectomies' to Nazi experiments. Here's why.,https://www.nbcnews.com/think/opinion/mass-hysterectomies-ice-happened-trump-s-watch-they-re-america-ncna1240238,"On Tuesday evening, a harrowing report surfaced after a nurse in Georgia, Dawn Wooten, accused Immigrant and Customs Enforcement officials at the Irwin County Detention Center of denying detainees th… [+5388 chars]",2020-09-16T20:46:00Z
immigrant,NBC News,Reuters,German police officers suspended for sharing pictures of Hitler,https://www.nbcnews.com/news/world/german-police-officers-suspended-sharing-pictures-adolf-hitler-n1240247,"DUESSELDORF, Germany - Twenty-nine police officers have been suspended in Germany for sharing pictures of Adolf Hitler and doctored depictions of refugees in gas chambers on their mobile phones, offi… [+1657 chars]",2020-09-16T18:46:38Z
immigrant,NBC News,Kimmy Yam,"Asian American voters support Biden at 54% and Trump at 30%, but numbers don't tell full story",https://www.nbcnews.com/news/asian-america/asian-american-voters-support-biden-54-trump-30-numbers-don-n1240263,"With less than two months until the presidential election, Asian American and Pacific Islander voters are favoring Democratic candidate Joe Biden, according to a survey published Tuesday that examine… [+6756 chars]",2020-09-16T22:57:49Z
immigrant,NBC News,Deepa Shivaram,"Change or keep your name? For 'Kamala,' 'Nikki,' others, a story of identity, culture and power",https://www.nbcnews.com/news/asian-america/change-or-keep-your-name-kamala-nikki-others-story-identity-n1240646,"More than a month after Joe Biden selected Kamala Harris as his vice presidential pick, Donald Trump is still asking how to pronounce her name.
After having referred to her as ""ka-MA-la"" at a rally … [+6453 chars]",2020-09-22T14:13:29Z
immigrant,NBC News,Silky Shah,Democrats' attention has moved on from ICE. But the crisis it enables continues.,https://www.nbcnews.com/think/opinion/why-america-still-needs-abolish-ice-ncna1243293,"In 2018, one of the biggest demands of immigrant rights activists was Abolish ICE. The rallying cry intensified in part due to the Trump administrations border policy, which separated parents from ch… [+6719 chars]",2020-10-14T21:52:24Z
immigrant,NBC News,Ludwig Hurtado,"Garment workers, paid by the piece, say they'll fight to change the system",https://www.nbcnews.com/news/latino/garment-workers-paid-piece-say-they-ll-keep-fighting-change-n1237810,"California garment worker Santa Son had hoped this was the year the state Legislature would end a system that pays her and other workers for the number of items they make not the hours they work.
So… [+5815 chars]",2020-09-18T00:27:37Z
immigrant,NBC News,Sahil Kapur,Pence and Harris reflect America's demographic transformation,https://www.nbcnews.com/politics/2020-election/mike-pence-kamala-harris-reflect-america-s-demographic-transformation-n1242434,"WASHINGTON When Americans tune in to watch Vice President Mike Pence debate Sen. Kamala Harris, D-Calif., theyll be watching a living encapsulation of the countrys demographic transformation over the… [+4807 chars]",2020-10-07T18:54:00Z
immigrant,NBC News,The Associated Press,Latino construction workers have fueled the building boom—at a price,https://www.nbcnews.com/news/latino/latino-construction-workers-have-enabled-construction-boom-cost-documentary-shows-n1240027,"RIO RANCHO, N.M. Since the Great Recession, cities like Dallas, Houston, Phoenix, and Hobbs, New Mexico, have seen construction booms. Homes and skyscrapers have popped up almost overnight thanks to … [+2063 chars]",2020-09-14T16:13:13Z
immigrant,NBC News,Saloni Gajjar,"Asian Twitter, Black Twitter joke about Harris' disapproving auntie vibe",https://www.nbcnews.com/news/asian-america/asian-twitter-black-twitter-joke-about-harris-disapproving-auntie-vibe-n1242583,Sen. Kamala Harris' facial expressions while Vice President Mike Pence was responding to questions about the administration's Covid-19 response during Wednesday's debate were a hit across social medi… [+2557 chars],2020-10-08T15:27:00Z
immigrant,NBC News,Reuters,"Indian Americans solidly behind Biden in U.S. presidential election, survey shows",https://www.nbcnews.com/news/asian-america/indian-americans-solidly-behind-biden-u-s-presidential-election-survey-n1243351,"NEW DELHI - Nearly three-quarters of Indian Americans plan to vote for Democratic presidential candidate Joe Biden in the U.S. election next month, believing the country is headed in the wrong direct… [+2697 chars]",2020-10-14T16:47:13Z
immigrant,NBC News,Daniella Silva,Mexico says 2 women may have had nonconsensual surgery in ICE detention,https://www.nbcnews.com/news/us-news/mexico-says-2-women-may-have-had-nonconsensual-surgery-ice-n1243427,"Mexico said it has identified two migrant women who may have undergone surgery without their consent while being detained by U.S. immigration authorities.
Mexicos Foreign Ministry announced the find… [+2538 chars]",2020-10-14T22:24:55Z
immigrant,NBC News,Reuters and Kalhan Rosenblatt,Twitter users flood #ProudBoys hashtag with gay pride images,https://www.nbcnews.com/feature/nbc-out/twitter-users-flood-proudboys-hashtag-gay-pride-images-n1242101,"Twitter users are flooding the #ProudBoys hashtag on social media with images of LGBTQ pride, displacing posts made by neo-Nazis and white supremacists using the tag.
Proud Boys, a far-right group f… [+3127 chars]",2020-10-05T13:06:13Z
