Keyword,Source,Author,Title,URL,Text,Published
migrant,Al Jazeera English,Al Jazeera,"‘Brawl’ at migrant camp in Bosnia kills two, injures 18",https://www.aljazeera.com/news/2020/10/1/brawl-among-migrants-in-bosnia-kills-2-injures-18,Two migrants were killed and 18 injured in a brawl in northwest Bosnia and Herzegovina as regional authorities emptied a migrant reception centre in the town of Bihac and moved hundreds to a camp 50 … [+1942 chars],2020-10-01T16:11:24Z
migrant,Al Jazeera English,Al Jazeera,"Three dead, 53 rescued after migrant boat sinks off Crete",https://www.aljazeera.com/news/2020/09/dead-53-rescued-migrant-boat-sinks-crete-200914200840466.html,"Three people have died while 53 others were rescued after a boat carrying migrants and refugees sank off the southern Greek island of Crete.
The dead included two children and a woman.
The Greek co… [+1051 chars]",2020-09-14T20:39:17Z
migrant,Al Jazeera English,Al Jazeera,Greek police accuse aid workers of supporting migrant smugglers,https://www.aljazeera.com/news/2020/9/28/greek-police-accuses-aid-workers-of-helping-migrant-smuggling,"Greek police have accused 35 people, among them two foreign nationals, from several foreign non-governmental aid organisations of illegally helping refugees and migrants to enter from Turkey.
Those … [+2884 chars]",2020-09-28T16:08:32Z
migrant,Al Jazeera English,Al Jazeera,Guatemala promises to break up migrant caravan heading to US,https://www.aljazeera.com/news/2020/10/2/guatemala-vows-to-break-up-migrant-caravan-heading-to-us,"Guatemala has promised to break up a caravan of about 2,000 migrants that set out from neighbouring Honduras this week in hopes of reaching the United States, saying they represent a health threat am… [+3573 chars]",2020-10-02T19:00:12Z
migrant,Al Jazeera English,Al Jazeera,Mexico deploys army on southern border to block migrant caravan,https://www.aljazeera.com/news/2020/10/3/mexico-deploys-army-on-southern-border-to-block-migrant-caravan,"Mexico on Friday ordered the military to deploy along its southern border to block a migrant caravan that President Andres Manuel Lopez Obrador suggested was linked to the United States election.
Th… [+2487 chars]",2020-10-03T08:25:56Z
migrant,Al Jazeera English,Al Jazeera,In Pictures: Guatemala toughens stance on migrant caravan,https://www.aljazeera.com/gallery/2020/10/7/dissolved-migrant-caravan-sign-of-tougher-guatemala-stance/,"The Guatemalan governments decision to halt more than 3,000 Honduran migrants who had set out for the United States amid the coronavirus pandemic, signalled that US pressure on immigration continues … [+2197 chars]",2020-10-07T11:23:01Z
migrant,Al Jazeera English,Al Jazeera,Migrant caravan sets out for the US amid COVID-19 concerns,https://www.aljazeera.com/news/2020/10/1/honduran-caravan-travels-to-the-us-amid-covid-19-concerns,"The first Hondurans hoping to reach the United States arrived at the Guatemala border on foot on Thursday morning as part of a newly-formed caravan, testing the newly reopened frontier that had been … [+5650 chars]",2020-10-01T20:26:53Z
migrant,Al Jazeera English,Al Jazeera,More migrant women in US detention say they didn't OK surgery: AP,https://www.aljazeera.com/news/2020/09/migrant-women-detention-didn-surgery-ap-200918165727667.html,"Sitting across from her lawyer at an immigration detention centre in rural Georgia, Mileidy Cardentey Fernandez unbuttoned her jail jumpsuit to show the scars on her abdomen. There were three small, … [+8229 chars]",2020-09-18T18:57:07Z
migrant,Al Jazeera English,Al Jazeera,Refugees in Greece wary of entering new camp after Moria fire,https://www.aljazeera.com/news/2020/09/refugees-greece-wary-entering-camp-moria-fire-200916125349988.html,"Greek authorities were still struggling to move thousands of refugees and migrants sleeping rough into a temporary camp, a week after the overcrowded Moria migrant camp burned down, while fears grew … [+2107 chars]",2020-09-16T13:30:48Z
migrant,Al Jazeera English,Al Jazeera,Melania Trump secret recordings: ‘I’m driving the liberals crazy’,https://www.aljazeera.com/news/2020/10/2/melania-trump-caught-on-tape-complaining-about-migrant-children,"First Lady Melania Trump expressed support for the care that migrant children separated from their families received in US detention centres, suggesting the facilities were better than what they had … [+2620 chars]",2020-10-02T19:29:39Z
migrant,Al Jazeera English,Al Jazeera,Ethiopian migrants held in Saudi Arabia call it ‘hellish’,https://www.aljazeera.com/news/2020/10/2/ethiopian-migrants-held-in-saudi-arabia-call-it-hellish,"From a filthy cell in Saudi Arabia, the Ethiopian migrant spoke on a smuggled phone, fearing to give his name. Some 300 countrymen are imprisoned with him, he said. And no one knows when Ethiopias go… [+3898 chars]",2020-10-02T10:46:57Z
migrant,Al Jazeera English,Al Jazeera,"Sweden: Far-right activists burn copy of Quran, plan more stunts",https://www.aljazeera.com/news/2020/09/sweden-activists-burn-copy-quran-plan-stunts-200910111120111.html,"Members of a Danish far-right group burned a copy of the Quran in Sweden, only days after a similar incident in the southern city of Malmo.
A video posted by the leader of the Stram Kurs (Hard Line)… [+1815 chars]",2020-09-10T13:33:56Z
migrant,Al Jazeera English,Al Jazeera,Italy softens harsh migration rules championed by Salvini,https://www.aljazeera.com/news/2020/10/6/italy-loosens-migration-rules-to-dismay-of-hardliner-salvini,"Italy has softened harsh rules penalising aid groups that bring undocumented migrants ashore and extended protection for refugees who risk persecution at home.
The so-called security decrees, which … [+3094 chars]",2020-10-06T19:31:00Z
migrant,Al Jazeera English,Al Jazeera,Algeria expelling thousands of migrants across Niger border: HRW,https://www.aljazeera.com/news/2020/10/9/algeria-abandons-thousands-of-migrants-at-niger-border-report,"Algerian security forces have arrested thousands of migrants and refugees, cramming them onto trucks and buses before expelling them across the border to Niger, Human Rights Watch said.
Since early … [+1460 chars]",2020-10-09T18:14:43Z
migrant,Al Jazeera English,Al Jazeera,EU: Greece-Turkey crisis talks might include other nations,https://www.aljazeera.com/news/2020/09/eu-greece-turkey-crisis-talks-include-nations-200915131159907.html,"Third countries might be invited to talks aimed at easing a dispute between Greece and Turkey about energy rights that has brought warships to the eastern Mediterranean, a top European Union official… [+2291 chars]",2020-09-15T13:52:04Z
migrant,Al Jazeera English,Al Jazeera,Two dozen migrants feared drowned off Libya's coast,https://www.aljazeera.com/news/2020/09/dozen-migrants-feared-drowned-libya-coast-200915154357375.html,"A boat carrying refugees and migrants bound for Europe has capsized in the Mediterranean Sea off Libya's coast, leaving at least two dozen people dead or missing, the UN migration agency said.
Safa … [+2497 chars]",2020-09-15T17:25:56Z
migrant,Al Jazeera English,Mia Swart,'There will be blood': Xenophobia in S Africa routine and lethal,https://www.aljazeera.com/news/2020/09/blood-xenophobia-africa-routine-lethal-200915051719107.html,"Sleeping was not an option for Syed in early September last year.
For three days and night, the Bangladeshi shop owner in central Johannesburg said he had to stand guard to protect his store during … [+6963 chars]",2020-09-17T10:44:41Z
migrant,Al Jazeera English,Al Jazeera,US bans palm oil imports from Malaysian producer FGV,https://www.aljazeera.com/economy/2020/10/1/us-bans-palm-oil-imports-from-malaysian-producer-fgv,"The United States has banned imports of palm oil from Malaysian company FGV Holdings following an investigation into allegations it uses forced labour, the US Customs and Border Protection (CBP) agen… [+3205 chars]",2020-10-01T06:02:45Z
migrant,Al Jazeera English,Al Jazeera,"Economy, border row on agenda as India's parliament reopens",https://www.aljazeera.com/news/2020/09/economy-border-row-agenda-india-parliament-reopens-200914091649540.html,"Indian lawmakers have returned to Parliament after a five-month absence, with the government's response to the coronavirus pandemic, the nosediving economy and simmering tensions with China setting t… [+3195 chars]",2020-09-14T10:33:40Z
migrant,Al Jazeera English,Arwa Ibrahim,India reports six million COVID-19 cases: Live news,https://www.aljazeera.com/news/2020/9/28/india-reports-its-six-millionth-covid-19-case-live-news,<ul><li>India reports its six millionth case as it surges closer to the United States as the most-infected nation.</li><li>Greek officials announce the first coronavirus death of a migrant living in … [+3340 chars],2020-09-28T15:14:07Z
migrant,Al Jazeera English,Al Jazeera,Italian PM Conte to testify in Salvini refugee abuse case,https://www.aljazeera.com/news/2020/10/3/italian-premier-to-testify-in-salvinis-hearing-on-migrant-abuse,Italian Prime Minister Giuseppe Conte and other senior officials have been called to testify at the next pre-trial hearing on an abuse of power case against far-right opposition leader Matteo Salvini… [+3526 chars],2020-10-03T18:51:42Z
migrant,Al Jazeera English,Usaid Siddiqui,"India sees 100,000 COVID-19 deaths: What happened and what now?",https://www.aljazeera.com/news/2020/10/5/india-at-100000-deaths-what-experts-say,"India has crossed the grim milestone of 100,000 coronavirus deaths, the third-highest in the world behind only the United States and Brazil.
Despite the South Asian nations attempts to control the s… [+10362 chars]",2020-10-05T09:46:30Z
migrant,Al Jazeera English,Al Jazeera,Divided Europe seeks to overhaul defunct migration policies,https://www.aljazeera.com/news/2020/9/23/divided-europe-seeks-to-overhaul-defunct-migration-policies,"The European Unions executive has proposed overhauling the blocs broken migration and asylum rules, seeking to end years of feuds and bitterness over the hundreds of thousands of people fleeing wars … [+4361 chars]",2020-09-23T13:16:32Z
migrant,Al Jazeera English,Al Jazeera,How a high school dropout forced Nepal gov't to act on pandemic,https://www.aljazeera.com/news/2020/09/high-school-dropout-forced-nepal-gov-act-pandemic-200911070611287.html,"On a sunny June day in Nepal, hundreds of young people wearing face masks stood a metre apart behind the barbed-wire barricades and rows of riot police guarding the prime minister's residence, shouti… [+4862 chars]",2020-09-11T08:25:02Z
migrant,Al Jazeera English,Virginia Pietromarchi,"Italy’s Salvini goes on trial, accused of ‘kidnapping’ refugees",https://www.aljazeera.com/news/2020/10/3/hold-for-anealla-salvini-trial-to-begin,"Rome, Italy Matteo Salvini appears in court on Saturday on charges of kidnapping more than a hundred migrants, in an event that the Italian far-right leader has attempted to use to boost his dwindlin… [+3896 chars]",2020-10-03T06:23:26Z
migrant,Al Jazeera English,Al Jazeera,Refugees accuse Greece of pushing them back out to sea,https://www.aljazeera.com/news/2020/9/25/refugees-accuse-greece-of-pushing-them-back-out-to-sea,"Shortly after reaching the Greek island of Lesbos, a group of Afghan refugees and migrants say their hopes for a new life in Europe were cut short when Greek authorities rounded them up, mistreated t… [+7382 chars]",2020-09-25T14:18:10Z
migrant,Al Jazeera English,Marianna Karakoulaki,The Greek anti-fascist struggle is far from over,https://www.aljazeera.com/opinions/2020/10/10/the-greek-anti-fascist-struggle-is-far-from-over/,"Golden Dawn is a criminal organisation, declared an announcer from the top of the Court of Appeals in Athens on Wednesday, making public the landmark verdict in the biggest trial of self-professed fa… [+7093 chars]",2020-10-10T08:13:39Z
migrant,Al Jazeera English,Mansur Mirovalev,Nagorno-Karabakh: Historical grievances with dangerous potential,https://www.aljazeera.com/news/2020/9/28/will-azerbaijan-regain-its-separatist-armenia-backed-province,"The winner in this war seemed so obvious Azerbaijan, the oil-rich nation whose defence spending is much larger than the government budget of its impoverished adversary.
But for three decades and aga… [+7280 chars]",2020-09-28T12:37:57Z
migrant,Al Jazeera English,Al Jazeera,Science vs humanities in Australia’s university fee shake-up,https://www.aljazeera.com/news/2020/10/9/science-vs-humanities-in-australia-university-fee-shake-up,"Canberra, Australia University students enrolling in degrees in the humanities, law and economics in Australia will see their course fees more than double next year under legislation that has just pa… [+7847 chars]",2020-10-09T01:44:29Z
migrant,Al Jazeera English,Patrick Strickland,How a Greek reporter could help put neo-Nazis behind bars,https://www.aljazeera.com/features/2020/10/3/how-a-greek-reporter-could-help-put-neo-nazis-behind-bars,"Athens, Greece  When the package arrived at Scholiastiss offices in the Greek capital one morning in early 1988, the magazines editorial staff made up their minds without much hesitation: they would … [+31298 chars]",2020-10-03T10:58:24Z
migrant,Al Jazeera English,Al Jazeera,How a Bollywood star’s death case took a ‘misogynistic spiral’,https://www.aljazeera.com/features/2020/9/28/media-trial-of-rhea-chakraborty-and-bollywoods-moral-judgments,"Mumbai, India Bollywood actor Sushant Singh Rajput was found dead by apparent suicide at his Mumbai residence on June 14. What was a tragic end to a promising young stars career has turned into a med… [+9534 chars]",2020-09-28T04:21:35Z
migrant,Al Jazeera English,Nazia Kazi,Islamophobia in the US presidential election,https://www.aljazeera.com/indepth/opinion/islamophobia-presidential-election-200913150532735.html,"With Barack Obama's victory in the 2008 presidential election, many in the United States hoped for the retreat of Bush administration policies that criminalised the lives of Muslims. Yet Obama's two … [+11174 chars]",2020-09-14T18:28:14Z
migrant,Al Jazeera English,Al Jazeera,Greece reports first COVID-19 refugee death since pandemic began,https://www.aljazeera.com/news/2020/9/28/greece-reports-first-covid-19-refugee-death-since-pandemic-began,"A 61-year-old man from Afghanistan died of COVID-19 on Sunday, the first reported death of a refugee from the disease in Greece since the pandemic began there in late February, a government official … [+1229 chars]",2020-09-28T00:39:30Z
migrant,Al Jazeera English,Al Jazeera,Cyprus accuses Turkey of expanding 'illegal drilling' in East Med,https://www.aljazeera.com/news/2020/09/cyprus-accuses-turkey-expanding-illegal-drilling-east-med-200916091527393.html,"Cyprus has accused Turkey of extending ""illegal drilling"" in disputed Mediterranean waters but said it is ready to engage in dialogue with Ankara to resolve differences over exploration rights.
On T… [+2914 chars]",2020-09-16T10:11:23Z
migrant,Al Jazeera English,Al Jazeera,"Thousands of refugees sleep rough, without food, after Moria fire",https://www.aljazeera.com/news/2020/09/thousands-refugees-sleep-rough-food-moria-fire-200910085353994.html,"Thousands of refugees slept rough on the Greek island of Lesbos for a second night after a fire razed the country's largest camp to the ground, sending crowds fleeing but with nowhere to go.
Familie… [+2592 chars]",2020-09-10T09:43:34Z
migrant,Al Jazeera English,Al Jazeera,Gallup poll says world becoming less tolerant of migrants,https://www.aljazeera.com/news/2020/9/23/gallup-poll-says-world-becoming-less-tolerant-of-migrants,"The world is becoming less tolerant of migrants, according to a poll released on Wednesday as Europe prepared to unveil a new asylum plan in the wake of a blaze at an overcrowded camp in Greece that … [+2765 chars]",2020-09-23T08:38:08Z
migrant,Al Jazeera English,Hamid Dabashi,Siah Armajani (1939-2020): An artist of public happiness,https://www.aljazeera.com/indepth/opinion/siah-armajani-1939-2020-artist-public-happiness-200917120720265.html,"""The twilight zones today between art forms that were once quite distinct - painting and photography, architecture and sculpture - have been the locus of the most intriguing art produced in recent de… [+8156 chars]",2020-09-18T07:27:56Z
