Keyword,Source,Author,Title,URL,Text,Published,compound score,negative score,positive score,neutral score
refugees,Al Jazeera English,"Katy Fallon, Nazanin Froghi",Refugee journalists in Lesbos tell their own stories,https://www.aljazeera.com/news/2020/9/24/greece-refugee-journalists,"Lesbos, Greece In the wake of the fire that destroyed large parts of the Moria refugee camp, a group of former residents have been documenting the aftermath.
The students of ReFOCUS Media Labs, co-f… [+3959 chars]",2020-09-24T13:28:12Z,0.0,0.0,0.0,1.0
refugees,Al Jazeera English,Al Jazeera,Myanmar army probes 'wider patterns' of abuse against Rohingya,https://www.aljazeera.com/news/2020/09/myanmar-army-probes-wider-patterns-abuse-rohingya-200916074855469.html,"The Myanmar military has said it is investigating ""possible wider patterns of violations"" before and during a 2017 crackdown in Rakhine state that the United Nations has said was executed with genoci… [+6521 chars]",2020-09-16T09:07:34Z,-0.6369,0.344,0.0,0.656
refugees,Al Jazeera English,Al Jazeera,Italy softens harsh migration rules championed by Salvini,https://www.aljazeera.com/news/2020/10/6/italy-loosens-migration-rules-to-dismay-of-hardliner-salvini,"Italy has softened harsh rules penalising aid groups that bring undocumented migrants ashore and extended protection for refugees who risk persecution at home.
The so-called security decrees, which … [+3094 chars]",2020-10-06T19:31:00Z,-0.1779,0.261,0.198,0.541
refugees,Al Jazeera English,Al Jazeera,Italian PM Conte to testify in Salvini refugee abuse case,https://www.aljazeera.com/news/2020/10/3/italian-premier-to-testify-in-salvinis-hearing-on-migrant-abuse,Italian Prime Minister Giuseppe Conte and other senior officials have been called to testify at the next pre-trial hearing on an abuse of power case against far-right opposition leader Matteo Salvini… [+3526 chars],2020-10-03T18:51:42Z,-0.6369,0.318,0.0,0.682
refugees,Al Jazeera English,Al Jazeera,Rohingya accuse Bangladesh officers of abuse over hunger strike,https://www.aljazeera.com/news/2020/10/8/rohingya-accuse-bangladesh-officers-of-abuse-over-hunger-strike,Rohingya refugees banished to Bhashan Char island off Bangladeshs southwestern coast have alleged they were beaten by the countrys officials for holding a hunger strike to demand better living condit… [+5534 chars],2020-10-08T10:11:38Z,-0.8176,0.655,0.0,0.345
refugees,Al Jazeera English,Al Jazeera,Mexico deploys army on southern border to block migrant caravan,https://www.aljazeera.com/news/2020/10/3/mexico-deploys-army-on-southern-border-to-block-migrant-caravan,"Mexico on Friday ordered the military to deploy along its southern border to block a migrant caravan that President Andres Manuel Lopez Obrador suggested was linked to the United States election.
Th… [+2487 chars]",2020-10-03T08:25:56Z,-0.4404,0.244,0.0,0.756
refugees,Al Jazeera English,Al Jazeera,"‘Brawl’ at migrant camp in Bosnia kills two, injures 18",https://www.aljazeera.com/news/2020/10/1/brawl-among-migrants-in-bosnia-kills-2-injures-18,Two migrants were killed and 18 injured in a brawl in northwest Bosnia and Herzegovina as regional authorities emptied a migrant reception centre in the town of Bihac and moved hundreds to a camp 50 … [+1942 chars],2020-10-01T16:11:24Z,-0.5423,0.28,0.0,0.72
refugees,Al Jazeera English,John Psaropoulos,Rights groups blast Greece for asylum violations,https://www.aljazeera.com/news/2020/9/23/rights-groups-blast-greece-for-asylum-violations,"Athens, Greece Two aid organisations have asked the European Commission to launch infringement proceedings against Greece for violations of Europes asylum law.
Oxfam and WeMove Europe said a Greek a… [+5067 chars]",2020-09-23T20:44:20Z,-0.5267,0.362,0.0,0.638
refugees,Al Jazeera English,Zaheena Rasheed,Global coronavirus cases pass 30 million: Live news,https://www.aljazeera.com/news/2020/09/global-coronavirus-cases-pass-30-million-live-news-200917235058708.html,"<ul><li>Canada could lose its ability to manage the pandemic due to a spike in new COVID-19 cases, the country's top medical officer has said.</li><li>One in seven cases of COVID-19 reported to the W… [+3739 chars]",2020-09-18T01:32:01Z,0.0,0.0,0.0,1.0
refugees,Al Jazeera English,Gouri Sharma,German far-right figure ‘caught’ saying migrants could be gassed,https://www.aljazeera.com/news/2020/9/29/afd-sacks-official-who-reportedly-said-refugees-could-be-gassed,"Berlin, Germany A long-standing member of the far-right Alternative for Deutschland (AfD) political party has been sacked amid reports of his inflammatory comments in which he allegedly said refugees… [+2700 chars]",2020-09-29T15:40:08Z,0.0,0.0,0.0,1.0
refugees,Al Jazeera English,Al Jazeera,Eight migrants drown after forced off boat by smugglers,https://www.aljazeera.com/news/2020/10/5/at-least-eight-migrants-drown-12-missing-off-djibouti,"At least eight migrants have drowned and 12 are missing after human smugglers forced them off a boat near Djibouti, according to the International Organization for Migration (IOM).
Another 14 migran… [+1460 chars]",2020-10-05T07:34:43Z,-0.8442,0.603,0.0,0.397
refugees,Al Jazeera English,Al Jazeera,Palestinian leadership to reconsider relations with Arab League,https://www.aljazeera.com/news/2020/09/palestinian-leadership-reconsider-relations-arab-league-200914140153555.html,"Palestinian Prime Minister Mohammed Ishtayeh has said the government will present a recommendation to President Mahmoud Abbas to reconsider relations with the Arab League.
The move comes amid Palest… [+1939 chars]",2020-09-14T14:47:39Z,0.0,0.0,0.0,1.0
refugees,Al Jazeera English,Al Jazeera,Pope Francis: COVID-19 crisis a chance to ‘come out better’,https://www.aljazeera.com/news/2020/9/25/pope-to-un-covid-19-crisis-chance-to-come-out-better,"Pope Francis has urged world leaders to use the coronavirus emergency as an opportunity to reform the injustices of the global economy and the perverse logic of the nuclear deterrence doctrine.
In a… [+1466 chars]",2020-09-25T18:47:17Z,-0.4767,0.313,0.153,0.534
refugees,Al Jazeera English,Mia Swart,'There will be blood': Xenophobia in S Africa routine and lethal,https://www.aljazeera.com/news/2020/09/blood-xenophobia-africa-routine-lethal-200915051719107.html,"Sleeping was not an option for Syed in early September last year.
For three days and night, the Bangladeshi shop owner in central Johannesburg said he had to stand guard to protect his store during … [+6963 chars]",2020-09-17T10:44:41Z,0.0,0.0,0.0,1.0
refugees,Al Jazeera English,Al Jazeera,"Facebook does not profit from hate speech, says India chief",https://www.aljazeera.com/news/2020/09/facebook-profit-hate-speech-india-chief-200917065139150.html,"Facebook does not profit from hate speech, the tech giant's India chief said on Wednesday, rejecting allegations the social media giant failed to act on the issue over business concerns.
India is th… [+2236 chars]",2020-09-17T07:30:13Z,0.1511,0.179,0.224,0.597
refugees,Al Jazeera English,Al Jazeera,Red Cross warns of COVID-19 fuelling discrimination in Asia,https://www.aljazeera.com/news/2020/09/red-cross-warns-covid-19-fuelling-discrimination-asia-200917070446392.html,"A new survey has found that nearly one in two people in Indonesia, Malaysia, Myanmar and Pakistan blame specific groups for spreading COVID-19, including migrants.
Released on Thursday, the study by… [+2153 chars]",2020-09-17T09:10:18Z,-0.1027,0.149,0.0,0.851
refugees,Al Jazeera English,Al Jazeera,Palestine quits Arab League role in protest over Israel deals,https://www.aljazeera.com/news/2020/9/22/palestine-quits-arab-league-role-in-protest-over-israel-deals,"Palestine has quit its current chairmanship of Arab League meetings, the Palestinian foreign minister said on Tuesday, condemning as dishonourable any Arab agreement to establish formal ties with Isr… [+1959 chars]",2020-09-22T14:51:11Z,-0.25,0.182,0.0,0.818
refugees,Al Jazeera English,Al Jazeera,Jordan’s King Abdullah accepts prime minister’s resignation,https://www.aljazeera.com/news/2020/10/3/jordans-king-abdullah-accepts-resignation-of-prime-minister,Jordans King Abdullah II has accepted the resignation of Prime Minister Omar al-Razzaz but asked him to stay on in a caretaker capacity until he designates a successor to oversee parliamentary electi… [+1877 chars],2020-10-03T20:56:44Z,0.0258,0.232,0.242,0.526
refugees,Al Jazeera English,Al Jazeera,"Rouhani: UAE, Bahrain will bear 'consequences' of Israel deals",https://www.aljazeera.com/news/2020/09/rouhani-uae-bahrain-bear-consequences-israel-deals-200916101848630.html,"Iran's President Hassan Rouhani has said the United Arab Emirates and Bahrain would be responsible for any ""consequences"" resulting from their normalisation of relations with Tehran's archrival, Isra… [+2269 chars]",2020-09-16T11:09:13Z,0.0,0.0,0.0,1.0
refugees,Al Jazeera English,Al Jazeera,Palestine quits Arab League role in protest over Israel deals,https://www.aljazeera.com/news/2020/09/palestine-quits-arab-league-role-protest-israel-deals-200922120847668.html,"Palestine has quit its current chairmanship of Arab League meetings, the Palestinian foreign minister said on Tuesday, condemning as dishonourable any Arab agreement to establish formal ties with Isr… [+1965 chars]",2020-09-22T12:21:31Z,-0.25,0.182,0.0,0.818
refugees,Al Jazeera English,Al Jazeera,Jordan king swears in new gov’t headed by PM Bisher al-Khaswaneh,https://www.aljazeera.com/news/2020/10/12/jordans-king-abdullah-swears-in-new-govt-headed-by-kasawneh,Jordans King Abdullah II has sworn in a new government led by Prime Minister Bisher al-Khaswaneh that is facing an uphill task to revive growth in an economy facing a sharp economic crisis aggravated… [+1952 chars],2020-10-12T15:10:41Z,0.0516,0.0,0.107,0.893
refugees,Al Jazeera English,Ali Adam,Palestinian Intifada: How Israel orchestrated a bloody takeover,https://www.aljazeera.com/news/2020/9/28/palestinian-intifada-20-years-later-israeli-occupation-continues,Gaza City The second Intifada commonly referred to by Palestinians as al-Aqsa Intifada began after then-Israeli opposition leader Ariel Sharon sparked the uprising when he stormed al-Aqsa Mosque comp… [+9723 chars],2020-09-28T20:22:50Z,-0.4404,0.326,0.0,0.674
refugees,Al Jazeera English,Haidar Eid,The Palestinians need an alternative vision,https://www.aljazeera.com/opinions/2020/10/3/palestinians-need-an-alternative-vision/,"Many articles have already been written criticising the normalisation deal signed between the United Arab Emirates (UAE), Bahrain and Israel and calling it a stab in the back of the Palestinian peopl… [+7049 chars]",2020-10-03T18:55:22Z,0.25,0.0,0.286,0.714
refugees,Al Jazeera English,Katy Fallon,Greece braces for historic verdict on far-right Golden Dawn group,https://www.aljazeera.com/news/2020/10/6/greece-braces-for-historic-verdict-on-far-right-golden-dawn-group,"Athens, Greece Pavlos Fyssas, a 34-year-old rapper and anti-racism campaigner known as Killa P, was stabbed to death just after midnight on September 18, 2013, in Athens.
More than seven years later… [+6645 chars]",2020-10-06T10:07:52Z,0.1531,0.0,0.151,0.849
refugees,Al Jazeera English,Al Jazeera,"At UN, Qatar emir questions world inaction on Israeli occupation",https://www.aljazeera.com/news/2020/9/22/at-un-qatar-emir-questions-world-inaction-on-israeli-occupation,"Qatar Emir Sheikh Tamim bin Hamad Al Thani has questioned the credibility of the international community as it stands by, unable to take any effective action to confront Israeli intransigence and its… [+2800 chars]",2020-09-22T20:35:27Z,-0.25,0.182,0.0,0.818
refugees,Al Jazeera English,Al Jazeera,"Attackers kill 25 displaced civilians in Burkina Faso, UN says",https://www.aljazeera.com/news/2020/10/7/attack-in-burkina-leaves-25-displaced-people-killed-un,"A convoy carrying dozens of displaced civilians hoping to return to their homes in central-northern Burkina Faso was ambushed by armed assailants, who then separated the men from the group and killed… [+2582 chars]",2020-10-07T19:44:10Z,-0.8555,0.512,0.0,0.488
refugees,Al Jazeera English,Robin Forestier-Walker,Nagorno-Karabakh: Information war and competing media narratives,https://www.aljazeera.com/news/2020/9/28/nagorno-karabakh-information-war-and-competing-media-narratives,"Tbilisi, Georgia Nagorno-Karabakh is today uniquely isolated in more ways than one.
From Azerbaijan, it should easily be reachable from the capital, Baku. But there is no way through the armies stat… [+3718 chars]",2020-09-28T20:32:07Z,-0.5994,0.394,0.0,0.606
refugees,Al Jazeera English,Al Jazeera,Thousands flee amid fighting between Taliban and Afghan forces,https://www.aljazeera.com/news/2020/10/14/tens-of-thousands-flee-taliban-offensive-in-southern-afghanistan,"Tens of thousands of people in southern Afghanistan have fled their homes following days of heavy fighting between the Taliban and security forces, officials said, as violence continues to soar despi… [+2868 chars]",2020-10-14T10:25:27Z,-0.3612,0.238,0.0,0.762
refugees,Al Jazeera English,Al Jazeera,Court rules Trump can end temporary legal status for four nations,https://www.aljazeera.com/news/2020/09/court-rules-trump-temporary-legal-status-nations-200914222405614.html,"The administration of United States President Donald Trump can end humanitarian protections that have allowed hundreds of thousands of people from El Salvador, Nicaragua, Haiti and Sudan to remain in… [+3897 chars]",2020-09-14T23:54:53Z,0.128,0.0,0.13,0.87
refugees,Al Jazeera English,Al Jazeera,Al Jazeera condemns AJ+ FARA registration order in US,https://www.aljazeera.com/news/2020/09/al-jazeera-condemns-aj-fara-registration-order-200916173319684.html,"Al Jazeera has strongly condemned a recent US Department of Justice (DOJ) order that forces AJ+ to register as a foreign agent, saying it appears the designation was a precondition of the United Arab… [+2788 chars]",2020-09-16T18:07:36Z,-0.5106,0.292,0.0,0.708
refugees,Al Jazeera English,Al Jazeera,"At UN, Qatar emir questions world inaction on Israeli occupation",https://www.aljazeera.com/news/2020/09/qatar-emir-questions-world-inaction-israeli-occupation-200922194045999.html,"Qatar Emir Sheikh Tamim bin Hamad Al Thani has questioned the credibility of the international community as it ""stands by, unable to take any effective action to confront Israeli intransigence and it… [+2824 chars]",2020-09-22T19:57:53Z,-0.25,0.182,0.0,0.818
refugees,Al Jazeera English,Al Jazeera,Sudan to strike peace with rebels after decades of war,https://www.aljazeera.com/news/2020/10/1/sudan-to-strike-peace-with-rebels-after-decades-of-war,"Sudans government and rebels are set to sign a landmark peace deal in a bid to end decades of war in which hundreds of thousands have died an historic achievement if it holds.
Ending Sudans internal… [+3652 chars]",2020-10-01T15:28:07Z,-0.4019,0.431,0.21,0.359
refugees,Al Jazeera English,Patrick Strickland,How a Greek reporter could help put neo-Nazis behind bars,https://www.aljazeera.com/features/2020/10/3/how-a-greek-reporter-could-help-put-neo-nazis-behind-bars,"Athens, Greece  When the package arrived at Scholiastiss offices in the Greek capital one morning in early 1988, the magazines editorial staff made up their minds without much hesitation: they would … [+31298 chars]",2020-10-03T10:58:24Z,0.4019,0.0,0.252,0.748
refugees,Al Jazeera English,Al Jazeera,Qatar rules out normalising relations with Israel,https://www.aljazeera.com/news/2020/09/qatar-rules-normalising-relations-israel-200915113549077.html,"Normalising relations with Israel ""can't be the answer"" to the Israeli-Palestinian conflict, a Qatari official has said, adding that Doha will not join other Gulf Arab states in establishing diplomat… [+4814 chars]",2020-09-15T13:03:37Z,0.0,0.0,0.0,1.0
refugees,Al Jazeera English,Katy Fallon,Greek court to decide fate of fascist Golden Dawn group,https://www.aljazeera.com/news/2020/10/7/greek-court-to-decide-fate-of-fascist-golden-dawn-group,"Athens, Greece  A five-and-a-half-year trial of the far-right Golden Dawn group draws to a close on Wednesday, with a panel of three judges at the court of appeals in Athens preparing to issue its ve… [+3881 chars]",2020-10-07T05:57:47Z,-0.5574,0.286,0.0,0.714
refugees,Al Jazeera English,Moira Lavelle,"After Moria fire, 'I don't have hope for myself or my baby'",https://www.aljazeera.com/news/2020/09/moria-fire-don-hope-baby-200915075948174.html,"Lesbos, Greece - Homaira Sakha was in her container when she first saw the fire in an adjacent forest. The inferno that reduced Moria to embers started small at about 12:30am on Wednesday, but quickl… [+4118 chars]",2020-09-15T09:40:31Z,-0.5867,0.325,0.0,0.675
refugees,Al Jazeera English,Jan Egeland,The little talked about side-effects of COVID-19,https://www.aljazeera.com/opinions/2020/9/25/the-little-talked-about-side-effects-of-covid-19/,"In March, we predicted that the 70 million people fleeing violence and persecution across the world would be hit hardest by the coronavirus pandemic. I underestimated the impact of the disease. Its k… [+5335 chars]",2020-09-25T07:53:03Z,0.0,0.0,0.0,1.0
refugees,Al Jazeera English,Mia Swart,‘I was chained for 11 months’: Living with depression in Liberia,https://www.aljazeera.com/features/2020/10/10/chained-for-11-months,"Benjamin Ballah was born on a farm in the north of Liberia, one of four children. Growing up, he went through bouts of depression that his parents and grandmother did not know how to cope with. These… [+5195 chars]",2020-10-10T10:05:52Z,-0.5719,0.27,0.0,0.73
refugees,Al Jazeera English,Al Jazeera,"Israel bombs Gaza after rocket fire as UAE, Bahrain signed deals",https://www.aljazeera.com/news/2020/09/israel-bombs-gaza-rocket-fire-uae-bahrain-signed-deals-200916064518070.html,"The Israeli military has carried out a series of air raids on the besieged Gaza Strip overnight on Wednesday, causing damage to property, Palestinian media reported.
According to Wafa, the official … [+3999 chars]",2020-09-16T07:45:55Z,-0.34,0.194,0.0,0.806
refugees,Al Jazeera English,Al Jazeera,"Paul Rusesabagina admits backing rebels, denies violence",https://www.aljazeera.com/news/2020/9/25/hotel-rwanda-hero-admits-forming-armed-group-behind-attacks,"Paul Rusesabagina, portrayed in a 2004 Hollywood movie as a hero who helped save Tutsis during the Rwandan genocide, has admitted to a Kigali court that he formed an armed group but denied he support… [+4091 chars]",2020-09-25T12:34:47Z,-0.7506,0.621,0.236,0.143
refugees,Al Jazeera English,Samira Shackle,‘Alarming’: Experts slam UK plan for offshore asylum centre,https://www.aljazeera.com/features/2020/10/5/uk-offshore,"London, United Kingdom Ascension Island is an isolated volcanic island that sits in the South Atlantic Ocean, around 2,300km from the coast of Brazil.
Along with Saint Helena and Tristan da Cunha, i… [+5448 chars]",2020-10-05T14:56:09Z,-0.3818,0.245,0.0,0.755
refugees,Al Jazeera English,Al Jazeera,EU prepares for standoff over Turkish sanctions,https://www.aljazeera.com/news/2020/9/30/eu-prepares-for-standoff-over-turkish-sanctions,"Athens, Greece European Union leaders face a difficult balancing act over the EU-Turkey relationship, on the eve of a crucial summit.
The EU Council meeting, with the eastern Mediterranean dispute h… [+6540 chars]",2020-09-30T15:25:23Z,0.0,0.0,0.0,1.0
refugees,Al Jazeera English,Marianna Karakoulaki,The Greek anti-fascist struggle is far from over,https://www.aljazeera.com/opinions/2020/10/10/the-greek-anti-fascist-struggle-is-far-from-over/,"Golden Dawn is a criminal organisation, declared an announcer from the top of the Court of Appeals in Athens on Wednesday, making public the landmark verdict in the biggest trial of self-professed fa… [+7093 chars]",2020-10-10T08:13:39Z,-0.3182,0.247,0.0,0.753
refugees,Al Jazeera English,William Roberts,Trump aims for an upset over Biden in Minnesota,https://www.aljazeera.com/news/2020/09/trump-aims-upset-biden-minnesota-200917180343769.html,"President Donald Trump and Democratic challenger Joe Biden are both going to the fabled Iron Range mining region of Minnesota on Friday for duelling campaign events.
President Trump will appear at a… [+6355 chars]",2020-09-18T00:34:35Z,-0.3818,0.245,0.0,0.755
refugees,Al Jazeera English,Denijal Jegic,Trump’s Kosovo-Serbia normalisation deal is all about Israel,https://www.aljazeera.com/opinions/2020/9/28/trumps-kosovo-serbia-normalisation-deal-is-all-about-israel/,"On September 4, after years of unsuccessful negotiations, Kosovar Prime Minister Avdullah Hoti and Serbian President Aleksandar Vucic signed an economic normalisation deal at a ceremony hosted by Pre… [+7786 chars]",2020-09-28T07:56:37Z,0.0,0.0,0.0,1.0
refugees,Al Jazeera English,John Psaropoulos,EU prepares for standoff over Turkish sanctions,https://www.aljazeera.com/news/2020/10/1/eu-prepares-for-standoff-over-turkish-sanctions,"Athens, Greece European Union leaders face a difficult balancing act over the EU-Turkey relationship.
The EU Council meeting, with the eastern Mediterranean dispute high on the agenda, takes place o… [+6763 chars]",2020-10-01T09:00:23Z,0.0,0.0,0.0,1.0
refugees,Al Jazeera English,Per Christian Selmer-Anderssen,A European odyssey: A portrait of Europe during the pandemic,https://www.aljazeera.com/features/2020/9/28/a-european-odyssey-a-portrait-of-europe-during-the-pandemic,"The main road leading to the Sicilian town of Cassibile is flanked by derelict houses. In days gone by, these stood as elegant mansions with arched entrances and large windows, but during the second … [+28993 chars]",2020-09-28T07:51:05Z,0.0,0.0,0.0,1.0
refugees,Al Jazeera English,Al Jazeera,Explainer: Where do Arab states stand on normalising Israel ties?,https://www.aljazeera.com/news/2020/9/22/explainer-where-do-arab-states-stand-on-normalising-israel-ties,"The United Arab Emirates (UAE) and Bahrain are the latest countries in the Arab region to formally establish diplomatic ties with Israel in deals brokered by the United States.
The Palestinians have… [+8473 chars]",2020-09-22T14:22:14Z,0.0,0.0,0.0,1.0
refugees,Al Jazeera English,Al Jazeera,Explainer: Where do Arab states stand on normalising Israel ties?,https://www.aljazeera.com/news/2020/09/explainer-arab-states-stand-normalising-israel-ties-200922105821515.html,"The United Arab Emirates (UAE) and Bahrain are the latest countries in the Arab region to formally establish diplomatic ties with Israel in deals brokered by the United States.
The Palestinians have… [+8544 chars]",2020-09-22T14:22:14Z,0.0,0.0,0.0,1.0
refugees,Al Jazeera English,Greta Moran,Is the climate crisis creating a mental health crisis?,https://www.aljazeera.com/indepth/features/climate-crisis-creating-mental-health-crisis-200416131647602.html,"Psychiatrist Dr Lise Van Susteren did not expect to be allowed into a public hearing of the Federal Energy Regulatory Commission (FERC), the agency responsible for regulating interstate energy transm… [+18131 chars]",2020-09-14T05:49:51Z,-0.7906,0.532,0.143,0.325
refugees,Al Jazeera English,Patrick Strickland,Antifa and America’s revamped Red Scare,https://www.aljazeera.com/features/2020/9/29/antifa-hysteria-americas-revamped-red-scare,"As the wildfires hit Molalla, Oregon, in early September, 29-year-old independent journalist Alissa Azar crouched in the weeds by the side of a gravel road. She angled her camera, searching for a sho… [+20890 chars]",2020-09-29T11:09:35Z,-0.4939,0.39,0.0,0.61
refugees,Al Jazeera English,Creede Newton,Advocates condemn Trump's 'tragically low' planned US refugee cap,https://www.aljazeera.com/news/2020/10/2/refugee-advocates-decry-trumps-tragically-low-refugee-target,"Refugee advocacy organisations have condemned the Trump administrations proposed drastic limits on refugee resettlement quotas, saying the move is an attack on legal migration, one of the founding te… [+3388 chars]",2020-10-02T01:08:37Z,-0.8126,0.583,0.0,0.417
refugees,Al Jazeera English,Al Jazeera,Gallup poll says world becoming less tolerant of migrants,https://www.aljazeera.com/news/2020/9/23/gallup-poll-says-world-becoming-less-tolerant-of-migrants,"The world is becoming less tolerant of migrants, according to a poll released on Wednesday as Europe prepared to unveil a new asylum plan in the wake of a blaze at an overcrowded camp in Greece that … [+2765 chars]",2020-09-23T08:38:08Z,0.204,0.0,0.184,0.816
refugees,Al Jazeera English,Al Jazeera,Cyprus accuses Turkey of expanding 'illegal drilling' in East Med,https://www.aljazeera.com/news/2020/09/cyprus-accuses-turkey-expanding-illegal-drilling-east-med-200916091527393.html,"Cyprus has accused Turkey of extending ""illegal drilling"" in disputed Mediterranean waters but said it is ready to engage in dialogue with Ankara to resolve differences over exploration rights.
On T… [+2914 chars]",2020-09-16T10:11:23Z,-0.7184,0.429,0.0,0.571
refugees,Al Jazeera English,"Steve Chaggaris, William Roberts",Trump sets refugee cap at record low: US election live updates,https://www.aljazeera.com/news/2020/10/1/us-election-live-updates-trump-sets-refugee-cap-at-record-low,"<ul><li>Trump and Biden are fundraising and off the campaign trail today.</li><li>Mike Pence campaigns in the battleground state of Iowa.</li><li>Trumps Supreme Court pick, Amy Coney Barrett, continu… [+2329 chars]",2020-10-01T15:10:22Z,-0.2732,0.174,0.0,0.826
