Keyword,Source,Author,Title,URL,Text,Published,compound score,negative score,positive score,neutral score
refugees,NBC News,Victoria Namkung,First Asian American Pulitzer board member on how his new role transcends literature,https://www.nbcnews.com/news/asian-america/viet-thanh-nguyen-1st-asian-american-pulitzer-board-member-how-n1240844,"Viet Thanh Nguyen's life changed when he won the Pulitzer Prize for fiction in 2016 for his startling debut novel, ""The Sympathizer."" In recent years, Nguyen, the hypervisible Aerol Arnold Chair of E… [+6254 chars]",2020-09-29T16:03:01Z,0.0,0.0,0.0,1.0
refugees,NBC News,Chuck Todd and Mark Murray and Carrie Dann and Melissa Holzberg,Biden outspent Trump $153 million to $57 million on ads in a single month,https://www.nbcnews.com/politics/meet-the-press/biden-outspent-trump-153-million-57-million-ads-single-month-n1241681,"WASHINGTON Weve told you how Joe Biden passed President Trump in the money race. Now lets show you how Biden is spending his money and how Trump isnt, at least over the advertising airwaves.
In the … [+4688 chars]",2020-10-01T12:58:00Z,0.0,0.0,0.0,1.0
refugees,NBC News,Alasdair Lane and Adela Suliman,'A crisis of humanity': Migrants take on treacherous journey from France to Britain,https://www.nbcnews.com/news/world/crisis-humanity-migrants-take-treacherous-journey-france-britain-n1239652,"LONDON Clad head to toe in newly bought all-black clothes that held no scent, as instructed by the smugglers who bundled him into the back of a truck, this is how Md Mominul Hamid's life in Britain b… [+7182 chars]",2020-09-20T08:30:23Z,-0.6249,0.255,0.0,0.745
refugees,NBC News,Kimmy Yam,Kamala Harris and a history of trying to define 'Asian American',https://www.nbcnews.com/news/asian-america/kamala-harris-history-trying-define-asian-american-n1242200,"The identity of Sen. Kamala Harris, who will debate Vice President Mike Pence on Wednesday, is part of a long discussion of who gets to be considered Asian American and who is too often left out of t… [+10950 chars]",2020-10-06T19:40:44Z,0.0,0.0,0.0,1.0
refugees,NBC News,Janelle Griffith,Colorado officer who pointed gun at doctor's head on his own property suspended 1 week,https://www.nbcnews.com/news/us-news/colorado-officer-who-pointed-gun-doctor-s-head-his-own-n1240336,"A police officer in Aurora, Colorado, who pointed a gun at an Indian American doctor trying to park at a refugee center he owns and operates has been suspended for 40 hours without pay.
Officer Just… [+6079 chars]",2020-09-17T21:26:00Z,-0.6705,0.314,0.0,0.686
refugees,NBC News,NBCNews.com,Pompeo defends Trump administration's record on human rights in China,https://www.nbcnews.com/video/pompeo-defends-trump-administration-s-record-on-human-rights-in-china-92845637903,,2020-09-30T13:07:24Z,0.0,0.0,0.0,1.0
refugees,NBC News,Suzanne Gamboa and Carmen Sesin and Marianna Sotomayor,"Puerto Rican voters, battered by crisis, could be pivotal for Biden in Florida",https://www.nbcnews.com/news/latino/puerto-rican-voters-battered-crisis-could-be-pivotal-biden-florida-n1240145,"MIAMI Jimmy Torres, who hosts the Boricua Action Network radio program in Kissimmee, Florida, said hes voting for Joe Biden because under the Trump administration, the country with the largest milita… [+7102 chars]",2020-09-15T18:39:24Z,-0.6249,0.255,0.0,0.745
refugees,NBC News,Chuck Todd and Mark Murray and Carrie Dann and Melissa Holzberg,Trump's 'rigged' election talk is more dangerous than it was four years ago,https://www.nbcnews.com/politics/meet-the-press/trump-s-rigged-election-talk-more-dangerous-it-was-four-n1240113,"WASHINGTON President Donald Trump has talked about the upcoming presidential election in conspiratorial and often violent ways, as liberal New York Times columnist Jamelle Bouie notes.
I am going to… [+8294 chars]",2020-09-15T12:37:37Z,-0.5256,0.22,0.0,0.78
refugees,NBC News,Suzanne Gamboa,"Progressive groups mobilize Latino voters in N.C. by tapping culture, youth",https://www.nbcnews.com/news/latino/progressive-groups-mobilize-latino-voters-north-carolina-tapping-culture-youth-n1240297,"In North Carolina, 2020 election mailers sent by progressive political groups to Latinos have become hot collectors' items.
The mailers were created by four political groups trying to bolster Latino… [+9221 chars]",2020-09-17T18:38:39Z,0.0,0.0,0.0,1.0
refugees,MSNBC,MSNBC.com,"Cornell Belcher on the president's message: 'Without racism, the emperor has no clothes'",https://www.msnbc.com/deadline-white-house/watch/cornell-belcher-on-the-president-s-message-without-racism-the-emperor-has-no-clothes-92968517602,,2020-10-01T22:56:11Z,0.2718,0.133,0.2,0.667
refugees,MSNBC,MSNBC.com,Trump allies voice concern after debate performance,https://www.msnbc.com/way-too-early/watch/trump-allies-voice-concern-after-debate-performance-92918853914,,2020-10-01T10:25:39Z,0.0,0.0,0.0,1.0
refugees,Fox News,Danielle Wallace,"German police officers suspended over pro-Nazi photos, doctored images of refugees in gas chambers",https://www.foxnews.com/world/german-police-suspended-adolf-hitler-nazi-refugees-gas-chambers,At least 29 police officers in western Germany have been suspended pending an ongoing investigation for allegedly exchanging photos of former Nazi leader Adolf Hitler and doctored images depicting re… [+2474 chars],2020-09-17T18:21:01Z,-0.4767,0.193,0.0,0.807
refugees,Fox News,Maxim Lott,Refugees from socialist countries warn Americans: Don't let it happen here,https://www.foxnews.com/politics/refugees-from-socialism-warn-americans-dont-let-it-happen-here,"One of the most memorable moments from the Republican National Convention came when Cuban-born Maximo Alvarez cautioned Americans against creeping socialism. 
“I’ve seen movements like this before,”… [+8213 chars]",2020-09-15T19:07:23Z,-0.1027,0.123,0.0,0.877
refugees,Fox News,Caitlin McFall,"Biden has immigrants, advocates hoping for reversal of Trump's border policies",https://www.foxnews.com/politics/biden-has-immigrants-advocates-hoping-for-reversal-of-trumps-border-policies,"Immigration advocates and even some Central Americans mulling entering the U.S. are reportedly rooting hard for a Joe Biden victory in November, encouraged by the Democratic nominee's pledge to disma… [+2621 chars]",2020-10-10T05:34:33Z,0.4215,0.0,0.219,0.781
refugees,Fox News,Audrey Conklin,"In Minnesota Biden would open 'flood gates' to terrorism, Trump says",https://www.foxnews.com/politics/minnesota-trump-biden-terrorism,"During a rally in Duluth, Minn., on Wednesday, President Trump said that Democratic presidential nominee Joe Biden would turn Minnesota into a ""refugee camp"" and open ""the flood gates to radical Isla… [+3168 chars]",2020-10-01T15:08:33Z,-0.6808,0.315,0.0,0.685
refugees,Fox News,Morgan Phillips,Trump says Joe Biden 'will turn Minnesota into a refugee camp',https://www.foxnews.com/politics/trump-rally-minnesota,"President Trump told a crowd of supporters in Bemidji, Minnesota that Joe Biden ""will turn Minnesota into a refugee camp.""
The president hit refugees, in particular Somali nationals, who committed c… [+5123 chars]",2020-09-19T00:23:39Z,0.0,0.0,0.0,1.0
refugees,Fox News,Audrey Conklin,Trump plans visit to Minnesota next week — what's at stake,https://www.foxnews.com/politics/trump-minnesota-duluth-visit,"President Trump is planning a visit next week to Minnesota, a state he lost to former 2016 Democratic presidential candidate Hillary Clinton in 2016.
Trump is expected to hold a rally at Duluth Inte… [+2390 chars]",2020-09-26T20:39:54Z,0.0,0.0,0.0,1.0
refugees,Fox News,Danielle Wallace,"Explosion kills British, Australian WWII bomb specialists in Solomon Islands",https://www.foxnews.com/world/wwii-bomb-detonators-solomon-islands-explosion,"Two men working to locate undetonated World War II bombs died in an explosion in the Solomon Islands on Sunday. 
Stephen ""Luke"" Atkinson, a dual citizen of the United Kingdom and New Zealand, and hi… [+2549 chars]",2020-09-21T16:15:40Z,-0.7717,0.456,0.0,0.544
refugees,Fox News,Benjamin Watson,"NFL Star Benjamin Watson: Nigeria needs justice, too, and Americans must help",https://www.foxnews.com/opinion/nfl-benjamin-watson-nigeria,"The horrific news shook our souls though we were 7,000 miles and a world away. The hashtag #BringBackOurGirls flooded our timelines, garnering global attention and turning our eyes and hearts to the … [+5282 chars]",2020-09-16T19:30:58Z,0.7269,0.0,0.379,0.621
refugees,Fox News,Marisa Schultz,House GOP China task force releases report on combating Chinese Communist Party: 'The U.S. must act decisively',https://www.foxnews.com/politics/house-gop-china-task-force-releases-report-on-turning-around-failed-strategy,"House Republicans Wednesday will release the results of their monthslong probe into the Chinese Communist Party (CCP) and how the U.S. can turnaround a ""failed"" engagement strategy that has put Ameri… [+4217 chars]",2020-09-30T09:03:25Z,0.4019,0.0,0.144,0.856
refugees,Fox News,"Reuven Fenton , Bruce Golding",Anthony Weiner piecing together shattered life as CEO of broken glass factory,https://www.foxnews.com/politics/anthony-weiner-piecing-together-shattered-life-as-ceo-of-broken-glass-factory,"Disgraced ex-pol Anthony Weiner is trying to rebuild his shattered life — by running a company that makes countertops out of broken glass!
The former Democratic congressman — whose serial sexting co… [+5322 chars]",2020-09-14T19:38:42Z,-0.7351,0.383,0.0,0.617
refugees,Fox News,Fox News,"Hurricane Sally strengthens to Category 2 storm, expect life-threatening flooding: officials",https://www.foxnews.com/us/hurricane-sally-strengthens-to-category-2-storm-expect-historic-life-threatening-flooding-officials,Good morning and welcome to Fox News. Here's what you need to know as you start your day ...Hurricane Sally expected to produce historic life-threatening floodingHurricane Sally has strengthened into… [+5689 chars],2020-09-16T09:38:18Z,0.4588,0.0,0.25,0.75
refugees,Fox News,Hollie McKay,"How US can help China's Uighurs, who suffer disappearances, forced abortions, other atrocities",https://www.foxnews.com/world/uighurs-china-united-states-human-rights,"For Ziba Murat, waiting for word of what became of her ailing mother after she abruptly disappeared in the Muslim-majority Xinjian region of northwestern China following a fractured phone conversatio… [+10268 chars]",2020-09-17T19:07:01Z,-0.5859,0.339,0.141,0.521
refugees,Fox News,Hollie McKay,GOP report claims Hunter Biden paid women linked to ‘prostitution or human trafficking ring’,https://www.foxnews.com/politics/hunter-biden-gop-report-claims-prostitution,Among the deluge of explosive claims tucked inside the new Senate Republican report about Hunter Biden’s business dealings is the allegation that the Democratic presidential nominee’s son has a histo… [+10614 chars],2020-09-25T20:32:42Z,0.0,0.0,0.0,1.0
refugees,Fox News,Hollie McKay,Death toll soars as Armenia-Azerbaijan conflict escalates: 'This is a fight against jihadists',https://www.foxnews.com/world/death-toll-soars-armenia-azerbaijan-conflict-escalates,"Ever since tensions flared up again late last month, everything from rockets to missiles to munitions continues to crack in and around Nagorno-Karabakh -- the hotly fought-after land parcel bordering… [+11225 chars]",2020-10-09T16:12:12Z,-0.8316,0.494,0.0,0.506
refugees,CBS News,CBS News,"Trump says Biden will flood Minnesota with ""refugees""",https://www.cbsnews.com/news/trump-tells-supporters-biden-will-flood-minnesota-with-refugees/,"President Trump on Friday night warned his crowd in Bemidji, Minnesota, that former Vice President Joe Biden would flood the state with refugees from the world's most dangerous countries. Mr. Trump m… [+1587 chars]",2020-09-19T05:22:58Z,0.0,0.0,0.0,1.0
refugees,CBS News,Camilo Montoya-Galvez,"Trump administration sets refugee cap at 15,000, a record low",https://www.cbsnews.com/news/trump-administration-refugee-resettlement-cap-historic-low/,"The Trump administration said it is planning to take in no more than 15,000 refugees in fiscal year 2021, slashing resettlement spots to yet another historic low as millions of people around the worl… [+4240 chars]",2020-10-01T15:15:15Z,-0.2732,0.208,0.0,0.792
refugees,CBS News,Caitlin O'Kane,"Facebook removes Trump ads about Biden, COVID-19 and refugees",https://www.cbsnews.com/news/facebook-removes-trump-ads-refugees-covid-19/,"Facebook has removed 216 Trump ads that claimed ""despite the health risks [of] COVID-19 Joe Biden will increase refugees"" from Somalia, Syria and Yemen. 
""We rejected these ads because we don't allo… [+2853 chars]",2020-10-01T19:30:27Z,0.0,0.0,0.0,1.0
refugees,CBS News,CBS News,Trump ramps up race rhetoric and attacks refugees at Minnesota rally,https://www.cbsnews.com/video/trump-ramps-up-race-rhetoric-and-attacks-refugees-at-minnesota-rally/,,2020-10-01T22:58:55Z,-0.4404,0.225,0.0,0.775
refugees,CBS News,CBS News,"10/11/2020: Genetic Revolution, The Youngest Refugees, Vision of Music",https://www.cbsnews.com/video/10112020-genetic-revolution-the-youngest-refugees-vision-of-music/,,2020-10-12T03:00:34Z,0.25,0.0,0.2,0.8
refugees,CBS News,CBS News,Britain considers holding refugees and asylum-seekers aboard ferries after record one-month influx,https://www.cbsnews.com/video/british-government-considers-housing-asylum-seekers/,"Watch CBSN Live
Copyright © 2020 CBS Interactive Inc. All rights reserved.",2020-10-02T13:17:46Z,0.0258,0.0,0.091,0.909
refugees,CBS News,Lesley Stahl,Sesame and the IRC join forces to help Syrian refugee children,https://www.cbsnews.com/news/sesame-street-international-rescue-committee-help-syria-refugee-children-60-minutes-2020-10-11/,"There are more people living as refugees around the world today than at any time since World War II. And with conflicts dragging on for years, being a refugee now often means not going home for decad… [+11700 chars]",2020-10-12T00:44:24Z,0.5994,0.0,0.353,0.647
refugees,CBS News,CBS News,Emotional coping tactics for young kids,https://www.cbsnews.com/news/sesame-street-teaching-children-refugees-from-syria-to-cope-with-emotions-60-minutes-2020-10-11/,"With the average length of refugee displacement approaching 20 years, non-governmental organizations (NGOs) have had to rethink their approaches to providing services for this vulnerable population. … [+2524 chars]",2020-10-12T00:41:53Z,0.1531,0.0,0.242,0.758
refugees,CBS News,George Baghdadi,"As country crumbles, Syrians face ""terrifying"" option of refugee life",https://www.cbsnews.com/news/syria-war-refugees-difficult-decision-as-economy-collapses-under-civil-war-and-sanctions/,"Damascus — Saleem sees no hope for his future in Syria. At just 25, he's made a good living as a singer at a restaurant in the capital's old town. Now he's saving whatever he can to finance what he e… [+4324 chars]",2020-09-17T09:32:30Z,0.0,0.0,0.0,1.0
refugees,CBS News,Scott Pelley,Nadia Murad's mission to hold ISIS accountable,https://www.cbsnews.com/news/nobel-peace-prize-recipient-nadia-murad-amal-clooney-isis-court-60-minutes-2020-10-04/,"She wore a scarf in our first interview because she did not want you to know her. She was a humble 21-year-old from a poor farm family. Her dream was to own a hair salon in her village of nearly 2,00… [+11042 chars]",2020-10-05T00:30:42Z,0.0,0.0,0.0,1.0
refugees,CBS News,Aaron Navarro,3 million voters registered after 2016 — Dems now hope to flip Texas,https://www.cbsnews.com/news/texas-election-democrats-registered-after-2016/,"Texas has seen one of the highest upticks in newly registered voters in the nation,with over 3 million people who registered after the 2016 election. 
That means about 1 in every 5 voters in Texas i… [+6817 chars]",2020-10-13T13:22:45Z,0.4404,0.0,0.225,0.775
refugees,CBS News,George Baghdadi,Syria may only be counting 1.25% of its actual coronavirus deaths,https://www.cbsnews.com/news/coronavirus-in-syria-deaths-under-counted-amid-civil-war-bashar-assad-regime-blames-sanctions/,"A staff member at Al-Assad University Hospital in the Syrian capital Damascus runs blood tests to screen for COVID-19 infections, April 15, 2020. Behind her hang portraits of President Bashar Assad (… [+6813 chars]",2020-09-15T11:11:02Z,0.0,0.0,0.0,1.0
refugees,CBS News,Camilo Montoya-Galvez,Trump-Biden race to dictate fate of U.S. immigration for generations,https://www.cbsnews.com/news/trump-biden-2020-immigration-policies/,"The 2020 presidential election will pit two drastically different visions on immigration against each other, with the victor retaining or assuming broad executive authorities that have dominated poli… [+17636 chars]",2020-09-28T20:00:05Z,0.0,0.0,0.0,1.0
refugees,Breitbart News,"Neil Munro, 
Neil Munro",Presidential Debates Ignore '2000-Lb Elephant' of Immigration,https://www.breitbart.com/politics/2020/10/09/presidential-debates-ignore-2000-lb-elephant-immigration/,"The first Presidential debate and the Vice Presidential debates avoided any mention of the hot-button, trillion-dollar immigration issue that got Donald Trump elected in 2016.
“I’m consistently surp… [+4609 chars]",2020-10-09T16:48:35Z,-0.3612,0.294,0.0,0.706
refugees,Breitbart News,"Callista Gingrich, 
Callista Gingrich",Callista Gingrich: Human Trafficking in the Wake of COVID-19,https://www.breitbart.com/politics/2020/10/14/callista-gingrich-human-trafficking-in-the-wake-of-covid-19/,"ROME — The COVID-19 outbreak, which originated in Wuhan and was turned into a pandemic by the Chinese Communist Partys lack of transparency, has dramatically changed our world. In far too many places… [+4435 chars]",2020-10-14T12:44:55Z,0.0,0.0,0.0,1.0
refugees,Breitbart News,Mike Rivero,Hungary Strikes Back Against E.U. ‘Open Borders’ Propaganda,https://www.breitbart.com/immigration/2020/09/15/hungary-strikes-back-against-e-u-open-borders-propaganda/,"ROME The Hungarian government has rejected new calls for open borders, insisting on the right of sovereign states to control their own borders.
Government spokesman Zoltan Kovacs responded sharply t… [+3933 chars]",2020-09-16T12:39:52Z,-0.5423,0.429,0.0,0.571
refugees,Breitbart News,"Thomas D. Williams, Ph.D.",Pope Francis: Migrants Are Forced to Flee ‘Like Jesus’,https://www.breitbart.com/immigration/2020/09/28/pope-francis-migrants-are-forced-to-flee-like-jesus/,"ROME Pope Francis emphasized the involuntary nature of much migration Sunday, insisting that, like Jesus, migrants and refugees are often forced to flee.
Today the Church celebrates the World Day of… [+2146 chars]",2020-09-28T13:59:13Z,-0.4588,0.273,0.0,0.727
refugees,Breitbart News,John Binder,Trump Further Reduces Obama’s Refugee Inflow to U.S. by 80 Percent,https://www.breitbart.com/politics/2020/10/01/trump-further-reduces-obamas-refugee-inflow-to-u-s-by-80-percent/,"President Trump is further reducing the inflow of refugees to the United States, cutting their resettlement by 80 percent compared to former President Obama’s last year in office.
This week, Trump a… [+2163 chars]",2020-10-01T20:05:09Z,0.0,0.0,0.0,1.0
refugees,Breitbart News,Neil Munro,Washington Post: Only ‘Bigots’ Oppose Large Refugee Inflows,https://www.breitbart.com/politics/2020/10/06/washington-post-only-bigots-oppose-large-refugee-inflows/,"President Donald Trump’s decision to accept 15,000 refugees in 2020 only helps “bigots,” says Catherine Rampell, a pro-migration columnist at the Washington Post.
“The only constituency helped by Tr… [+6473 chars]",2020-10-06T22:18:19Z,0.0,0.0,0.0,1.0
refugees,Breitbart News,Lucas Nolan,Facebook Removes Trump Campaign Ad,https://www.breitbart.com/tech/2020/10/01/facebook-removes-trump-campaign-ad/,"Facebook has reportedly removed a recent ad from the Trump campaign, claiming that the ad features factually incorrect information about refugees and the coronavirus pandemic.
NBC News reports that … [+2173 chars]",2020-10-02T00:33:29Z,0.0,0.0,0.0,1.0
refugees,Breitbart News,John Binder,Trump Ad: Joe Biden to Hike Refugees by 700 Percent During Coronavirus Crisis,https://www.breitbart.com/politics/2020/09/21/trump-ad-joe-biden-to-hike-refugees-by-700-percent-during-coronavirus-crisis/,"A new campaign ad for President Trump notes Democrat presidential candidate Joe Biden’s plan to hike refugee resettlement to the United States by 700 percent during the Chinese coronavirus crisis.
“… [+1886 chars]",2020-09-21T20:35:35Z,-0.6249,0.255,0.0,0.745
refugees,Breitbart News,Victoria Friedman,"MSM Catches up to Farage, Finally Reports Alleged Refugees Evading Authorities",https://www.breitbart.com/europe/2020/09/14/msm-catches-up-farage-finally-reports-alleged-refugees-evading-authorities/,"Five months after Nigel Farage first reported that the true number of illegal aliens was likely much higher than the official figure because many arrive undetected, the mainstream media has finally r… [+4631 chars]",2020-09-14T17:42:30Z,0.0,0.0,0.0,1.0
refugees,Breitbart News,Joel B. Pollak,Fact Check: Kamala Harris Repeats False ‘Muslim Ban’ Claim,https://www.breitbart.com/2020-election/2020/10/07/fact-check-kamala-harris-repeats-false-muslim-ban-claim/,"CLAIM: Sen. Kamala Harris (D-CA) claimed that President Donald Trump “instituted, as his first act, a ‘Muslim ban’.”
VERDICT: FALSE. Trump’s travel ban was not a “Muslim ban” and has since been uphe… [+2634 chars]",2020-10-08T04:01:38Z,0.0,0.0,0.0,1.0
refugees,Breitbart News,Breitbart London,"Driver Killed, Nine Injured After Suspected Migrant Smuggler’s Car Crash",https://www.breitbart.com/europe/2020/10/09/driver-killed-nine-injured-after-suspected-migrant-smugglers-car-crash/,"THESSALONIKI, Greece (AP) – A car involved in suspected migrant trafficking has crashed in northern Greece leaving the driver dead and all nine passengers injured, police said Friday.
Police said th… [+1021 chars]",2020-10-09T14:14:06Z,-0.8957,0.663,0.0,0.337
refugees,Breitbart News,"Thomas D. Williams, Ph.D.",Jesuit Cardinal: Europe Must ‘Open the Doors’ to Migrants,https://www.breitbart.com/immigration/2020/09/14/jesuit-cardinal-europe-must-open-the-doors-to-migrants/,"ROME The progressive leader of the Bishops Conferences of the European Community (COMECE) has called on Europeans to open their doors to migrants stranded in camps in Libya, Lesbos, and Lampedusa.
O… [+2679 chars]",2020-09-14T15:27:07Z,0.0,0.0,0.0,1.0
refugees,Breitbart News,Charlie Spiering,Minnesota Supporters Chant ‘Lock Her Up’ as Trump Mentions Ilhan Omar,https://www.breitbart.com/politics/2020/09/30/supporters-chant-lock-her-up-trump-mentions-ilhan-omar/,"Supporters of President Donald Trump on Wednesday chanted, “lock her up,” when the president referred to recent reporting exposing an organized ballot harvesting scheme in Minneapolis connected to Re… [+1469 chars]",2020-10-01T03:42:52Z,0.4404,0.0,0.225,0.775
refugees,Breitbart News,Kristina Wong,House Republican China Task Force Unveils Detailed Plan on How to Counter China,https://www.breitbart.com/politics/2020/09/30/house-republican-china-task-force-plan-counter-china/,"The House Republican China Task Force on Wednesday unveiled a detailed plan on how to counter the Chinese Communist Party’s (CCP) efforts to replace the United States as the world’s superpower.
Hous… [+2652 chars]",2020-09-30T11:47:37Z,0.0,0.0,0.0,1.0
refugees,Breitbart News,Neil Munro,"Joe Biden Promises Welcome for Venezuelan, Cuban Migrants",https://www.breitbart.com/politics/2020/10/08/joe-biden-promises-welcome-venezuelan-cuban-migrants/,"Democratic candidate Joe Biden is offering a green light to migrants who want to flee from Cuba and Venezuela.
“The Venezuelan people need our support to recover their democracy and rebuild their co… [+5550 chars]",2020-10-08T19:08:08Z,0.6808,0.0,0.483,0.517
refugees,Breitbart News,Gabrielle Reyes,Afghanistan’s Only Known Jewish Citizen: Peace Talks Must Protect Minorities,https://www.breitbart.com/asia/2020/09/18/afghanistans-only-known-jewish-citizen-peace-talks-must-protect-minorities/,"The only known Jewish citizen in Afghanistan says that the country’s future political system “should ensure the protection of all minorities in the country and their humanitarian rights,” Afghanistan… [+2384 chars]",2020-09-18T20:27:03Z,0.7269,0.0,0.433,0.567
refugees,Breitbart News,Chris Tomlinson,EU Commission President Claims Populist Opponents ‘Preach Hate’,https://www.breitbart.com/europe/2020/09/18/eu-commission-president-claims-populist-opponents-preach-hate/,"European Commission President Ursula von der Leyen rebuffed populist critics in the European Parliament on mass migration, claiming they “preach hatred”.
President Von der Leyen was challenged on ma… [+2324 chars]",2020-09-18T09:08:42Z,0.0,0.0,0.0,1.0
refugees,Breitbart News,Chris Tomlinson,Greek Minister Claims Closed Borders Have Cost People Traffickers €100 Million,https://www.breitbart.com/europe/2020/09/18/greek-minister-closed-borders-cost-people-traffickers-100-million/,"Greek Minister for Migration and Asylum Notis Mitarakis has claimed that people traffickers have lost as much as 100 million due to the reduction in migrants flowing into Greece.
The Migration and A… [+2216 chars]",2020-09-18T14:20:18Z,0.0,0.0,0.0,1.0
refugees,Breitbart News,Trent Baker,Scarborough: Trump Using ‘Clearly Fascist Language’ in Omar Attacks,https://www.breitbart.com/clips/2020/09/23/scarborough-trump-using-clearly-fascist-language-in-omar-attacks/,"MSNBC “Morning Joe” host Joe Scarborough on Wednesday weighed in on President Donald Trump taking aim at Rep. Ilhan Omar (D-MN) and her native country Somalia.
Trump at his rally in Moon Township, P… [+2173 chars]",2020-09-23T13:43:40Z,-0.7579,0.481,0.0,0.519
