Keyword,Source,Author,Title,URL,Text,Published,compound score,negative score,positive score,neutral score
refugees,Breitbart News,Chris Tomlinson,Moroccans Make Up Nearly a Quarter of All Juvenile Inmates in Spain,https://www.breitbart.com/europe/2020/09/20/moroccans-make-up-nearly-a-quarter-of-all-juvenile-inmates-in-spain/,"A study has revealed that around a quarter of those in juvenile detention in Spain come from Morocco and as many as three in ten illegal migrants have committed some sort of crime.
According to the … [+2234 chars]",2020-09-20T13:58:25Z,0.0,0.0,0.0,1.0
refugees,Breitbart News,Kurt Zindulka,Channel Migrant Tsar Claims 'Vast Majority' of Asylum Seekers Are 'Genuine',https://www.breitbart.com/europe/2020/10/12/channel-migrant-tsar-claims-vast-majority-of-asylum-seekers-are-genuine/,"The “vast majority” of illegal migrants claiming asylum in the United Kingdom are “genuine”, alleged the recently installed Channel Migrant Tsar, despite figures pointing to the contrary.
On Saturda… [+5210 chars]",2020-10-12T15:44:06Z,0.0,0.0,0.0,1.0
refugees,Breitbart News,Victoria Friedman,Farage Watched French Warship Escort Migrant Boat into British Waters,https://www.breitbart.com/europe/2020/09/16/farage-watched-french-warships-escort-migrants-british-waters-hour/,"Nigel Farage reported from the English Channel on Wednesday that French authorities continue to escort boats full of illegal aliens into British waters, despite UK government claims that France is do… [+3371 chars]",2020-09-16T11:45:27Z,-0.1779,0.159,0.0,0.841
refugees,Breitbart News,Pam Key,Omar: ‘I Resent’ Anyone Who Says Trump ‘Is Not Racist’ — We Have ‘Fascist in the White House’,https://www.breitbart.com/clips/2020/10/01/omar-i-resent-anyone-who-says-trump-is-not-racist-we-have-fascist-in-the-white-house/,"Representative Ilhan Omar (D-MN) said she resented anyone claiming President Donald Trump was not a racist on Thursday’s broadcast of MSNBC’s “Live.”
In a video clip from lastnight’s Minnesota rally… [+2909 chars]",2020-10-01T20:32:15Z,0.0,0.0,0.0,1.0
refugees,Breitbart News,Joel B. Pollak,Left: Trump Equals Hitler for Saying ‘Good Genes’; Obama Used Same Phrase,https://www.breitbart.com/politics/2020/09/22/left-trump-equals-hitler-for-saying-good-genes-obama-used-same-phrase/,Left-wing critics are comparing President Donald Trump to Nazi dictator and mass murderer Adolf Hitler because he used the phrase “good genes” in a speech last week — even though President Barack Oba… [+3041 chars],2020-09-22T14:55:10Z,0.0,0.0,0.0,1.0
refugees,Breitbart News,Neil Munro,Politico: ‘Union Members Snub Biden for Trump’,https://www.breitbart.com/economy/2020/09/22/politico-union-members-snub-biden-for-trump/,"Union leaders are trying to drag their members into Joe Biden’s column amid strong union support for President Donald Trump’s pro-worker policies, according to Politico.
Under the headline, “Rank-an… [+3285 chars]",2020-09-22T19:18:07Z,-0.4215,0.318,0.0,0.682
refugees,Breitbart News,"Thomas D. Williams, Ph.D.",Newark Cardinal: Americans Can Vote for Joe Biden ‘in Good Conscience’,https://www.breitbart.com/2020-election/2020/09/17/newark-cardinal-americans-can-vote-joe-biden-good-conscience/,"Newark Cardinal Joe Tobin told a panel of Catholics Tuesday they could vote for Joe Biden in good conscience, adding that he would have a harder time justifying a vote for Donald Trump.
I think that… [+3692 chars]",2020-09-17T17:47:33Z,0.4404,0.0,0.225,0.775
refugees,Breitbart News,"Thomas D. Williams, Ph.D.","Pope Francis Knocks Nationalism, Pushes Multilateralism in U.N. Speech",https://www.breitbart.com/national-security/2020/09/25/pope-francis-knocks-nationalism-pushes-multilateralism-in-u-n-speech/,"ROME Pope Francis told the U.N. General Assembly Friday that the world stands at a crossroads between multilateralism and a dangerous resurgence of nationalism.
In an apparent swipe at U.S. Presiden… [+3226 chars]",2020-09-25T15:14:54Z,0.0,0.0,0.0,1.0
refugees,Breitbart News,Kurt Zindulka,‘We Have Space’ Thousands of Germans Protest For MORE Migrants After Moria Camp Fire,https://www.breitbart.com/europe/2020/09/21/we-have-space-thousands-of-germans-protest-for-more-migrants-after-moria-camp-fire/,"Thousands of protesters took to the streets of Germany on Sunday to demand that the government take in more migrants following the fire that destroyed the Moria migrant camp in Greece.
In Berlin, ar… [+2848 chars]",2020-09-21T16:43:27Z,-0.5267,0.268,0.0,0.732
refugees,Breitbart News,Jack Montgomery,Leftists Protest New Migrant Camps – Want Even More Generous Housing for Illegals,https://www.breitbart.com/europe/2020/09/22/leftists-protest-new-migrant-camps-want-illegals-get-more-generous-housing/,"Leftist campaigners protest plans to establish migrant camps in Wales — because they want them to receive more luxurious housing, free education, and paying jobs instead.
The Penally Army Centre nea… [+2801 chars]",2020-09-22T13:05:09Z,0.4391,0.126,0.308,0.566
refugees,Breitbart News,Virginia Hale,UK Government Importing Asylum Seekers Directly from Greece Under ‘Family Reunification’,https://www.breitbart.com/europe/2020/10/05/uk-government-importing-asylum-seekers/,"The British government has revealed it is flying in asylum seekers directly from Greece, while record numbers of illegal immigrants continue to arrive on UK shores in boats.
On Friday, the governmen… [+3422 chars]",2020-10-05T12:21:03Z,0.0,0.0,0.0,1.0
refugees,Breitbart News,John Hayward,Lebanon at the U.N.: Beirut Will 'Rise from Its Ruins',https://www.breitbart.com/national-security/2020/09/23/lebanon-un-beirut-will-rise-its-ruins/,"Lebanese President Michel Aoun used his address to the 2020 U.N. General Assembly on Wednesday to thank the international community for assisting Lebanon after an explosion rocked Beirut, but also in… [+3001 chars]",2020-09-23T21:10:14Z,-0.4404,0.244,0.0,0.756
refugees,Breitbart News,Victoria Friedman,Deportation Flight Had One Passenger After 29 Lodged Legal Challenges,https://www.breitbart.com/europe/2020/10/03/deportation-flight-had-one-passenger-29-lodged-legal-challenges/,"The UK deported just one out of 30 failed asylum seekers scheduled on a flight to France after the rest had lodged legal challenges to their removal.
One Sudanese man was returned to Paris under cur… [+3664 chars]",2020-10-03T07:47:46Z,0.2023,0.0,0.259,0.741
refugees,Breitbart News,Virginia Hale,. UN Insists Record Boat Migrant Numbers 'Not a Threat' to Britain,https://www.breitbart.com/europe/2020/10/01/un-boat-migrants-threat-britain/,"Record numbers of illegal immigrants crossing the English Channel are not a threat to Britain, and could even be a boon for taxpayers, the United Nations (UN) has claimed.
Speaking to the Commons Ho… [+4550 chars]",2020-10-01T09:20:20Z,0.4168,0.0,0.236,0.764
refugees,Breitbart News,Jack Montgomery,EU Reveals 'Mandatory Solidarity Mechanism' to Spread Migrants Across All States,https://www.breitbart.com/europe/2020/09/24/eu-plots-mandatory-solidarity-mechanism-spread-migrants/,"The European Union’s unelected executive-cum-legislature, the European Commission, has put forward a “Mandatory Solidarity Mechanism” to spread the burden of the migrant crisis across all member-stat… [+4041 chars]",2020-09-24T07:58:53Z,0.3612,0.0,0.28,0.72
refugees,Breitbart News,Neil Munro,"Donald Trump’s Policies Boosted Lower, Middle Income Americans",https://www.breitbart.com/economy/2020/09/30/donald-trumps-policies-boosted-lower-and-middle-income-americans/,"Lower- and middle-income Americans gained ground in President Donald Trump’s first-term economy, while upper-income Americans gained the most under President Barack Obama, according to a survey by th… [+4181 chars]",2020-09-30T17:43:15Z,0.0772,0.206,0.234,0.561
refugees,Breitbart News,Neil Munro,Agriculture Deptartment Drops Wage Floor in H-2A Farmworker Program,https://www.breitbart.com/economy/2020/10/01/agriculture-dept-drops-wage-floor-h2a-program/,"Agriculture department officials have announced they will not conduct a routine annual survey on wages in the farm sector, likely helping agriculture employers to suppress wages for the expected supp… [+5197 chars]",2020-10-02T02:22:16Z,0.0,0.0,0.0,1.0
refugees,Breitbart News,Neil Munro,Biden: My Immigration Policy Will Protect Foreign Families,https://www.breitbart.com/economy/2020/09/17/biden-my-deportation-policy-will-protect-foreign-families/,"The U.S. government will change its deportation policy to help keep foreign families together, Democratic candidate Joe Biden promised the Spanish-language Telemundo TV network.
“There are still tho… [+3910 chars]",2020-09-17T18:40:23Z,0.3818,0.0,0.271,0.729
refugees,Breitbart News,Neil Munro,Populist Joe Biden: 2020 is ‘Between Scranton and Park Avenue’,https://www.breitbart.com/immigration/2020/09/18/populist-joe-biden-2020-between-scranton-park-avenue/,"Joe Biden is portraying his 2020 campaign as a populist movement, even though his campaign is strongly backed by elites and Wall Street donors who favor mass immigration and wage-cutting free trade.… [+4586 chars]",2020-09-18T17:20:10Z,0.0,0.0,0.0,1.0
refugees,Breitbart News,Frances Martel,Senate Bill Demands Probe into U.N. Role in Cuba’s Billion-Dollar Slave Doctor Industry,https://www.breitbart.com/latin-america/2020/09/22/senate-bill-demands-probe-into-u-n-role-in-cubas-billion-dollar-slave-doctor-industry/,Sens. Robert Menendez (D-NJ) and Marco Rubio (R-NJ) introduced legislation on Monday that would require the U.S. government to investigate the Pan-American Health Organization’s (PAHO) role in helpin… [+5464 chars],2020-09-22T14:11:58Z,0.0,0.0,0.0,1.0
refugees,Breitbart News,Victoria Friedman,"UK Failed to Learn Lessons of 9/11, 7/7, Says Father of Ariana Grande Terror Attack Victim",https://www.breitbart.com/europe/2020/09/23/uk-failed-learn-lessons-9-11-7-7-says-father-manchester-terror-attack-victim/,"Andrew Roussos, the father of eight-year-old Saffie who was killed in an Islamist terror attack three years ago, has criticised the government for failing to learn security lessons following the 9/11… [+3630 chars]",2020-09-23T16:58:32Z,-0.8979,0.498,0.0,0.502
refugees,Breitbart News,Jack Montgomery,Report: Law Firm Which Stops Deportations Got 55m in Taxpayer Legal Aid,https://www.breitbart.com/europe/2020/10/06/report-law-firm-which-stops-deportations-got-55m-taxpayer-legal-aid/,"A law firm which has helped to block a number of deportations has received tens of millions in taxpayer-funded legal aid over the last three years, according to reports.
Amarpal Singh Gupta’s firm, … [+3583 chars]",2020-10-06T11:42:32Z,-0.0258,0.122,0.115,0.763
refugees,Breitbart News,Joel B. Pollak,WATCH: Democrat Ammar Campa-Najjar Released 'Free Palestine' Music Video in 2012,https://www.breitbart.com/middle-east/2020/10/08/watch-democrat-ammar-campa-najjar-released-free-palestine-music-video-in-2012/,"Democrat Ammar Campa-Najjar, who is running for Congress in California’s 50th district, created a music video about the Palestinian cause in 2012 that included the slogan “Free Palestine.”
The video… [+3672 chars]",2020-10-08T23:56:38Z,0.5106,0.0,0.248,0.752
refugees,Breitbart News,Chris Tomlinson,Italy: Majority of Migrants Rejected for Asylum But Stay in Country Anyway,https://www.breitbart.com/europe/2020/09/29/italy-majority-of-migrants-rejected-for-asylum-but-stay-in-country-anyway/,"Italian asylum case figures show an overwhelming majority of migrants coming into the country are not approved for asylum but nearly none of the rejected asylum seekers are actually deported.
Data f… [+2874 chars]",2020-09-29T11:44:00Z,-0.5106,0.231,0.0,0.769
refugees,Breitbart News,Neil Munro,Axios: New York City Shrinks Due to Lower Immigration,https://www.breitbart.com/politics/2020/09/18/axios-new-york-city-shrinks-due-to-lower-immigration/,"President Donald Trump’s pro-American curbs on migration are pressuring New York’s parochial elite to accept out-of-state young Americans into the city’s economy.
“The main driver of both new busine… [+8321 chars]",2020-09-18T23:05:13Z,-0.296,0.216,0.0,0.784
refugees,Breitbart News,Kurt Zindulka,French Police Dismantle Calais 'Jungle' Migrant Camp Housing Over 700 'Asylum Seekers',https://www.breitbart.com/europe/2020/09/29/french-police-dismantle-calais-jungle-camp-housing-700-migrants/,"A migrant camp in Calais, France in which 700 to 800 migrants were squatting was dismantled by French police on Tuesday, in what is being characterized as the largest operation since the destruction … [+4664 chars]",2020-09-29T17:55:56Z,0.0,0.0,0.0,1.0
refugees,Breitbart News,Victoria Friedman,"UK Considering Floating Asylum Centres in Old Ferries, Sending Migrants to Remote Islands: Reports",https://www.breitbart.com/europe/2020/10/02/uk-considering-floating-asylum-centres-in-old-ferries-sending-migrants-to-remote-islands-reports/,"The British government is said to be considering off-shore asylum centres on old ferries, or even sending claimants to remote islands in the South Atlantic.
The government is reportedly considering … [+4499 chars]",2020-10-02T09:59:28Z,0.0,0.0,0.0,1.0
refugees,Breitbart News,Neil Munro,Trump Gets Pennsylvania Opportunity as Democrats Endorse H-1B Outsourcing,https://www.breitbart.com/immigration/2020/09/28/trump-pennsylvania-opportunity-democrats-endorse-h-1b-job-losses/,"The Vanguard Group’s outsourcing of 1,300 Pennsylvania white-collar jobs to Indian H-1B workers has given a huge opportunity to President Donald Trump in the key swing state, says a series of activis… [+17923 chars]",2020-09-29T03:02:41Z,0.6249,0.0,0.421,0.579
refugees,Breitbart News,Joshua Klein,Left Recruits 600k Poll Workers to Ensure 'Fair Election',https://www.breitbart.com/politics/2020/10/09/left-recruits-600k-poll-workers-to-ensure-fair-election/,"A slew of left-wing activist groups, former and current Democratic politicians, as well as anti-Trump celebrities, athletes, and corporations have teamed up and recruited over 600,000 healthy, low-ri… [+14676 chars]",2020-10-09T21:58:50Z,0.5994,0.0,0.412,0.588
refugees,Bloomberg,Thomas Penny,U.K. Considers Processing Refugees Offshore in Immigration Shake-Up,https://www.bloomberg.com/news/articles/2020-09-30/u-k-mulls-processing-refugees-offshore-in-immigration-shake-up,,2020-09-30T14:06:53Z,0.0,0.0,0.0,1.0
refugees,Bloomberg,,Faith Groups Decry Trump's Plans for Record Low Refugee Cap,https://www.bloomberg.com/news/articles/2020-10-01/faith-groups-decry-trump-s-plans-for-record-low-refugee-cap,,2020-10-01T17:55:51Z,0.1779,0.163,0.217,0.62
refugees,Al Jazeera English,Al Jazeera,Does anyone care about the Moria refugees?,https://www.aljazeera.com/program/the-stream/2020/9/26/does-anyone-care-about-the-moria-refugees/,"There is a lack of food, water and toilet facilities at Kara Tepe, forcing people to urinate in the sea and near tents.",2020-09-26T20:48:12Z,0.4939,0.0,0.348,0.652
refugees,Al Jazeera English,Manos Moschopoulos,The ashes of Moria refugee camp could poison European politics,https://www.aljazeera.com/opinions/2020/9/23/the-ashes-of-moria-refugee-camp-could-poison-european-politics/,"Even by the grim standards of Greeces reception system, the September 8 fire at the Moria refugee camp is an unprecedented humanitarian catastrophe. It was not the first fire at the camp and it was e… [+5473 chars]",2020-09-23T11:43:49Z,-0.5423,0.28,0.0,0.72
refugees,Al Jazeera English,Al Jazeera,Refugees accuse Greece of pushing them back out to sea,https://www.aljazeera.com/news/2020/9/25/refugees-accuse-greece-of-pushing-them-back-out-to-sea,"Shortly after reaching the Greek island of Lesbos, a group of Afghan refugees and migrants say their hopes for a new life in Europe were cut short when Greek authorities rounded them up, mistreated t… [+7382 chars]",2020-09-25T14:18:10Z,-0.2023,0.167,0.0,0.833
refugees,Al Jazeera English,Al Jazeera,Divided Europe seeks to overhaul defunct migration policies,https://www.aljazeera.com/news/2020/9/23/divided-europe-seeks-to-overhaul-defunct-migration-policies,"The European Unions executive has proposed overhauling the blocs broken migration and asylum rules, seeking to end years of feuds and bitterness over the hundreds of thousands of people fleeing wars … [+4361 chars]",2020-09-23T13:16:32Z,0.0,0.0,0.0,1.0
refugees,Al Jazeera English,Katy Fallon,"After fire destroyed Greek camp, refugees seek European support",https://www.aljazeera.com/news/2020/09/fire-destroyed-greek-camp-refugees-seek-european-support-200914080544868.html,"Lesbos, Greece - In the middle of the burned remains that were once the Moria refugee camp lies a notebook left behind by one of the thousands of people who rushed to save their lives when fires tore… [+6021 chars]",2020-09-14T12:00:12Z,-0.4404,0.392,0.189,0.42
refugees,Al Jazeera English,Al Jazeera,Amnesty urges EU to rethink Libya cooperation over refugee abuse,https://www.aljazeera.com/news/2020/9/24/amnesty-urges-eu-to-rethink-libya-cooperation-over-migrant-abuse,"A prominent rights group has called on the European Union to reconsider its cooperation with Libya over horrific abuses being committed against refugees and migrants in the North African country.
In… [+3222 chars]",2020-09-24T09:03:01Z,-0.6369,0.318,0.0,0.682
refugees,Al Jazeera English,Peter Yeung,Lead poisoning fears at Greek refugee camp built on military site,https://www.aljazeera.com/news/2020/10/2/lead-poisoning-greece,"Asylum seekers living at a new refugee camp in Lesbos, which was built by the Greek army on a former military shooting range following the burning of Moria last month, could be at serious risk of lea… [+3534 chars]",2020-10-02T13:51:22Z,-0.765,0.423,0.0,0.577
refugees,Al Jazeera English,Al Jazeera,"Trump to limit 2021 US refugee admissions to 15,000, a record low",https://www.aljazeera.com/news/2020/10/1/trump-plans-to-limit-us-refugee-admissions-to-a-record-low,"The US State Department has notified Congress the United States anticipates resettling 15,000 refugees in the United States during the fiscal 2021 year, a record low number.
The government estimate,… [+4416 chars]",2020-10-01T17:08:55Z,-0.2732,0.174,0.0,0.826
refugees,Al Jazeera English,Al Jazeera,A Place of Refuge: Malmo and Nickelsdorf,https://www.aljazeera.com/program/al-jazeera-world/2020/10/7/a-place-of-refuge-malmo-and-nickelsdorf/,"An Algerian actor, a Honduran journalist, a Liberian writer, a Cameroonian performer: four remarkable journeys to Spain.",2020-10-07T18:30:38Z,0.0,0.0,0.0,1.0
refugees,Al Jazeera English,Al Jazeera,Algeria expelling thousands of migrants across Niger border: HRW,https://www.aljazeera.com/news/2020/10/9/algeria-abandons-thousands-of-migrants-at-niger-border-report,"Algerian security forces have arrested thousands of migrants and refugees, cramming them onto trucks and buses before expelling them across the border to Niger, Human Rights Watch said.
Since early … [+1460 chars]",2020-10-09T18:14:43Z,-0.3818,0.245,0.0,0.755
refugees,Al Jazeera English,Al Jazeera,Trump set to miss required deadline for 2021 refugee quota,https://www.aljazeera.com/news/2020/9/30/trump-looks-set-to-miss-required-deadline-for-2021-refugee-quota,"US President Donald Trump appears to be ignoring a deadline to establish how many refugees will be allowed into the United States next year, raising uncertainty about the future of the 40-year-old re… [+3437 chars]",2020-09-30T23:44:21Z,-0.1531,0.151,0.0,0.849
refugees,Al Jazeera English,Al Jazeera,Eleven dead after boat carrying refugees sinks off Tunisia,https://www.aljazeera.com/news/2020/10/12/eleven-refugees-dead-after-boat-sinks-off-tunisia,"At least 11 people died, including eight women and three children, and seven others were rescued when a boat carrying refugees sank off southern Tunisia, officials said late on Sunday.
A police sour… [+1023 chars]",2020-10-12T08:41:09Z,-0.6486,0.35,0.0,0.65
refugees,Al Jazeera English,Gaia Lamperti,The British coastal communities doomed to become climate refugees,https://www.aljazeera.com/features/2020/9/24/the-british-coastal-communities-doomed-to-become-climate-refugees,"Two years ago, Nicola Bayless was taking her evening walk in Happisburgh, a tiny village on the eastern coast of England, when a big chunk of the cliff fell down.
It sounded like thunder. Like a cli… [+8240 chars]",2020-09-24T06:54:54Z,-0.6369,0.344,0.0,0.656
refugees,Al Jazeera English,,Refugees flee as fire destroys Greece's overcrowded Moria camp,https://www.aljazeera.com/programmes/newsfeed/2020/09/refugees-flee-fire-destroys-greece-overcrowded-moria-camp-200914075038457.html,,2020-09-14T10:05:32Z,-0.7184,0.462,0.0,0.538
refugees,Al Jazeera English,Al Jazeera,"After France refused rescue ship to dock, refugees reach Sardinia",https://www.aljazeera.com/news/2020/9/24/after-france-refused-rescue-ship-to-dock-refugees-reach-sardinia,"A ship with 125 rescued refugees and migrants on board reached the Italian island of Sardinia on Thursday, the aid organisation Sea-Eye said, adding the fate of its survivors remains unclear.
The Al… [+2657 chars]",2020-09-24T15:37:04Z,0.296,0.162,0.324,0.515
refugees,Al Jazeera English,Virginia Pietromarchi,"Italy’s Salvini goes on trial, accused of ‘kidnapping’ refugees",https://www.aljazeera.com/news/2020/10/3/hold-for-anealla-salvini-trial-to-begin,"Rome, Italy Matteo Salvini appears in court on Saturday on charges of kidnapping more than a hundred migrants, in an event that the Italian far-right leader has attempted to use to boost his dwindlin… [+3896 chars]",2020-10-03T06:23:26Z,-0.296,0.216,0.0,0.784
refugees,Al Jazeera English,Efi Latsoudi,"Do not close Pikpa down, replicate it",https://www.aljazeera.com/opinions/2020/10/13/do-not-close-pikpa-down-replicate-it/,"On the morning of September 10, just hours after a massive fire tore through the Moria refugee camp on the Greek island of Lesbos, women at Pikpa, a small volunteer- and refugee-run shelter on the sa… [+4469 chars]",2020-10-13T07:55:32Z,0.0,0.0,0.0,1.0
refugees,Al Jazeera English,Al Jazeera,Two dozen migrants feared drowned off Libya's coast,https://www.aljazeera.com/news/2020/09/dozen-migrants-feared-drowned-libya-coast-200915154357375.html,"A boat carrying refugees and migrants bound for Europe has capsized in the Mediterranean Sea off Libya's coast, leaving at least two dozen people dead or missing, the UN migration agency said.
Safa … [+2497 chars]",2020-09-15T17:25:56Z,-0.7964,0.542,0.0,0.458
refugees,Al Jazeera English,Al Jazeera,Greece: Police move refugees to new Lesbos camp after Moria fire,https://www.aljazeera.com/news/2020/09/200917085905742.html,"Names marked with an asterisk* have been changed to protect identities.
Police on the Greek island of Lesbos have launched an operation to rehouse thousands of refugees and migrants who have been sl… [+5437 chars]",2020-09-17T09:31:36Z,-0.34,0.194,0.0,0.806
refugees,Al Jazeera English,Al Jazeera,Refugees in Greece wary of entering new camp after Moria fire,https://www.aljazeera.com/news/2020/09/refugees-greece-wary-entering-camp-moria-fire-200916125349988.html,"Greek authorities were still struggling to move thousands of refugees and migrants sleeping rough into a temporary camp, a week after the overcrowded Moria migrant camp burned down, while fears grew … [+2107 chars]",2020-09-16T13:30:48Z,-0.34,0.194,0.0,0.806
refugees,Al Jazeera English,Sofia Barbarani,"After Moria fire, refugees decry conditions in new camp on Lesbos",https://www.aljazeera.com/news/2020/09/moria-fire-refugees-decry-conditions-camp-lesbos-200918125444995.html,"Refugees and migrants on the Greek island of Lesbos, having escaped the fire that engulfed Moria, have told Al Jazeera that living conditions inside a new camp are squalid and uninhabitable, just one… [+4037 chars]",2020-09-18T13:46:34Z,-0.34,0.194,0.0,0.806
refugees,Al Jazeera English,Al Jazeera,"Three dead, 53 rescued after migrant boat sinks off Crete",https://www.aljazeera.com/news/2020/09/dead-53-rescued-migrant-boat-sinks-crete-200914200840466.html,"Three people have died while 53 others were rescued after a boat carrying migrants and refugees sank off the southern Greek island of Crete.
The dead included two children and a woman.
The Greek co… [+1051 chars]",2020-09-14T20:39:17Z,-0.3612,0.285,0.185,0.53
refugees,Al Jazeera English,Al Jazeera,Several killed in ‘gang war’ at Rohingya camps in Bangladesh,https://www.aljazeera.com/news/2020/10/9/several-killed-in-gang-war-at-rohingya-camps-in-bangladesh,"A turf war between criminal armed groups in Rohingya camps in southern Bangladesh has killed at least eight people and forced thousands to flee following clashes in recent days, police and humanitari… [+1913 chars]",2020-10-09T05:47:15Z,-0.6705,0.333,0.0,0.667
refugees,Al Jazeera English,Al Jazeera,At least 16 migrants feared dead in shipwreck off Libya: IOM,https://www.aljazeera.com/news/2020/9/25/at-least-16-people-died-in-a-shipwreck-un-migration-agency,"Three people have died and 13 are feared drowned after a boat carrying refugees and migrants capsized off Libyas coast on Thursday night, according to the International Organization for Migration (IO… [+2236 chars]",2020-09-25T16:16:36Z,-0.8176,0.455,0.0,0.545
refugees,Al Jazeera English,Al Jazeera,Greek police accuse aid workers of supporting migrant smugglers,https://www.aljazeera.com/news/2020/9/28/greek-police-accuses-aid-workers-of-helping-migrant-smuggling,"Greek police have accused 35 people, among them two foreign nationals, from several foreign non-governmental aid organisations of illegally helping refugees and migrants to enter from Turkey.
Those … [+2884 chars]",2020-09-28T16:08:32Z,-0.0772,0.321,0.221,0.458
