Keyword,Source,Author,Title,URL,Text,Published,compound score,negative score,positive score,neutral score
refugees,The Washington Post,Nick Miroff,"Trump cuts refugee cap to lowest level ever, depicts them on campaign trail as a threat and burden - The Washington Post",https://www.washingtonpost.com/immigration/trump-cuts-refugee-cap/2020/10/01/a5113b62-03ed-11eb-8879-7663b816bfa5_story.html,"The 15,000 figure, the lowest since the 1980 Refugee Act, is a drop from the 2020 cap that was set at 18,000. Since March, the number of refugees admitted to the United States fell sharply as the cor… [+5805 chars]",2020-10-01T18:07:00Z,-0.8779,0.41,0.0,0.59
refugees,The Washington Post,Max Boot,Two new polls show the damage Trump has done to U.S. foreign policy - The Washington Post,https://www.washingtonpost.com/opinions/2020/09/17/two-new-polls-show-damage-trump-has-done-us-foreign-policy/,Part of the decline is due to Trumps egregious mishandling of the coronavirus. Only 15 percent of respondents give the United States good marks on the pandemic. Chinas handling of the pandemic is mor… [+4131 chars],2020-09-17T14:00:00Z,-0.4939,0.176,0.0,0.824
refugees,The Washington Post,Aaron Blake,Trump’s rally rhetoric is becoming uglier,https://www.washingtonpost.com/politics/2020/09/24/trumps-rally-rhetoric-is-getting-uglier/,"Over the course of the rallies, Trump has amped up his attacks on refugees and a Muslim congresswoman, his approval of violence against journalists, his baseless theories about Joe Biden and his shun… [+4710 chars]",2020-09-24T10:00:41Z,-0.4939,0.39,0.0,0.61
refugees,The Washington Post,Greg Sargent,Trump’s ugly rant in Minnesota shows why Republicans fear he’ll lose,https://www.washingtonpost.com/opinions/2020/10/01/trumps-ugly-rant-minnesota-shows-why-republicans-fear-hell-lose/,But Trumps latest rant at a rally in Minnesota along with a new election forecast that shows him losing Midwestern whites and a new report on rising GOP anxiety about Trump strongly suggests his pret… [+5373 chars],2020-10-01T14:41:10Z,-0.891,0.624,0.0,0.376
refugees,The Washington Post,James Hohmann,"""Will public sympathy lead to a bounce in the polls?"" Questions on the political ramifications of Trump’s COVID-19 diagnosis.",https://www.washingtonpost.com/politics/2020/10/02/daily-202-dozen-questions-gauge-political-ramifications-trumps-coronavirus-diagnosis/,This October surprise upends the presidential campaign with just over a month until Election Day. This will draw fresh attention to Trumps public and private squabbles with a number of the medical ex… [+35047 chars],2020-10-02T18:14:00Z,0.3612,0.0,0.128,0.872
refugees,The Washington Post,"Steve Hendrix, Nader Durgham","Fleeing chaos and hardship, Lebanese have begun braving perilous seas",https://www.washingtonpost.com/world/middle_east/lebanon-crisis-migrants-refugees/2020/09/25/246295fc-fe4c-11ea-b0e4-350e4e60cc91_story.html,"But as newcomers to this black-market transport, the Lebanese have encountered a grisly learning curve. Some boats have become lost or caught in storms, requiring rescues at sea. Frantic families hav… [+6936 chars]",2020-09-26T12:00:00Z,-0.7184,0.429,0.0,0.571
refugees,The Washington Post,Dan Balz,"Poll: Sharp partisan differences now exist on foreign policy, views of American exceptionalism",https://www.washingtonpost.com/politics/poll-foreign-policy-trump-democrats/2020/09/16/8e2d903e-f836-11ea-be57-d00bb9bc632d_story.html,"In November, the council report notes, voters will not only decide who will become the next U.S. president, but also they will help determine the path U.S. foreign policy takes either working in part… [+7380 chars]",2020-09-17T11:00:00Z,0.0,0.0,0.0,1.0
refugees,The Washington Post,Marc Fisher,"The Undecideds: Sure, Biden and Trump are very different. But maybe neither is right for the job.",https://www.washingtonpost.com/politics/undecided-voters-2020-presidential-debates/2020/09/27/0911c650-fd9e-11ea-8d05-9beaaa91c71f_story.html,"The Boltzes, who live in a rural area half an hour outside Pittsburgh, find themselves squarely between their children. Their son who lives next door is more conservative than they are and supports T… [+11149 chars]",2020-09-28T10:00:00Z,0.3182,0.0,0.126,0.874
refugees,The Washington Post,Shibani Mahtani,"Hong Kongers who fled by sea are held without legal access in China, families say",https://www.washingtonpost.com/world/asia_pacific/hong-kongers-who-fled-by-sea-are-held-without-legal-access-in-china-families-say/2020/09/14/e1acb8b8-f631-11ea-85f7-5941188a98cd_story.html,"That was the last that relatives and friends heard from the three, who were among a dozen Hong Kong activists intercepted at sea by Chinese authorities while trying to flee to Taiwan on a speedboat. … [+6034 chars]",2020-09-14T09:20:00Z,-0.0951,0.089,0.0,0.911
refugees,The Washington Post,Kareem Fahim,"Turkey arrests dozens, including members of pro-Kurdish party, in connection with deadly 2014 protests",https://www.washingtonpost.com/world/middle_east/turkey-arrests-dozens-including-members-of-pro-kurdish-party-in-connection-with-deadly-2014-protests/2020/09/25/fce83e9c-ff1c-11ea-830c-a160b331ca62_story.html,"The prosecutors statement Friday said the arrests were being ordered regarding the calls for protests at the time by the Kurdistan Workers Party, or PKK, a banned militant group in Turkey, as well as… [+2813 chars]",2020-09-25T12:02:35Z,-0.2732,0.259,0.146,0.595
refugees,The Washington Post,Greg Miller,Allegations of racism have marked Trump’s presidency and become key issue as election nears,https://www.washingtonpost.com/national-security/trump-race-record/2020/09/23/332b0b68-f10f-11ea-b796-2dd09962649c_story.html,"Trumps private musings about Hispanics match the vitriol he has displayed in public, and his antipathy to Africa is so ingrained that when first lady Melania Trump planned a 2018 trip to that contine… [+30767 chars]",2020-09-23T14:29:10Z,-0.6249,0.24,0.0,0.76
refugees,The Washington Post,"Ana Vanessa Herrero, Anthony Faiola, Shane Harris","Venezuela says it has captured American 'mercenary' plotting to blow up power plants, oil refineries",https://www.washingtonpost.com/world/the_americas/venezuela-maduro-american-mercenary-captured/2020/09/14/1a92bfdc-f5de-11ea-89e3-4b9efa36dc64_story.html,"CARACAS, Venezuela Venezuelas authoritarian government claimed Monday it had dismantled a covert operation to blow up power plants and oil facilities to destabilize the socialist state, saying it had… [+6036 chars]",2020-09-14T21:01:20Z,0.0,0.0,0.0,1.0
refugees,The Washington Post,"Chico Harlan, Elinda Labropoulou","After fire guts Europe's biggest migrant camp, Greece erects tents, other countries offer little",https://www.washingtonpost.com/world/europe/moria-refugee-camp-fire/2020/09/16/0d301a94-f6a4-11ea-85f7-5941188a98cd_story.html,"The new camp sits on a converted military practice range. It consists of hundreds of white tents, arranged in rows in the dirt. People moving in must submit to an immediate coronavirus lockdown.
You… [+5702 chars]",2020-09-16T19:22:24Z,-0.34,0.156,0.0,0.844
refugees,The Washington Post,Anthony Faiola,U.S. criticism of European mission to Venezuela shows growing divide over Maduro,https://www.washingtonpost.com/world/the_americas/venezuela-maduro-guaido-us-eu/2020/09/27/d13be724-00ea-11eb-897d-3a6201d6643f_story.html,"This will make relations with the E.U. bureaucracy more difficult, Elliott Abrams, the U.S. special representative on Venezuela, told The Washington Post Sunday.
Brussels on Friday confirmed an E.U.… [+4988 chars]",2020-09-27T22:32:52Z,-0.296,0.199,0.116,0.685
refugees,The Washington Post,Amanda Coletta,Canada to bring 5-year-old orphan home from Syrian camp; others remain stranded,https://www.washingtonpost.com/world/the_americas/canada-amira-syria-orphan-repatriated/2020/10/05/bafe08ea-0723-11eb-859b-f9c27abe638d_story.html,"There are no other operations of the sort ongoing, Trudeau told reporters Monday in Ottawa. He said Amiras case was exceptional because she was orphaned.
The girl was found last year walking alone o… [+4778 chars]",2020-10-05T20:45:26Z,0.0,0.0,0.0,1.0
refugees,The Washington Post,Elizabeth Dwoskin,"TikTok videos, Facebook Trump ads spread misinformation concerning Biden’s health",https://www.washingtonpost.com/technology/2020/09/30/biden-misinformation-earpiece-tiktok-facebook/,"And on the video platform TikTok, four grainy videos alleging that Biden was wearing a wire to cheat during the debate racked up more than half a million combined views on Wednesday, according to res… [+2796 chars]",2020-09-30T23:34:27Z,-0.3182,0.204,0.0,0.796
refugees,The Washington Post,Anthony Faiola,U.N. investigators accuse Venezuelan government of 'crimes against humanity',https://www.washingtonpost.com/world/the_americas/venezuela-maduro-united-nations-crimes-humanity/2020/09/16/21f148ee-f826-11ea-89e3-4b9efa36dc64_story.html,"Venezuelan President Nicolás Maduro and members of his inner circle gave orders, coordinated activities and supplied resources for arbitrary detentions, torture, disappearances and extrajudicial kill… [+6591 chars]",2020-09-16T20:18:58Z,-0.2023,0.184,0.0,0.816
refugees,The Washington Post,Adam Taylor,Democracies are backsliding amid the coronavirus pandemic,https://www.washingtonpost.com/world/2020/10/02/democracy-coronavirus-freedom-house/,"At the same time, the virus has thrown up obstacles to voting in person and other forms of political participation that might fight these problems. Elected officials who are willing to lean into dema… [+6391 chars]",2020-10-02T04:00:00Z,0.0,0.0,0.0,1.0
refugees,The Washington Post,"Mariana Zúñiga, Anthony Faiola",Venezuela's broken oil industry is spewing crude into the Caribbean Sea,https://www.washingtonpost.com/world/the_americas/venezuela-oil-spills/2020/09/23/5613c996-f793-11ea-a275-1a2c2d36e1f1_story.html,"Venezuelas once powerful oil industry is literally falling apart, with years of mismanagement, corruption, falling prices and a U.S. embargo imposed last year bringing aging infrastructure to the bri… [+7404 chars]",2020-09-24T10:00:00Z,-0.7783,0.43,0.0,0.57
refugees,The Washington Post,Claire Parker,Economic fallout from coronavirus leads to surge in Tunisians leaving for Europe,https://www.washingtonpost.com/world/middle-east/coronavirus-tunisia-migrants-italy/2020/09/23/ad4c37cc-fc0f-11ea-b0e4-350e4e60cc91_story.html,"During the first eight months of this year, nearly 8,000 Tunisians crossed the Mediterranean to Italy, six times as many as last year, according to the Office of the U.N. High Commissioner for Refuge… [+8078 chars]",2020-09-24T10:00:00Z,0.0,0.0,0.0,1.0
refugees,The Washington Post,Shibani Mahtani,'You're still my baby': Hong Kong mother pleas for son held in mainland China after desperate boat escape,https://www.washingtonpost.com/world/asia_pacific/hong-kong-12-arrests-china/2020/09/27/fcd90c02-fe26-11ea-b0e4-350e4e60cc91_story.html,"Li had his political awakening in 2014, as a participant in the Umbrella Movement. The 79-day street occupation failed in its goal of universal suffrage, but inspired a new generation of Hong Kongers… [+7830 chars]",2020-09-27T12:00:20Z,-0.1531,0.115,0.085,0.8
refugees,Politico,Matthew Choi,‘She’s telling us how to run our country’: Trump again goes after Ilhan Omar’s Somali roots,https://www.politico.com/news/2020/09/22/trump-attacks-ilhan-omar-420267,"The comment was one of the presidents many jabs suggesting that Omar is not an American. Going after her has become almost a staple of his campaign rallies, where he often focuses on her more than ot… [+992 chars]",2020-09-23T01:34:27Z,0.0,0.0,0.0,1.0
refugees,Politico,Matthew Choi,Trump at Minnesota rally: Biden will turn state into a 'refugee camp',https://www.politico.com/news/2020/09/18/trump-biden-will-turn-minnesota-into-a-refugee-camp-417900,"""These hardened criminals are back in their country where they can do all the complaining they want,"" Trump said. ""And your families are safer for it.""
The Trump administration has made stonewalling… [+3788 chars]",2020-09-19T01:32:08Z,0.0,0.0,0.0,1.0
refugees,Politico,Melanie Zanona,House Republicans release recommendations for China crackdown,https://www.politico.com/news/2020/09/30/house-republicans-release-china-crackdown-recommendations-423816,"House Minority Leader Kevin McCarthy said at a Wednesday news conference that he had been working for nearly eight months to assemble a bipartisan task force to address economic, technological, milit… [+2369 chars]",2020-09-30T18:22:55Z,0.0,0.0,0.0,1.0
refugees,Politico,Nancy Cook and Matthew Choi,"Trump basks in cheers of Minnesota rally, far from debate criticism",https://www.politico.com/news/2020/09/30/trump-debate-minnesota-rally-424308,"Last night I did what the corrupt media has refused to do, Trump said. I held Joe Biden accountable for his 47 years of lies, 47 years of betrayal and 47 years of failure. I held Joe accountable for … [+4625 chars]",2020-10-01T02:24:24Z,0.0516,0.193,0.207,0.6
refugees,Politico,Maya King and Laura Barrón-López,"Trump blames low-income people, minorities for 'ruining' suburbia",https://www.politico.com/news/2020/10/01/how-white-grievance-politics-informs-trumps-campaign-playbook-424590,"Speaking to a mostly white crowd in Duluth, Minnesota on Wednesday, Trump gave a shout-out to the suburbs, particularly women in the suburbs. He boasted he was the person to end an Obama-era fair hou… [+6609 chars]",2020-10-02T00:51:46Z,-0.4019,0.278,0.0,0.722
refugees,Politico,Nahal Toosi,The Trump foreign policies Biden might keep,https://www.politico.com/news/2020/09/21/trump-biden-foreign-policy-419130,"For the United States to be a trusted and credible international partner, we have to have greater consistency in our approach. We dont, and we havent for quite some time, said Heather Conley, an anal… [+13460 chars]",2020-09-21T08:30:38Z,0.0,0.0,0.0,1.0
refugees,Politico,By Anna Palmer and Jake Sherman,POLITICO Playbook: President Trump and Melania have Covid-19. What now?,https://www.politico.com/newsletters/playbook/2020/10/02/president-trump-and-melania-have-covid-19-what-now-490505,"Presented by Facebook
President Donald Trump and first lady Melania Trump will remain at home after being diagnosed with Covid-19. | Drew Angerer/Getty Images
DRIVING THE DAY
PRESIDENT DONALD TRUM… [+19287 chars]",2020-10-02T10:16:43Z,0.0,0.0,0.0,1.0
refugees,Politico,By Rebecca Rainey and Eleanor Mueller,Senate to vote on another aid package next week,https://www.politico.com/newsletters/weekly-shift/2020/10/14/senate-to-vote-on-another-aid-package-next-week-790974,"Editors Note: Weekly Shift is a weekly version of POLITICO Pros daily Employment &amp; Immigration policy newsletter, Morning Shift. POLITICO Pro is a policy intelligence platform that combines the n… [+11058 chars]",2020-10-14T14:00:59Z,0.0,0.0,0.0,1.0
refugees,Politico,"By Carla Marinucci, Jeremy B. White, Graph Massara and Mackenzie Hawkins",Presidential debate: CHAOS in CLEVELAND — ICE to launch targeted arrest campaign in CA — Covid-19 effects: DISNEY to lay off 28K — SCHWARZENEGGER funds voter ‘super centers’ — NEWSOM’s deadline: Sign or veto,https://www.politico.com/newsletters/california-playbook/2020/09/30/presidential-debate-chaos-in-cleveland-ice-to-launch-targeted-arrest-campaign-in-ca-covid-19-effects-disney-to-lay-off-28k-schwarzenegger-funds-voter-super-centers-newsoms-deadline-sign-or-veto-wine-country-fire-tragedies-anita-hills-hollywood-probe-490475,"Presented by DoorDash
THE BUZZ: It was chaos in Cleveland. A disaster. A dumpster fire. A train wreck.
Thats how the highly anticipated first presidential debate of 2020 will be remembered a disorg… [+19733 chars]",2020-09-30T13:14:58Z,-0.7804,0.196,0.0,0.804
refugees,USA Today,"USA TODAY, Kim Hjelmgaard, USA TODAY",Trump administration tightens H-1B visa restrictions for foreign workers,https://www.usatoday.com/story/news/2020/10/07/trump-tightens-h-1-b-visa-restrictions-foreign-workers/5906966002/,President Donald Trump signs an executive order to try to bring jobs back to American workers and revamp the H-1B visa guest worker program during a visit to the headquarters of tool manufacturer Sna… [+2329 chars],2020-10-07T11:59:43Z,0.0,0.0,0.0,1.0
refugees,USA Today,"USA TODAY, Deirdre Shesgreen, USA TODAY",Trump administration slashes refugee program amid president's campaign attacks on immigrants,https://www.usatoday.com/story/news/world/2020/10/01/trump-moves-slash-refugee-resettlement-amid-campaign-attacks/3574637001/,"Starting a new life in the United States is never easy for refugees. But doing it during a pandemic has created even more struggles, especially after the federal government cut off resettlement fundi… [+5522 chars]",2020-10-01T15:14:23Z,-0.5719,0.343,0.0,0.657
refugees,USA Today,"AP Domestic, AP",Today in History for September 16th,https://www.usatoday.com/videos/news/nation/2020/09/16/today-history-september-16th/5813171002/,,2020-09-16T03:21:22Z,0.0,0.0,0.0,1.0
refugees,USA Today,"AP Domestic, AP",Trump seeks rural votes in battleground Minnesota,https://www.usatoday.com/videos/news/nation/2020/09/19/trump-seeks-rural-votes-battleground-minnesota/5832604002/,,2020-09-19T01:21:17Z,-0.4019,0.31,0.0,0.69
refugees,USA Today,"USA TODAY, Jasmine Sanders, Opinion contributor","As my beautiful bayou home is ravaged by hurricanes, people of color become climate refugees",https://www.usatoday.com/story/opinion/voices/2020/09/18/climate-change-hurricane-laura-sally-louisiana-migrants-column/3478995001/,"Hurricanes Laura and Sally have ravaged an already-vulnerable Gulf Coast. And it is people of color who most often suffer as climate change migrants.
There is nothing quite like the smell of the bay… [+5271 chars]",2020-09-18T09:00:16Z,0.5994,0.0,0.218,0.782
refugees,USA Today,"USA TODAY, Nicquel Terry Ellis, USA TODAY",'Stand back and stand by': Rhetoric some call racist has marked Trump's entire presidency,https://www.usatoday.com/story/news/politics/elections/2020/10/13/hate-speech-common-theme-trumps-presidency/5873238002/,"President Donald Trump and Joe Biden clashed over COVID-19, crime and election integrity during the first presidential debate.
USA TODAY
President Donald Trump has undermined Black Lives Matter pro… [+9240 chars]",2020-10-13T12:00:13Z,-0.6124,0.235,0.0,0.765
refugees,USA Today,"Pensacola News Journal, Colin Warren-Hicks, Pensacola News Journal",Florida deputy uses resident's boat to save about 120 people trapped in Sally floodwaters,https://www.usatoday.com/story/news/nation/2020/09/18/florida-sally-flooding-deputy-saves-100-people-using-residents-boat/5829386002/,"In drone footage courtesy of Sam Perry, the extent of damage done to locations done in and around Pensacola can be seen from the air.
Wochit
PENSACOLA, Fla.  At the height of the flooding from Sall… [+7015 chars]",2020-09-18T21:01:24Z,-0.0516,0.183,0.172,0.645
refugees,USA Today,"USA TODAY, Todd Gitlin, Opinion contributor","First, stanch the Trump bleeding. Whatever progressives think of Biden, we can't sit out 2020.",https://www.usatoday.com/story/opinion/2020/09/21/vote-joe-biden-oust-trump-fight-for-progressive-reforms-column/5822465002/,"Take it from me, a lifelong leftist protester: Voting is not futile even if revolution is not on the ballot. A win is a chance to fight for reforms.
The United States of America is on life support. … [+5830 chars]",2020-09-21T12:36:12Z,0.0,0.0,0.0,1.0
refugees,USA Today,"USA TODAY, Suzette Hackney, USA TODAY",Honor Justice Ruth Bader Ginsburg by registering to vote and casting a ballot,https://www.usatoday.com/story/opinion/2020/09/22/honor-justice-ruth-bader-ginsburg-registering-vote-column/5851986002/,"President Donald Trump stumped for votes in rural Minnesota, predicting his Democratic opponent, Joe Biden, would terminate Trump's travel ban and settle more refugees in the North Star State. (Sept.… [+4524 chars]",2020-09-22T07:15:05Z,0.765,0.0,0.398,0.602
refugees,USA Today,"USA TODAY, Bart Jansen and Michael Collins, USA TODAY",Democrat Joe Biden arrives in Duluth to battle President Donald Trump for Minnesota's middle-class voters,https://www.usatoday.com/story/news/politics/elections/2020/09/18/joe-biden-donald-trump-minnesota-jobs-manufacturing/3491972001/,"Democratic Presidential candidate Joe Biden says the latest jobs report should not be a 'victory to be celebrated' by President Donald Trump while the coronavirus pandemic is on the rise. (July 2)
A… [+5289 chars]",2020-09-18T19:05:09Z,-0.3818,0.157,0.0,0.843
refugees,USA Today,"USA TODAY, Jill Lawrence, USA TODAY",Will Democrats grow backbones amid Trump-Republican rush to replace Ruth Bader Ginsburg?,https://www.usatoday.com/story/opinion/2020/09/19/ruth-bader-ginsburg-death-mcconnell-replacement-rush-column/5837974002/,"Most Americans didn't vote for Trump or the GOP Senate. The time has come to consider new states, more justices and 18-year Supreme Court term limits.
The lid is going to blow off the boiling pot at… [+7038 chars]",2020-09-19T17:36:05Z,0.0,0.0,0.0,1.0
refugees,USA Today,"USA TODAY, Rebecca Morin, USA TODAY",COVID-19 and health care have dominated the debates. But what about other key issues?,https://www.usatoday.com/story/news/politics/elections/2020/10/08/2020-debates-gun-immigration-marijuana-not-being-discussed/5922437002/,"WASHINGTON The coronavirus pandemic is at the top of mind for many voters, and it has been one of the main topics at both the first presidential debate and the only vice presidential debate this year… [+8083 chars]",2020-10-08T23:07:24Z,0.4939,0.0,0.198,0.802
refugees,USA Today,Kim Hjelmgaard,These countries quietly slid into authoritarianism. Should the US be concerned under Trump?,https://www.usatoday.com/story/news/world/2020/10/07/what-authoritarian-countries-can-tell-us-democracy-and-trump/3518563001/,"Dr. Golfo Alexopoulos of the University of South Florida explains the signs that could indicate a democracy is moving towards an authoritarian regime.
USA TODAY
Analysis: Experts both sound and qui… [+20846 chars]",2020-10-07T07:00:15Z,0.0,0.0,0.0,1.0
refugees,NBC News,Reuters,German police officers suspended for sharing pictures of Hitler,https://www.nbcnews.com/news/world/german-police-officers-suspended-sharing-pictures-adolf-hitler-n1240247,"DUESSELDORF, Germany - Twenty-nine police officers have been suspended in Germany for sharing pictures of Adolf Hitler and doctored depictions of refugees in gas chambers on their mobile phones, offi… [+1657 chars]",2020-09-16T18:46:38Z,-0.0772,0.24,0.217,0.543
refugees,NBC News,Claire Wang,Affirmative action debate ignores Asian American community college students,https://www.nbcnews.com/news/asian-america/affirmative-action-debate-ignores-asian-american-community-college-students-n1242201,"The November election has yet again thrust the Asian American community into the middle of a contentious affirmative action fight. This time, it's in California, with Proposition 16, a statewide ball… [+6863 chars]",2020-10-08T13:34:21Z,-0.2732,0.208,0.0,0.792
refugees,NBC News,Jo Ling Kent and David Ingram,Facebook removes Trump ads with baseless claims,https://www.nbcnews.com/tech/tech-news/facebook-removes-trump-ads-refugees-covid-19-n1241602,"Facebook said Wednesday that it had taken down ads from the Trump campaign that claimed without evidence that accepting refugees from abroad would increase risks related to the coronavirus pandemic.… [+1041 chars]",2020-09-30T19:31:06Z,0.0,0.0,0.0,1.0
refugees,NBC News,Abigail Williams and Saphora Smith,Trump plans to slash refugee admissions to U.S. to a record low,https://www.nbcnews.com/news/us-news/trump-plans-slash-refugee-admissions-u-s-record-low-n1241672,"The Trump administration has proposed to further slash the number of refugees admitted to the United States in the coming fiscal year to a record low.
The administration intends to admit up to 15,00… [+3706 chars]",2020-10-01T13:10:53Z,-0.4939,0.318,0.0,0.682
refugees,NBC News,Seth Shostak,An unexpected discovery on Venus is a potential game changer for alien hunters,https://www.nbcnews.com/think/opinion/alien-life-venus-phosphine-gas-discovery-potential-game-changer-ncna1240273,"It could be atmospheric chemistry. Or pollution from unseen volcanoes. But there's a chance a not insignificant chance that scientists have made the first clear discovery of life beyond Earth.
Resea… [+5207 chars]",2020-09-17T17:09:05Z,0.0,0.0,0.0,1.0
refugees,NBC News,Diep Tran,How one chocolatier pivoted during pandemic,https://www.nbcnews.com/news/asian-america/how-one-chocolatier-pivoted-during-pandemic-putting-own-spin-mooncakes-n1241713,Chocolatier Wendy Lieu has been making a lot of mooncakes in preparation for the Mid-Autumn Festival on Thursday. But hers arent the typical baked pastry with a sweet or savory filling. Lieu's are ma… [+5500 chars],2020-10-01T21:36:41Z,0.0,0.0,0.0,1.0
refugees,NBC News,Kimmy Yam,"Asian American voters support Biden at 54% and Trump at 30%, but numbers don't tell full story",https://www.nbcnews.com/news/asian-america/asian-american-voters-support-biden-54-trump-30-numbers-don-n1240263,"With less than two months until the presidential election, Asian American and Pacific Islander voters are favoring Democratic candidate Joe Biden, according to a survey published Tuesday that examine… [+6756 chars]",2020-09-16T22:57:49Z,0.2144,0.0,0.104,0.896
