Keyword,Source,Author,Title,URL,Text,Published,compound score,negative score,positive score,neutral score
immigrant,Fox News,Brian Flood,MSNBC’s Maddow uses Obama-era photos of immigrant children to slam Trump,https://www.foxnews.com/media/msnbc-maddow-obama-immigrant-photos-trump,MSNBC’s Rachel Maddow used powerful images on Tuesday of immigrant children sleeping on a floor to make a point that the Trump administration has “deliberately” hurt families -- but a pair of key pho… [+2600 chars],2020-09-16T20:23:09Z,-0.3818,0.206,0.0,0.794
immigrant,Fox News,Danielle Wallace,"DHS investigates forced sterilization, hysterectomy allegations of illegal immigrants",https://www.foxnews.com/politics/ice-hysterectomy-sterilization-dhs-investigations,The Department of Homeland Security’s internal watchdog launched an investigation into a whistleblower complaint alleging that an outside doctor performed “mass hysterectomies” on immigrant women hel… [+5442 chars],2020-09-17T13:39:07Z,-0.765,0.485,0.0,0.515
immigrant,Fox News,Associated Press,"Georgia jail housing ICE, other detainees performed questionable hysterectomies, shredded records, nurse says",https://www.foxnews.com/politics/georgia-jail-ice-detainees-questionable-hysterectomies-shredded-records-nurse-says,"An immigration detention center in Georgia performed questionable hysterectomies, refused to test detainees for COVID-19 and shredded medical records, according to a nurse quoted in a complaint filed… [+2904 chars]",2020-09-15T14:23:56Z,-0.296,0.155,0.0,0.845
immigrant,Fox News,Nicole Rabon,The Catholic Vote: PART I,https://radio.foxnews.com/2020/10/01/the-catholic-vote-part-i/,"The phrase ""So goes the Catholic, so goes the election"" has been tried and true for the last few decades. Since 1976 Catholics have picked the winner of the presidential election all but one time. Bu… [+947 chars]",2020-10-01T16:00:23Z,0.0,0.0,0.0,1.0
immigrant,Fox News,Adam Shaw,ICE planning immigration enforcement operations in sanctuary cities,https://www.foxnews.com/politics/ice-planning-immigration-enforcement-operations-in-sanctuary-cities,"The Trump administration is preparing a series of immigration enforcement operations targeting illegal immigrants in at least three sanctuary jurisdictions, a source familiar with the operations told… [+2721 chars]",2020-09-30T01:19:40Z,0.0,0.0,0.0,1.0
immigrant,Fox News,Paul Best,Mexican teen in US illegally is charged as adult for attempted murder of Arizona trooper,https://www.foxnews.com/us/mexican-arizona-trooper-attempted-murder-phoenix-ice-charge,"A 17-year-old accused of shooting at a Department of Public Safety trooper in Phoenix last week is an ""unlawfully present citizen of Mexico,"" and has been charged with attempted first-degree murder o… [+1276 chars]",2020-09-25T16:04:16Z,-0.7579,0.333,0.0,0.667
immigrant,Fox News,Adam Shaw,ICE arrests 128 illegal immigrants in Calif.; 96 percent had criminal charges or convictions,https://www.foxnews.com/politics/ice-128-illegal-immigrants-calif-offenses,"The Department of Homeland Security on Tuesday announced that it had detained 128 illegal immigrants in a five-day operation in California last week, including those with convictions and charges for … [+3641 chars]",2020-10-07T17:17:25Z,-0.9001,0.545,0.0,0.455
immigrant,Fox News,"Michael Ruiz, Bill Mears",Federal appeals court strikes down Trump administration policy on keeping undocumented immigrants from being counted in the census,https://www.foxnews.com/politics/federal-panel-blocks-trump-illegal-immigrants-2020-census,"A three-judge panel from a federal court in New York has blocked President Trump’s order to exclude counting illegal immigrants for the purpose of redrawing congressional districts.
The panel ruled … [+1851 chars]",2020-09-10T22:33:28Z,-0.3612,0.128,0.0,0.872
immigrant,Fox News,Stephen Sorace,"Google Doodle honors Felicitas Mendez, civil rights pioneer, for Hispanic Heritage Month",https://www.foxnews.com/tech/google-doodle-felicitas-mendez-civil-rights-school-segregation-california,"Felicitas Mendez was honored Tuesday with a Google Doodle celebrating her work as a civil rights pioneer to mark the first day of Hispanic Heritage Month.
Mendez, who was born in Puerto Rico in 1916… [+1551 chars]",2020-09-15T17:05:19Z,0.5106,0.0,0.231,0.769
immigrant,Fox News,Brittany De Lea,Democrats to unveil bill limiting Supreme Court justice terms,https://www.foxnews.com/politics/democrats-bill-supreme-court-terms,Democrats plan to introduce legislation that would limit the length of a term a Supreme Court justice could serve to less than two decades as President Trump prepares to announce a candidate to fill … [+2028 chars],2020-09-25T00:31:37Z,0.7906,0.0,0.5,0.5
immigrant,Fox News,Adam Shaw,"Trump administration moves to limit student visa stays over fraud, national security concerns",https://www.foxnews.com/politics/trump-administration-limit-student-visa-stays,"The Trump administration has announced a rule limiting the open-ended stay for international students from countries, amid concerns about overstays, fraud and potential risks to national security.
T… [+2575 chars]",2020-09-25T20:37:36Z,-0.34,0.221,0.14,0.64
immigrant,Fox News,Brie Stimson,California town destroyed by deadly wildfire; another town relives 2018 nightmare,https://www.foxnews.com/us/california-town-destroyed-by-deadly-wildfire-another-town-relives-2018-nightmare,"A small California community about 100 miles north of Sacramento was destroyed by the deadly Bear Fire on Wednesday, according to reports.
The Bear Fire is part of the North Complex of fires that ha… [+2152 chars]",2020-09-10T10:38:32Z,-0.4939,0.242,0.0,0.758
immigrant,Fox News,Marisa Schultz,GOP rep unveils 'Creeper Act' to crack down on pedophilia amid 'Cuties' outrage,https://www.foxnews.com/politics/gop-rep-unveils-creeper-act-to-crack-down-on-pedophilia-amid-cuties-outrage,"Rep. Vern Buchanan, R-Fla., introduced legislation this week in the House to take on pedophilia amid growing outrage over a Netflix drama critics say exploits young girls.
Buchanan unveiled the ""Cre… [+2015 chars]",2020-09-15T18:50:27Z,-0.5106,0.216,0.0,0.784
immigrant,Fox News,Nick Givas,Abortion and immigration driving Florida Latino voters to the polls,https://www.foxnews.com/politics/abortion-and-immigration-driving-flordia-latino-voters-to-the-polls,"As the 2020 presidential election approaches, Latino and evangelical voters in Florida are finding themselves pulled to the polls by issues related to the regulation of abortion and illegal immigrati… [+2358 chars]",2020-10-08T20:42:43Z,0.0,0.0,0.0,1.0
immigrant,Fox News,Caitlin McFall,"Biden has immigrants, advocates hoping for reversal of Trump's border policies",https://www.foxnews.com/politics/biden-has-immigrants-advocates-hoping-for-reversal-of-trumps-border-policies,"Immigration advocates and even some Central Americans mulling entering the U.S. are reportedly rooting hard for a Joe Biden victory in November, encouraged by the Democratic nominee's pledge to disma… [+2621 chars]",2020-10-10T05:34:33Z,0.4215,0.0,0.219,0.781
immigrant,Fox News,Maxim Lott,Refugees from socialist countries warn Americans: Don't let it happen here,https://www.foxnews.com/politics/refugees-from-socialism-warn-americans-dont-let-it-happen-here,"One of the most memorable moments from the Republican National Convention came when Cuban-born Maximo Alvarez cautioned Americans against creeping socialism. 
“I’ve seen movements like this before,”… [+8213 chars]",2020-09-15T19:07:23Z,-0.1027,0.123,0.0,0.877
immigrant,Fox News,Joseph Wulfsohn,Critics rip Netflix for condemning Jerry Harris' alleged abuse of minors after defending 'Cuties',https://www.foxnews.com/entertainment/critics-rip-netflix-for-condemning-jerry-harris-alleged-abuse-of-minors-after-defending-cuties,"Netflix raised eyebrows on Thursday while addressing the arrest of ""Cheer"" star Jerry Harris, who's been accused of sexually abusing minors, amid the fallout of its controversial film ""Cuties.""
The … [+3603 chars]",2020-09-18T03:23:49Z,-0.7506,0.348,0.0,0.652
immigrant,Fox News,Associated Press,Parkland parents create artificial intelligence video of slain son to spur voters,https://www.foxnews.com/us/parkland-ai-video-son-voters,"FORT LAUDERDALE, Fla. — Wearing his signature hoodie and beanie, an earbud casually hanging from one ear, passionate Parkland teen Joaquin Oliver urges his peers to vote for lawmakers who will end gu… [+2613 chars]",2020-10-02T18:36:12Z,0.6369,0.0,0.342,0.658
immigrant,Fox News,Mercedes Schlapp,Mercedes Schlapp: Why I celebrate Hispanic Heritage Month,https://www.foxnews.com/opinion/why-celebrate-hispanic-heritage-month-mercedes-schlapp,"During Hispanic Heritage Month, we recognize the incredible contributions that Hispanics have made to this great nation.
From cabinet and congressional members to sports figures, we have helped to s… [+2842 chars]",2020-09-20T16:01:36Z,0.5719,0.0,0.381,0.619
immigrant,Fox News,David Aaro,Jimmy Kimmel criticized after ICE joke directed towards John Oliver,https://www.foxnews.com/entertainment/jimmy-kimmel-criticized-joke-towards-john-oliver,"Jimmy Kimmel, the U.S.-born host of Sunday night's the Emmy Awards, received some backlash online after making a joke about reporting John Oliver, another late-night host who is from the U.K., to Imm… [+2700 chars]",2020-09-21T07:10:37Z,-0.0772,0.197,0.173,0.63
immigrant,Fox News,Morgan Phillips,Conservatives call on Obamas to use Netflix influence to nix 'Cuties',https://www.foxnews.com/politics/conservatives-obamas-netflix-cuties,"The politicized conflict over Netflix’s “Cuties” has now drawn the Obamas into the mix, with some calling on them to use their influence over the company to have the show nixed from the platform.
Up… [+3473 chars]",2020-09-15T17:55:16Z,0.0,0.0,0.0,1.0
immigrant,Fox News,Nick Givas,Rep. Ken Buck calls for investigation into 'exploitation of children' in letter to DOJ regarding Netflix film 'Cuties',https://www.foxnews.com/politics/rep-ken-buck-highlights-exploitation-of-children-in-letter-to-doj-regarding-netflixs-new-film-cuties,"Rep. Ken Buck, R-Colo., sent a letter to the Department of Justice on Monday raising concerns about Netflix's new film ""Cuties,"" which follows a group of scantily dressed young girls who do sexualize… [+2981 chars]",2020-09-14T21:09:41Z,0.0,0.0,0.0,1.0
immigrant,Fox News,Adam Shaw,Group led by Black Lives Matter founder is 'fiscally sponsored project' of pro-China org: report,https://www.foxnews.com/politics/group-black-lives-matter-founder-is-fiscally-sponsored-project-china-report,"A group led by one of the founders of Black Lives Matter has ties to a progressive pro-China organization that acts as a fiscal sponsor to the group, according to a new report by a conservative think… [+2634 chars]",2020-09-17T19:16:11Z,0.0258,0.0,0.073,0.927
immigrant,Fox News,Joseph Wulfsohn,'Coronavirus Death Scoreboard' display stirs controversy in Illinois town,https://www.foxnews.com/us/coronavirus-death-scoreboard-display-stirs-controversy-in-illinois-town,"A public display highlighting the coronavirus death toll is causing a stir in a small town in Illinois.
What has been described in a local report as a ""Coronavirus Death Scoreboard"" was erected on F… [+3556 chars]",2020-09-19T00:02:47Z,-0.5994,0.328,0.0,0.672
immigrant,Fox News,Danielle Wallace,"Ex-Texas deputy sheriff gets 18 years in prison for sexually exploiting, cyberstalking two Massachusetts girls",https://www.foxnews.com/us/texas-sheriff-child-sex-exploitation-cyber-stalking-massachusetts,"A former Texaslaw enforcement officer was sentenced to 18 years in prison Tuesday after sexually exploiting and cyberstalking two Massachusetts girls from the time they were 12 years old, including t… [+3801 chars]",2020-09-17T15:42:14Z,-0.7351,0.323,0.0,0.677
immigrant,Fox News,Ann Schmidt,Woman loans designer wedding dress to other brides for free,https://www.foxnews.com/lifestyle/woman-loans-designer-wedding-dress-free,"A woman in Minneapolis wants to help other brides feel special on their wedding day by loaning out her designer dress. 
Last week, Tina Nguyen posted a photo of her wedding dress on Facebook Marketp… [+3306 chars]",2020-10-10T00:54:32Z,0.5106,0.0,0.268,0.732
immigrant,Fox News,Brie Stimson,"Netflix should face DOJ action over 'Cuties,' some members of Congress say",https://www.foxnews.com/politics/netflix-should-face-doj-action-over-cuties-some-members-of-congress-say,"Lawmakers in Washington, most of them Republicans, called Friday for the Justice Department to take legal action against Netflix for streaming the highly controversial film “Cuties"" -- claiming the c… [+3907 chars]",2020-09-12T04:25:21Z,0.0,0.0,0.0,1.0
immigrant,Fox News,Stephanie Nolasco,"Sophia Loren, 86, reveals the reason she came out of retirement",https://www.foxnews.com/entertainment/sophia-loren-86-retirement-movies,"At age 86, Sophia Loren is coming out of retirement.
After not appearing on the big screen for 10 years, the Oscar-winning actress is making her return to acting in a new movie titled “The Life Ahea… [+3919 chars]",2020-10-06T09:00:49Z,-0.3818,0.206,0.0,0.794
immigrant,Fox News,Hunter Davis,"Amid coronavirus pandemic, Texas border agents see human smuggling on the rise",https://www.foxnews.com/us/coronavirus-pandemic-texas-border-patrol-human-smuggling,"LAREDO, Texas -- The Laredo Border Sector is reporting a rise in commercial trade due to the COVID-19 pandemic, but that’s not all. Customs and Border Protection [CBP] agents are also battling an upt… [+4070 chars]",2020-09-18T21:31:33Z,-0.4767,0.22,0.0,0.78
immigrant,Fox News,Hollie McKay,Joint push for Caribbean countries to develop a coordinated sex-offender registry announced,https://www.foxnews.com/world/joint-push-caribbean-countries-develop-coordinated-sex-offender-registry-announced,"A joint mission to create a coordinated sex offender registry across 15 Caribbean nations – tracking them both in that region and eventually across the world – was announced this week, urging all gov… [+5214 chars]",2020-09-18T18:05:45Z,0.0,0.0,0.0,1.0
immigrant,Fox News,Joseph Wulfsohn,"'Coronavirus Death Scoreboard' vandalized, Illinois town decides not to remove anti-Trump display",https://www.foxnews.com/us/coronavirus-death-scoreboard-vandalized-northbrook-illinois,"An anti-Trump display that has been stirring up controversy in an Illinois town was vandalized on Tuesday evening.
The hyperlocal newsite Patch first reported on Wednesday that what has been called … [+5227 chars]",2020-09-23T21:11:08Z,-0.5994,0.262,0.0,0.738
immigrant,Fox News,Joseph Wulfsohn,Washington Post columnist defends 'Cuties' from uproar after knocking 'Joker' as provocative,https://www.foxnews.com/media/washington-post-defends-cuties-joker-provocative,"A columnist from The Washington Post accused critics of the controversial Netflix film ""Cuties"" of ""freaking out"" after she previously sounded the alarm over the 2019 release of the comic book movie … [+3944 chars]",2020-09-12T00:50:42Z,0.0,0.0,0.0,1.0
immigrant,Fox News,Marisa Schultz,Ted Cruz calls for DOJ investigation into 'Cuties' filmmakers and Netflix,https://www.foxnews.com/politics/ted-cruz-calls-for-doj-investigation-into-netflix-promotion-of-cuties,"Texas Sen. Ted Cruz called on the Justice Department to investigate Netflix and the ""Cuties"" filmmakers to determine whether they broke any federal laws against the production and distribution of chi… [+4103 chars]",2020-09-12T16:05:52Z,0.0,0.0,0.0,1.0
immigrant,Fox News,Paul Steinhauser,"Biden, Florida-bound, says his support among Hispanic voters has ‘gotta go higher’",https://www.foxnews.com/politics/biden-florida-bound-says-his-support-among-latinos-has-gotta-go-higher,"On the eve of his first trip to Florida as a general election candidate, Democratic presidential nominee Joe Biden said his mission on Tuesday would be court Spanish-speaking voters.
“I will talk ab… [+6456 chars]",2020-09-15T15:42:36Z,0.4019,0.0,0.197,0.803
immigrant,Fox News,Jeffrey Sutton,Jeffrey Sutton: Justice Scalia and our Constitution -- a legacy that will endure,https://www.foxnews.com/opinion/justice-scalia-constitution-jeffrey-sutton,"In the midst of a one-of-a-kind year, Constitution Day, September 17, offers a reminder of what will endure and what will pass.
On the endure side are the headwaters of American democracy: a republi… [+5926 chars]",2020-09-17T11:00:12Z,0.5267,0.0,0.236,0.764
immigrant,Fox News,"Paul Steinhauser, Allie Raffa","Biden blasts Trump, touts veterans issues during first stop in battleground Florida",https://www.foxnews.com/politics/biden-blasts-trump-veterans-battleground-florida,"Democratic presidential nominee Joe Biden took aim at President Trump minutes after arriving for his first general election visit to Florida, the largest traditional general election battleground sta… [+9324 chars]",2020-09-15T21:25:05Z,-0.6124,0.4,0.0,0.6
immigrant,Fox News,Joseph Wulfsohn,Pro-Trump crowd in Illinois opposes Trump-bashing 'Coronavirus Death Scoreboard',https://www.foxnews.com/us/pro-trump-crowd-in-illinois-opposes-trump-bashing-coronavirus-death-scoreboard,A fiery pro-Trump crowd gathered in a northern Chicago suburb Friday after an anti-Trump display critical of the president's handling of the coronavirus was placed at a busy intersection in the downt… [+8538 chars],2020-09-26T08:02:15Z,-0.5994,0.328,0.0,0.672
immigrant,Fox News,Chris Stirewalt,"Ruth Bader Ginsburg, R.I.P.",https://www.foxnews.com/politics/ruth-bader-ginsburg-r-i-p,"**Want FOX News Halftime Report in your inbox every day? Sign up here.**
On the roster: Ruth Bader Ginsburg, R.I.P. - Dems prepare SupCo term limit bill - Fox Poll: Tight in Ohio, Biden tops in Neva… [+23857 chars]",2020-09-25T19:27:53Z,0.0,0.0,0.0,1.0
immigrant,Fox News,Chris Stirewalt,The Trump show goes into reruns,https://www.foxnews.com/politics/the-trump-show-goes-into-reruns,"**Want FOX News Halftime Report in your inbox every day? Sign up here.**
On the roster: The Trump show goes into reruns -Pennsylvania moving out of reach for Trump - Biden to Texas: Yeehaw - Senate … [+24582 chars]",2020-10-06T19:17:49Z,0.0,0.0,0.0,1.0
immigrant,CBS News,CBS News,Explosive charges from nurse at immigrant detention center,https://www.cbsnews.com/news/whistleblower-nurse-questionable-hysterectomies-shoddy-covid-care-georgia-immigrant-detention-center-dawn-wooten/,"Ocilla, Georgia — An immigration detention center in Georgia performed questionable hysterectomies, refused to test detainees for COVID-19 and shredded medical records, according to a nurse quoted in… [+3803 chars]",2020-09-15T09:24:05Z,-0.5574,0.434,0.0,0.566
immigrant,CBS News,CBS News,"New book ""Lobizona"" uses folklore and magic to highlight the experience of undocumented immigrants",https://www.cbsnews.com/video/new-book-lobizona-uses-folklore-and-magic-to-highlight-the-experience-of-undocumented-immigrants/,"Watch CBSN Live
Copyright © 2020 CBS Interactive Inc. All rights reserved.",2020-09-17T17:57:27Z,0.34,0.0,0.156,0.844
immigrant,CBS News,Camilo Montoya-Galvez,"U.S. reimposes ""public charge"" wealth test for immigrants",https://www.cbsnews.com/news/trump-public-charge-immigration-wealth-test-court-ruling/,"The Trump administration on Tuesday said it is reimposing its ""public charge"" wealth test for green cards that had been blocked during the pandemic, a move likely to alarm advocates, who have warned … [+3381 chars]",2020-09-22T16:13:33Z,0.4939,0.0,0.314,0.686
immigrant,CBS News,CBS News,Trump and Pence's shared values,https://www.cbsnews.com/video/trump-and-pences-shared-values/,,2020-10-01T20:50:37Z,0.6249,0.0,0.63,0.37
immigrant,CBS News,CBS News,Appeals court upholds ban on holding migrant kids in hotels,https://www.cbsnews.com/news/appeals-court-upholds-ban-on-holding-immigrant-children-in-hotels/,Houston — An appeals court refused Sunday to allow the Trump administration to resume detaining immigrant children in hotel rooms before expelling them under rules adopted during the coronavirus pand… [+3592 chars],2020-10-05T09:18:46Z,-0.5574,0.286,0.0,0.714
immigrant,CBS News,Jeff Glor,Remembering New York's worst terror attack before 9/11,https://www.cbsnews.com/news/wall-street-bombing-new-york-terror-attack/,"Wall Street in New York City, a global financial center, was once the site of a deadly terror attack — the worst on U.S. soil until September 11, 2001. 
A century ago, on September 16, 1920 at 12:01… [+1737 chars]",2020-09-12T16:05:34Z,-0.891,0.679,0.0,0.321
immigrant,CBS News,Irina Ivanova,Amnesty Int'l slams Palantir over company's work for ICE,https://www.cbsnews.com/news/palantir-human-rights-record-amnesty-international/,"Amnesty International is criticizing Palantir's human rights record a day before the secretive Silicon Valley technology startup is set to go public.
In a report on Monday, Amnesty singled out Palan… [+2633 chars]",2020-09-29T11:38:21Z,0.0,0.0,0.0,1.0
immigrant,CBS News,Irina Ivanova,Amnesty Int'l slams Palantir over company's work for ICE,https://www.cbsnews.com/news/palantir-direct-listing-human-rights-record-amnesty-international/,"Amnesty International is criticizing Palantir's human rights record a day before the secretive Silicon Valley technology startup is set to go public.
In a report on Monday, Amnesty singled out Palan… [+2633 chars]",2020-09-28T22:29:00Z,0.0,0.0,0.0,1.0
immigrant,CBS News,Camilo Montoya-Galvez,"ICE billboards of immigrants denounced as ""wildly inappropriate""",https://www.cbsnews.com/news/ice-billboards-immigrants-pennsylvania-criticism-former-officials/,"Former U.S. Department of Homeland Security (DHS) officials criticized the Trump administration for erecting billboards of immigrants it seeks to arrest in a key 2020 battleground state, saying the p… [+8044 chars]",2020-10-05T14:00:01Z,0.0,0.0,0.0,1.0
immigrant,CBS News,Camilo Montoya-Galvez,15-year-old girl facing deportation after hospital arrest,https://www.cbsnews.com/news/15-year-old-girl-who-spent-her-life-in-the-u-s-facing-deportation-after-hospital-arrest/,A 15-year-old girl who has lived in the U.S. with her family since she was an infant is now alone in government custody and facing deportation after she was arrested by Customs and Border Protection … [+3522 chars],2020-09-26T03:04:21Z,-0.34,0.286,0.0,0.714
immigrant,CBS News,Camilo Montoya-Galvez,Trump-Biden race to dictate fate of U.S. immigration for generations,https://www.cbsnews.com/news/trump-biden-2020-immigration-policies/,"The 2020 presidential election will pit two drastically different visions on immigration against each other, with the victor retaining or assuming broad executive authorities that have dominated poli… [+17636 chars]",2020-09-28T20:00:05Z,0.0,0.0,0.0,1.0
immigrant,CBS News,CBS News,How the outlawed practice of redlining is still hurting Black Americans,https://www.cbsnews.com/news/wealth-gap-black-americans-redlining/,"The 1968 Fair Housing Act outlawed redlining nationwide. But the disastrous effects of the discriminatory practice are still contributing to today's wealth gap between Black and White Americans.
""I … [+4896 chars]",2020-10-10T16:37:03Z,-0.4019,0.213,0.0,0.787
immigrant,CBS News,CBS News,Migrant caravan sets off from Honduras with eyes on U.S. border,https://www.cbsnews.com/news/migrant-caravan-sets-off-honduras-guatamala-mexico-eyes-on-us-border-immigration/,"San Pedro Sula, Honduras — Hundreds of migrants began walking Wednesday night from this city in northern Honduras toward the Guatemala border, testing a well-trod migration route now in times of the … [+4806 chars]",2020-10-01T07:40:43Z,0.0,0.0,0.0,1.0
immigrant,CBS News,Christopher Brito,"Melania Trump takes aim at critics, migrant children in secret recordings",https://www.cbsnews.com/news/melania-trump-audio-recording-migrant-children-christmas/,"First Lady Melania Trump downplayed her husband, President Trump's family separation policy and complained about Christmas planning in an expletive-filled secret recording aired by CNN. 
The leaked … [+3785 chars]",2020-10-02T18:09:14Z,-0.296,0.18,0.0,0.82
immigrant,CBS News,Caitlin Conant,2020 Daily Trail Markers: Republicans are narrowing voter registration gaps in swing states,https://www.cbsnews.com/news/2020-daily-trail-markers-republicans-are-narrowing-voter-registration-gaps-in-swing-states-2020-10-01/,"There are still more people registered as Democrats than Republicans in the battleground states of Florida, North Carolina and Pennsylvania, but Republicans have been gaining ground. There are multip… [+22456 chars]",2020-10-01T23:23:16Z,0.0,0.0,0.0,1.0
immigrant,CBS News,Caitlin Conant,2020 Daily Trail Markers: Pence and Harris are set to face off in their only debate,https://www.cbsnews.com/news/2020-daily-trail-markers-pence-and-harris-are-set-to-face-off-in-their-only-debate-2020-10-07/,"Vice President Mike Pence and Senator Kamala Harris are meeting on Wednesday evening in Salt Lake City, Utah, for the sole vice presidential debate, which will be moderated by USA Today Washington bu… [+23088 chars]",2020-10-08T00:07:08Z,0.0,0.0,0.0,1.0
immigrant,CBS News,Caitlin Conant,2020 Daily Trail Markers: Debate prep is in full swing for Trump and Biden,https://www.cbsnews.com/news/2020-daily-trail-markers-debate-prep-is-in-full-swing-for-trump-and-biden-2020-09-28/,Debate preparation is in full swing for President Trump and Joe Biden ahead of their first debate matchup on Tuesday evening. Mr. Trump has dispensed with traditional formal rehearsals and scripted p… [+22896 chars],2020-09-29T00:16:59Z,0.0,0.0,0.0,1.0
