Keyword,Source,Author,Title,URL,Text,Published,compound score,negative score,positive score,neutral score
immigrant,CBS News,CBS News,"Ex- CIA head Brennan on ethics of intel, challenges to democracy",https://www.cbsnews.com/news/john-brennan-challenges-to-democracy-ethics/,"In this episode of Intelligence Matters, host Michael Morell interviews John Brennan, career intelligence officer and former Director of the Central Intelligence Agency. Brennan, who led the agency d… [+43750 chars]",2020-10-07T10:01:55Z,0.0772,0.0,0.115,0.885
immigrant,CBS News,CBS News,"Mexico asks U.S. to ""clarify"" alleged hysterectomies on migrant women in ICE custody",https://www.cbsnews.com/news/mexico-asks-us-to-clarify-alleged-hysterectomies-on-migrant-women-in-ice-custody/,"Mexico City — Mexico said Monday it had requested more information from the U.S. on medical procedures given to migrants in detention centers, after allegations that detained Mexican women were steri… [+2968 chars]",2020-09-29T09:12:14Z,0.0,0.0,0.0,1.0
immigrant,Breitbart News,"Neil Munro, 
Neil Munro",Donald Trump Gains Votes from Asian Immigrants,https://www.breitbart.com/politics/2020/09/22/donald-trump-gains-among-asian-immigrants/,"President Donald Trump is on track to raise his share of Asian American voters to perhaps 35 percent in 2020, up from perhaps 27 percent in 2016.
Asian Americans are just five percent of the nation’… [+6747 chars]",2020-09-22T17:04:02Z,0.34,0.0,0.286,0.714
immigrant,Breitbart News,John Binder,Trump Weighs More Crackdowns on Welfare-Dependent Immigration,https://www.breitbart.com/politics/2020/10/06/trump-weighs-more-crackdowns-on-welfare-dependent-immigration/,"President Trump’s administration is weighing more crackdowns to ensure American taxpayers are not footing the bill for the cost of legal immigrant welfare dependents to the United States.
Last year,… [+3322 chars]",2020-10-06T22:43:12Z,0.0,0.0,0.0,1.0
immigrant,Breitbart News,Joshua Caplan,"Ilhan Omar: Hate for Me Is ‘Anti-Muslim, Anti-Immigrant, Anti-Black, Sexist’",https://www.breitbart.com/politics/2020/09/21/ilhan-omar-hate-for-me-is-anti-muslim-anti-immigrant-anti-black-sexist/,"Rep. Ilhan Omar (D-MN) touted her intersectional oppression in a recent interview with the New York Times, lamenting that she constantly has to “deal with the hate of anti-Muslim, anti-immigrant, ant… [+2165 chars]",2020-09-21T20:07:26Z,-0.5719,0.291,0.0,0.709
immigrant,Breitbart News,John Binder,NBC: VP Debate ‘Living Encapsulation’ of U.S. ‘Demographic Transformation’,https://www.breitbart.com/politics/2020/10/07/nbc-vp-debate-living-encapsulation-of-u-s-demographic-transformation/,Wednesday night’s vice presidential debate between Vice President Mike Pence (R) and Sen. Kamala Harris (D-CA) is a “living encapsulation” of the United States’ “demographic transformation” spurred b… [+3797 chars],2020-10-08T00:01:19Z,0.0,0.0,0.0,1.0
immigrant,Breitbart News,Neil Munro,"Amnesty Groups Demand Bailout for Cities, States that Rely on Illegal Migrants",https://www.breitbart.com/politics/2020/09/16/amnesty-groups-demand-bailout-for-cities-states-that-rely-on-illegal-migrants/,"The unemployment rate for illegal migrants in the United States reached almost 30 percent during the coronavirus crash, says a California advocacy report that urges a federal bailout for the cities a… [+5639 chars]",2020-09-17T00:40:20Z,-0.6705,0.419,0.0,0.581
immigrant,Breitbart News,Kyle Olson,"Fact Check: Joe Biden, Eva Longoria Attack Donald Trump over Obama Administration Putting Kids in Cages",https://www.breitbart.com/politics/2020/09/16/fact-check-joe-biden-eva-longoria-attack-donald-trump-over-obama-administration-putting-kids-in-cages/,"CLAIM: Former Vice President Joe Biden and actress Eva Longoria told a Florida audience on Tuesday that President Trump locked immigrant kids in cages at the southern border.
VERDICT: Misleading. Th… [+3199 chars]",2020-09-16T20:59:57Z,-0.4767,0.171,0.0,0.829
immigrant,Breitbart News,Neil Munro,Cato: Immigration Slowed During 2019 Economic Boom,https://www.breitbart.com/economy/2020/09/20/cato-immigration-slowed-2019-economic-boom/,"President Donald Trump’s personality and policies likely get the credit for reducing immigration by roughly one million people from mid-2017 to 2020, says a report by the pro-migration Cato Institute… [+2927 chars]",2020-09-21T04:11:36Z,0.0,0.0,0.0,1.0
immigrant,Breitbart News,Neil Munro,Politico: ‘Union Members Snub Biden for Trump’,https://www.breitbart.com/economy/2020/09/22/politico-union-members-snub-biden-for-trump/,"Union leaders are trying to drag their members into Joe Biden’s column amid strong union support for President Donald Trump’s pro-worker policies, according to Politico.
Under the headline, “Rank-an… [+3285 chars]",2020-09-22T19:18:07Z,-0.4215,0.318,0.0,0.682
immigrant,Breitbart News,Neil Munro,Immigration Reformers OK Judge Amy Coney Barrett,https://www.breitbart.com/economy/2020/09/27/immigration-reformers-ok-judge-amy-coney-barrett/,"Judge Amy Coney Barrett is getting applause from immigration reformers, including the Federation for American Immigration Reform.
“When it comes to immigration, Amy Coney Barrett applies the law as … [+3436 chars]",2020-09-28T04:10:05Z,0.4466,0.0,0.328,0.672
immigrant,Breitbart News,Penny Starr,Judge Blocks Trump Administration Effort to Fund Immigration Services,https://www.breitbart.com/politics/2020/09/30/judge-blocks-trump-administration-effort-to-fund-immigration-services/,A federal judge in San Francisco on Tuesday temporarily blocked a United States Citizenship and Immigration Services (USCIS) rule that sought to better fund services for people seeking citizenship an… [+2938 chars],2020-09-30T16:53:03Z,-0.2263,0.192,0.0,0.808
immigrant,Breitbart News,John Binder,Study: Joe Biden Migration Plan Could Bring 52 Million Foreign Nationals to U.S.,https://www.breitbart.com/politics/2020/09/21/study-biden-migration-could-bring-52-million-immigrants-us/,"Democrat presidential candidate Joe Biden’s plan to overhaul the nation’s immigration system could help bring an estimated 52 million foreign nationals to the United States, a study details.
Researc… [+1695 chars]",2020-09-21T20:01:07Z,0.0,0.0,0.0,1.0
immigrant,Breitbart News,Neil Munro,Axios: New York City Shrinks Due to Lower Immigration,https://www.breitbart.com/politics/2020/09/18/axios-new-york-city-shrinks-due-to-lower-immigration/,"President Donald Trump’s pro-American curbs on migration are pressuring New York’s parochial elite to accept out-of-state young Americans into the city’s economy.
“The main driver of both new busine… [+8321 chars]",2020-09-18T23:05:13Z,-0.296,0.216,0.0,0.784
immigrant,Breitbart News,Charles Hurt,Charles Hurt: Donald Trump Should Nominate Miguel Estrada to Supreme Court,https://www.breitbart.com/politics/2020/09/24/charles-hurt-donald-trump-should-nominate-miguel-estrada-to-supreme-court/,"President Trump has signaled his clear intention to nominate a woman to the Supreme Court to replace Justice Ruth Bader Ginsburg.In a single stroke, Mr. Trump could correct one of the most egregious … [+4821 chars]",2020-09-24T18:40:38Z,0.0516,0.212,0.225,0.562
immigrant,Breitbart News,John Binder,Trump Further Reduces Obama’s Refugee Inflow to U.S. by 80 Percent,https://www.breitbart.com/politics/2020/10/01/trump-further-reduces-obamas-refugee-inflow-to-u-s-by-80-percent/,"President Trump is further reducing the inflow of refugees to the United States, cutting their resettlement by 80 percent compared to former President Obama’s last year in office.
This week, Trump a… [+2163 chars]",2020-10-01T20:05:09Z,0.0,0.0,0.0,1.0
immigrant,Breitbart News,Bob Price,48 Migrants Found in Crowded New Mexico Stash House near Border,https://www.breitbart.com/border/2020/09/17/48-migrants-found-in-crowded-new-mexico-stash-house-near-border/,El Paso Sector Border Patrol agents teamed up with ICE agents and officers to disrupt a human smuggling operation in New Mexico. The effort resulted in the arrest of two human smugglers and 57 migran… [+2016 chars],2020-09-17T14:37:27Z,0.0,0.0,0.0,1.0
immigrant,Breitbart News,John Binder,Amy Schumer Posts Staged Photo of Mannequins in Cages in Get Out the Vote Screed Against America’s ‘Caste System’,https://www.breitbart.com/entertainment/2020/10/09/amy-schumer-posts-staged-photo-of-mannequins-in-cages-in-get-out-the-vote-screed-against-americas-caste-system/,Actress and leftist activist Amy Schumer posted a staged photo of mannequin dolls in cages in a social media rant urging people to vote against America’s “caste system.” Schumer’s screed to her 10 mi… [+2042 chars],2020-10-09T16:35:04Z,0.0,0.0,0.0,1.0
immigrant,Breitbart News,Rep. Matt Gaetz (R-FL),Exclusive Excerpt—Rep. Matt Gaetz: ‘Firebrand: Dispatches from the Front Lines of the MAGA Revolution’,https://www.breitbart.com/politics/2020/09/21/exclusive-excerpt-rep-matt-gaetz-firebrand-dispatches-from-the-front-lines-of-the-maga-revolution/,"The following is an exclusive excerpt from a new book by Rep. Matt Gaetz (R-FL), Firebrand: Dispatches from the Front Lines of the MAGA Revolution, available Tuesday, September 22.
***
America is n… [+7330 chars]",2020-09-21T16:12:59Z,0.128,0.0,0.103,0.897
immigrant,Breitbart News,Bob Price,"Lost Migrant Starts Fire in California, 13 More Rescued from Heatwave",https://www.breitbart.com/border/2020/09/10/lost-migrant-starts-fire-in-california-13-more-rescued-from-heatwave/,San Diego Sector Border Patrol agents rescued 14 migrants over the Labor Day weekend. The rescues led to eight of the 14 being transported to hospitals due to heat-related illnesses. One admitted to … [+2662 chars],2020-09-10T15:51:12Z,-0.1548,0.298,0.196,0.507
immigrant,Breitbart News,Neil Munro,DHS Denies Democrat Claims It Downplays the Threat of White Terrorists,https://www.breitbart.com/immigration/2020/09/09/democrats-claim-dhs-downplays-white-terrorism/,"Department of Homeland Security (DHS) acting Secretary Chad Wolf is rejecting claims that his agency is downplaying the threat of terrorism by white Americans.
“Just this week, we are releasing an i… [+3368 chars]",2020-09-09T22:51:27Z,-0.8834,0.563,0.0,0.437
immigrant,Breitbart News,Allum Bokhari,Project Veritas Exposes Ilhan Omar Allies in Alleged Ballot Harvesting Operation in Minnesota,https://www.breitbart.com/politics/2020/09/27/breaking-project-veritas-ballot-harvesting-minnesota/,"Project Veritas has released the results of an investigation into alleged ballot harvesting by supporters of Democrat Rep. Ilhan Omar in Minnesota, a key swing state in the 2020 presidential election… [+3381 chars]",2020-09-28T02:20:56Z,-0.128,0.111,0.0,0.889
immigrant,Breitbart News,John Binder,ABC News: Arizona’s Changing Demographics Helping Democrats,https://www.breitbart.com/politics/2020/09/22/abc-news-arizonas-changing-demographics-helping-democrats/,"The swing state of Arizona is continuing to see rapid demographic changes that are helping to secure election victories for Democrats, ABC News reports.
The report acknowledges that Democrats in Ari… [+3250 chars]",2020-09-22T21:03:24Z,0.296,0.0,0.268,0.732
immigrant,Breitbart News,Kurt Zindulka,Report: Illegal Boat Migrants Sign Slave Labour ‘Pact’ with Traffickers to Reach UK,https://www.breitbart.com/europe/2020/09/21/report-illegal-boat-migrants-sign-slave-labour-pact-traffickers-reach-uk/,"Illegal boat migrants are reportedly making ‘pacts’ with human trafficking networks to serve as slave labourers in order to pay off the fees charged for crossing the English Channel from France.
Off… [+3817 chars]",2020-09-21T12:33:42Z,-0.5423,0.229,0.07,0.701
immigrant,Breitbart News,John Binder,Law Professors: Let Immigrants Become President by Amending Constitution,https://www.breitbart.com/politics/2020/09/20/law-professors-let-immigrants-become-president-amending-constitution/,"A pair of law professors are now arguing for an amendment to the United States Constitution that would repeal the requirement for presidents to be natural born citizens of the U.S.
Natural born citi… [+3061 chars]",2020-09-20T17:54:47Z,0.0,0.0,0.0,1.0
immigrant,Breitbart News,Penny Starr,Kamala Harris Courts Mormon Voters Ahead of VP Debate in Salt Lake City,https://www.breitbart.com/2020-election/2020/10/05/kamala-harris-courts-mormon-voters-ahead-of-vp-debate-in-salt-lake-city/,"Sen. Kamala Harris (D-CA), the Democrat nominee for Vice President, wrote in an op-ed published by the Deseret News on Sunday, that her running mate, former Vice President Joe Biden, would “restore” … [+3504 chars]",2020-10-06T03:10:47Z,0.0,0.0,0.0,1.0
immigrant,Breitbart News,John Binder,"Sanctuary Los Angeles Frees Illegal Aliens Charged with Murder, Sex Crimes",https://www.breitbart.com/immigration/2020/09/27/sanctuary-los-angeles-frees-illegal-aliens-charged-murder-sex-crimes/,"The sanctuary jurisdiction of Los Angeles County, California, continues to release illegal alien career criminals back into communities, including those charged with murder and child sex crimes.
The… [+2977 chars]",2020-09-27T21:10:51Z,-0.836,0.523,0.114,0.363
immigrant,Breitbart News,Alana Mastrangelo,Report: U. of New Hampshire Prof Posed as ‘Woman of Color’ on Twitter,https://www.breitbart.com/tech/2020/10/06/report-u-of-new-hampshire-prof-posed-as-woman-of-color-on-twitter/,"A University of New Hampshire (UNH) professor allegedly posed as a “woman of color” on Twitter, according to a report in the school’s student newspaper. After the student investigation, the account w… [+3008 chars]",2020-10-06T15:55:44Z,0.0,0.0,0.0,1.0
immigrant,Breitbart News,John Binder,Pew Research: Mass Immigration Drives Up Democrat Support in Swing States,https://www.breitbart.com/politics/2020/10/04/pew-mass-immigration-drives-democrat-support-swing-states/,"Mass immigration to the United States is likely driving up support in key swing states as foreign-born voters and the U.S.-born children of immigrants increasingly account for the electorate, a Pew R… [+3259 chars]",2020-10-05T02:58:23Z,0.4019,0.0,0.213,0.787
immigrant,Breitbart News,Neil Munro,Joe Biden Promises to Let Mayors Import Foreign Workers,https://www.breitbart.com/economy/2020/09/10/joe-biden-promises-to-let-mayors-import-foreign-workers/,"If Joe Biden is elected president, mayors and county executives will get a pipeline of foreign workers for local CEOs who say they cannot recruit Americans for the jobs, says Joe Biden’s 2020 campaig… [+10382 chars]",2020-09-10T21:43:43Z,0.3818,0.0,0.245,0.755
immigrant,Breitbart News,Neil Munro,Glenn Beck: We Need One Billion People in the U.S.,https://www.breitbart.com/politics/2020/09/24/glenn-beck-we-need-one-billion-people-u-s/,"The United States needs one billion people to keep pace with China’s expanding strategic power, according to Glenn Beck, owner of TheBlaze TV network.
“Having ONE BILLION AMERICANS is a goal worth s… [+5672 chars]",2020-09-24T14:34:36Z,0.0,0.0,0.0,1.0
immigrant,Breitbart News,Victoria Friedman,Farage Watched French Navy Abandon Struggling Migrant Vessel in English Channel,https://www.breitbart.com/europe/2020/09/17/farage-watched-french-abandon-struggling-migrant-vessel-channel/,"Nigel Farage, a Telegraph journalist, and a fishing boat captain were witnesses to the French Navy escorting into British waters a vessel full of migrants bailing water and return to France without t… [+5142 chars]",2020-09-17T15:50:56Z,-0.6908,0.388,0.0,0.612
immigrant,Breitbart News,Hannah Bleau,AOC Sounds the Alarm in Wake of Ruth Bader Ginsburg’s Death: ‘November’s About Survival’,https://www.breitbart.com/politics/2020/09/19/aoc-sounds-alarm-wake-ruth-bader-ginsburgs-death-novembers-survival/,"Rep. Alexandria Ocasio-Cortez (D-NY) offered some words of advice to concerned progressives Friday following the news of Justice Ruth Bader Ginsburg’s death, stressing that a vote for Joe Biden is “n… [+3776 chars]",2020-09-19T18:07:18Z,-0.743,0.344,0.0,0.656
immigrant,Breitbart News,John Binder,"Survey: Hispanic Americans Most Opposed to Illegal Immigration, Defunding Police",https://www.breitbart.com/politics/2020/09/24/survey-hispanic-americans-most-opposed-to-illegal-immigration-defunding-police/,"Hispanic Americans, more than white and black Americans, are the most convinced by campaign rhetoric that denounces illegal immigration to the United States and the “defund the police” movement, a ne… [+4197 chars]",2020-09-24T20:41:30Z,-0.5945,0.3,0.0,0.7
immigrant,Breitbart News,Charles Hurt,Charles Hurt — Leftist Hatred Hits Its Apex: Trump-Haters Wishing POTUS Dead,https://www.breitbart.com/health/2020/10/07/charles-hurt-leftist-hatred-hits-its-apex-trump-haters-wishing-potus-dead/,"One good thing about any serious crisis is how clearly it reveals peoples true selves.
Watching the hate-filled vermin squeal and squirm in their toxic juices over President Trumps COVID-19 diagnosi… [+4073 chars]",2020-10-07T20:03:05Z,-0.9001,0.572,0.091,0.337
immigrant,Breitbart News,Neil Munro,Watch: Chad Wolf’s DHS Confirmation Hearing,https://www.breitbart.com/immigration/2020/09/23/watch-chad-wolf-gets-sept-23-confirmation-hearing/,"Chad Wolf, the acting secretary at the Department of Homeland Security (DHS), will get a Senate confirmation hearing on Wednesday morning.
The September 23 hearing is needed before a confirmation vo… [+4125 chars]",2020-09-23T13:33:29Z,0.0,0.0,0.0,1.0
immigrant,Breitbart News,Neil Munro,Democrats Demand Investigation of ‘Mass Hysterectomies’ of Migrant Women,https://www.breitbart.com/2020-election/2020/09/16/democrats-demand-investigation-mass-hysterectomies-migrant-women/,Democrats are pushing for an investigation into the dramatic charge that a contract doctor secretly removed the uteruses of migrant women who were detained at a privately-run detention center in Geor… [+6739 chars],2020-09-16T18:56:36Z,-0.128,0.158,0.0,0.842
immigrant,Breitbart News,Neil Munro,Business Slams Draft Curbs on White-Collar Illegal Migrants,https://www.breitbart.com/economy/2020/09/24/business-slams-draft-curbs-on-white-collar-illegal-migrants/,"Business groups, labor brokers, and migration advocates are protesting a draft regulation that would open up many thousands of outsourced white-collar jobs to debt-burdened U.S. graduates.
The regul… [+6940 chars]",2020-09-25T01:25:35Z,-0.5574,0.34,0.0,0.66
immigrant,Breitbart News,Joel B. Pollak,Trump’s New Supreme Court List Includes Diverse Array of Conservative All-stars,https://www.breitbart.com/politics/2020/09/09/trumps-new-supreme-court-list-includes-diverse-array-of-conservative-all-stars/,"President Donald Trump released a list of 20 potential Supreme Court nominees on Wednesday as a supplement to his original list, which he produced during the 2016 presidential campaign.
At the time,… [+25768 chars]",2020-09-10T00:15:54Z,0.5574,0.0,0.265,0.735
immigrant,Al Jazeera English,Al Jazeera,US white male professor allegedly poses as Black immigrant woman,https://www.aljazeera.com/news/2020/10/6/white-male-teacher-accused-of-posing-as-immigrant-woman,A white male University of New Hampshire chemistry professor is accused of posing as an immigrant woman of colour on Twitter to make racist and sexist comments and attack users who supported racial j… [+4267 chars],2020-10-06T15:21:02Z,0.0,0.0,0.0,1.0
immigrant,Al Jazeera English,Rebecca Rosman,"‘Stop stigmatising us’, French Muslims tell Macron",https://www.aljazeera.com/news/2020/10/6/french-muslims,"Paris, France  In a divisive speech last Friday, French President Emmanuel Macron outlined proposals on how to challenge what he called Islamist separatism.
Islam is a religion that is in crisis all… [+5413 chars]",2020-10-06T12:16:49Z,0.0,0.0,0.0,1.0
immigrant,Al Jazeera English,Joseph Stepansky,Race to watch: Iranian-American activist faces Texas conservative,https://www.aljazeera.com/news/2020/09/race-watch-iranian-american-activist-faces-texas-conservative-200921160139636.html,A congressional race between staunchly conservative House Republican Dan Crenshaw and Iranian American progressive Sima Ladjevardian has garnered national attention while encapsulating the shifting D… [+5271 chars],2020-09-22T12:55:58Z,0.0,0.0,0.0,1.0
immigrant,Al Jazeera English,Katy Fallon,Greek court to decide fate of fascist Golden Dawn group,https://www.aljazeera.com/news/2020/10/7/greek-court-to-decide-fate-of-fascist-golden-dawn-group,"Athens, Greece  A five-and-a-half-year trial of the far-right Golden Dawn group draws to a close on Wednesday, with a panel of three judges at the court of appeals in Athens preparing to issue its ve… [+3881 chars]",2020-10-07T05:57:47Z,-0.5574,0.286,0.0,0.714
immigrant,Al Jazeera English,Al Jazeera,"US seeks sweeping DNA collection of immigrants, sponsors",https://www.aljazeera.com/news/2020/09/seeks-sweeping-dna-collection-immigrants-sponsors-200911155833092.html,"The Trump administration on Friday formally proposed a sweeping expansion of its collection of DNA and other biometric data of immigrants, to go beyond detained migrants in order to include US citize… [+2049 chars]",2020-09-11T16:57:15Z,0.0,0.0,0.0,1.0
immigrant,Al Jazeera English,Al Jazeera,Italy softens harsh migration rules championed by Salvini,https://www.aljazeera.com/news/2020/10/6/italy-loosens-migration-rules-to-dismay-of-hardliner-salvini,"Italy has softened harsh rules penalising aid groups that bring undocumented migrants ashore and extended protection for refugees who risk persecution at home.
The so-called security decrees, which … [+3094 chars]",2020-10-06T19:31:00Z,-0.1779,0.261,0.198,0.541
immigrant,Al Jazeera English,Al Jazeera,US court rejects Trump plan to leave many immigrants off census,https://www.aljazeera.com/news/2020/09/court-rejects-trump-plan-leave-immigrants-census-200910214635224.html,"A United States court has rejected the Trump administration's attempt to prevent undocumented immigrants from being counted in the US census, the American Civil Liberties Union (ACLU) said Thursday, … [+3486 chars]",2020-09-10T23:46:38Z,-0.5267,0.328,0.0,0.672
immigrant,Al Jazeera English,Gouri Sharma,German far-right figure ‘caught’ saying migrants could be gassed,https://www.aljazeera.com/news/2020/9/29/afd-sacks-official-who-reportedly-said-refugees-could-be-gassed,"Berlin, Germany A long-standing member of the far-right Alternative for Deutschland (AfD) political party has been sacked amid reports of his inflammatory comments in which he allegedly said refugees… [+2700 chars]",2020-09-29T15:40:08Z,0.0,0.0,0.0,1.0
immigrant,Al Jazeera English,Al Jazeera,Guatemala promises to break up migrant caravan heading to US,https://www.aljazeera.com/news/2020/10/2/guatemala-vows-to-break-up-migrant-caravan-heading-to-us,"Guatemala has promised to break up a caravan of about 2,000 migrants that set out from neighbouring Honduras this week in hopes of reaching the United States, saying they represent a health threat am… [+3573 chars]",2020-10-02T19:00:12Z,0.3818,0.0,0.224,0.776
immigrant,Al Jazeera English,Al Jazeera,Italian PM Conte to testify in Salvini refugee abuse case,https://www.aljazeera.com/news/2020/10/3/italian-premier-to-testify-in-salvinis-hearing-on-migrant-abuse,Italian Prime Minister Giuseppe Conte and other senior officials have been called to testify at the next pre-trial hearing on an abuse of power case against far-right opposition leader Matteo Salvini… [+3526 chars],2020-10-03T18:51:42Z,-0.6369,0.318,0.0,0.682
immigrant,Al Jazeera English,Mia Swart,Ruth Bader Ginsburg: A life in pursuit of gender equality,https://www.aljazeera.com/news/2020/9/23/ruth-bader-ginsburg-a-life-in-pursuit-of-gender-equality,"Ruth Bader Ginsburg, who became the second female United States Supreme Court Justice in 1993, devoted much of her career to advancing womens rights. The impact of her judgements and dissents on gend… [+8742 chars]",2020-09-23T15:44:54Z,0.0,0.0,0.0,1.0
immigrant,Al Jazeera English,Al Jazeera,Migrant caravan sets out for the US amid COVID-19 concerns,https://www.aljazeera.com/news/2020/10/1/honduran-caravan-travels-to-the-us-amid-covid-19-concerns,"The first Hondurans hoping to reach the United States arrived at the Guatemala border on foot on Thursday morning as part of a newly-formed caravan, testing the newly reopened frontier that had been … [+5650 chars]",2020-10-01T20:26:53Z,0.0,0.0,0.0,1.0
immigrant,Al Jazeera English,Mia Swart,'There will be blood': Xenophobia in S Africa routine and lethal,https://www.aljazeera.com/news/2020/09/blood-xenophobia-africa-routine-lethal-200915051719107.html,"Sleeping was not an option for Syed in early September last year.
For three days and night, the Bangladeshi shop owner in central Johannesburg said he had to stand guard to protect his store during … [+6963 chars]",2020-09-17T10:44:41Z,0.0,0.0,0.0,1.0
immigrant,Al Jazeera English,Mersiha Gadzo,Canada: Murder raises fresh concerns about far-right violence,https://www.aljazeera.com/news/2020/10/3/what-is-being-done-about-the-far-right-canadas-biggest-threat,"Toronto, Canada Mohamed-Aslim Zafis was sitting outside a mosque in Torontos west end last month when a man approached him and stabbed him in the neck with a knife.
The brazen killing, which police … [+7845 chars]",2020-10-03T14:11:20Z,-0.8176,0.547,0.143,0.311
